0	VFalse	2012-06-08 09:30 AM BLOOD @test$ - 10.1 RBC - 4.35 * Hgb - 14.2 @test$ - 39.9 * MCV - 92 MCH - 32.6 * MCHC - 35.6 * RDW - 12.4 Plt Ct - 151
1	PIP	"IMPRESSION : Moderate symmetric eft ventricular hypertrophy with @problem$ c/w @problem$ ( toxin , metabolic , cannot exclude myocarditis ; in the absence of LVH on ECG , an infiltrative process should also be considered )."
2	TeRP	3. RHYTHM : The patient was monitored on @problem$ throughout her hospitalization with no @test$ .
3	TrCP	History of @problem$ to Tetracycline , @treatment$ , declomycin associated with edema and rash , Talwin associated with disorientation and gastrointestinal symptoms , Dilantin has caused rash and edema , morphine associated with itching and gastrointestinal symptoms , Demerol unclear .
4	TrAP	"Elavil by mouth 15 mg every night , Dulcolax rectally 10 mg once a day , Tegretol by mouth 100 mg twice a day , Benadryl by mouth 25 mg three times a day , Colace by mouth 200 mg twice a day , Vasotec by mouth 10 mg twice a day , EOC / LOC p.r./p.o. one each once a day as needed for constipation , Lasix by mouth 80 mg every morning , insulin regular according to insulin scale , Synthroid by mouth 25 mcg once a day , Maalox Plus Extra Strength by mouth 15 ml every six hours as needed for indigestion , Milk of @treatment$ by mouth 30 ml once a day as needed for @problem$ , Asacol by mouth 400 mg every morning , Asacol 800 mg every night , Lopressor by mouth 25 mg twice a day , Miracle cream topically on skin once a day , nystatin swish and swallow by mouth 5 ml four times a day , Percocet by mouth one tab every four hours as needed for pain , and vancomycin by infusion 1 gm every 18 hours ; instructions in 250 ml slow IV infusion over one hour ."
5	TrWP	This is a 47 - year-old male with a past medical history of type 2 diabetes , high cholesterol , hypertension , and coronary artery disease , status post percutaneous transluminal coronary angioplasty times two , who presented with @problem$ refractory to medical treatment and @treatment$ , now status post Angio-Jet percutaneous transluminal coronary angioplasty and stent of proximal left anterior descending artery and percutaneous transluminal coronary angioplasty of first diagonal with intra-aortic balloon pump placement .
6	TeCP	@test$ of @problem$ showed that the patient has bilateral hydronephrosis , most likely obstructive uropathy due to prostate CA in the pelvic area .
7	TrIP	He subsequently became @problem$ and bradycardiac in the Catheterization Laboratory which responded to IV fluids , dopamine , @treatment$ , and he was then transferred to the CCU for further monitoring .
8	TrNAP	Urology consultation thinks that cystoscopy would not add any benefit to the management and only would consider @problem$ if @treatment$ failed to improve .
