95	CPRFalse	All together, they indicate that aversive property of ethanol is dependent on ethanol action on @CHEMICAL$. Deletion of the a2-subunit led to faster recovery whereas absence of the a3-subunit slowed recovery from @GENE$-induced incoordination (rotarod).
96	CPRFalse	Numerous studies have suggested that increased @CHEMICAL$ levels are associated closely with resistance to @GENE$-based chemotherapy.
97	CPRFalse	In contrast to @CHEMICAL$ and somatostatin, galanin, another inhibitor of insulin secretion, reduced Ca2+ currents by about 40% in a @GENE$-insensitive manner.
98	CPR:4	"@CHEMICAL$ produced a rapid, concentration-dependent block of currents evoked by 50 microM NMDA and 10 microM glycine in human embryonic kidney 293 cells expressing the rat NR1a subunit, and either the NR2A, @GENE$ or NR2C subunits; the IC50 values for block were 2.6, 0.52 and 2.4 mM, respectively (holding potential, - 60 mV)."
99	CPRFalse	RATIONALE: A common polymorphism (5HTTLPR) within the promoter region of the @CHEMICAL$ gene (LSC6A4) has been shown to influence response time as well as overall response to selective @GENE$ reuptake inhibitors (SSRIs) in subjects with major depressive disorder.
100	CPR:4	New classes of @CHEMICAL$-derived nitrooxyalkyl inverse esters, carbonates, and ethers (7-10) as @GENE$ selective inhibitors and NO donors were synthesized and are herein reported.
101	CPRFalse	The folding rate for wild-type @CHEMICAL$ is faster in the presence of the inhibitor 2'CMP than in its absence, indicating that the transition-state structure in the rate-determining step is stabilized by @GENE$.
102	CPRFalse	In this work, the interactions between loperamide and two @CHEMICAL$ secretagogues, lysine vasopressin (@GENE$) and corticotropin-releasing hormone (CRH), were investigated in patients with Addison's disease.
103	CPRFalse	Recently, it has been shown that the activation of particular T2R bitter taste receptors is partially involved with the bitter aftertaste sensation of saccharin and @CHEMICAL$. To more fully understand the biology behind these phenomena we have addressed the question of whether AS could stimulate @GENE$, as these receptors are activated by a large range of structurally different chemicals.
104	CPRFalse	However, one @CHEMICAL$ PAM, CPPHA (@GENE$), interacts with a separate allosteric site on mGlu5.
105	CPRFalse	Despite a low @CHEMICAL$ identity between @GENE$ and TREK-1 (approximately 28%), both channel proteins share the same overall structural arrangement consisting of two pore-forming domains and four transmembrane segments (TMS).
106	CPRFalse	METHODS: In 304 Caucasian American NTD families with myelomeningocele or anencephaly, we examined 28 polymorphisms in 11 genes: @CHEMICAL$ receptor 1, folate receptor 2, solute carrier family 19 member 1, transcobalamin II, methylenetetrahydrofolate dehydrogenase 1, serine hydroxymethyl-transferase 1, 5,10-methylenetetrahydrofolate reductase (MTHFR), 5-methyltetrahydrofolate-homo-cysteine methyltransferase, 5-methyltetrahydrofolate-homocysteine methyltransferase reductase, @GENE$ (BHMT), and cystathionine-beta-synthase.
107	CPR:4	@CHEMICAL$, a @GENE$ inhibitor, arrests cell division and causes apoptosis in non-small lung cancer cells [283660].
108	CPRFalse	Here, we have now found that activation of p38 MAPK by anisomycin potentiated induction of @CHEMICAL$ mRNA by CAR ligand in HepG2 cells to levels observed in ligand-treated human primary hepatocytes. siRNA knockdown of p38 MAPK abrogated the ability of @GENE$ to synergistically induce CYP2B6 mRNA.
109	CPR:4	These results suggest that @CHEMICAL$ inhibited the activity of VMAT2 by a mechanism different from that of reserpine and did not directly interact with the active site of @GENE$.
110	CPRFalse	Selective competitive antagonists of @CHEMICAL$-coupled endothelin-1 type A and B receptors were ~60% effective in blocking @GENE$ inhibition and combination of antagonists to both receptors were 85% effective.
111	CPRFalse	CONCLUSIONS: In patients with established ischemic LV dysfunction, plasma @CHEM-GENE$ and adrenomedullin are independent predictors of mortality and heart failure.
112	CPR:6	@CHEMICAL$ (nonselective @GENE$ antagonist), silodosin (selective alpha(1A)-adrenoceptor antagonist) and BMY-7378 (8-[2-[4-(2-methoxyphenyl)-1-piperazinyl]ethyl]-8-azaspiro[4.5]decane-7,9-dione dihydrochloride) (selective alpha(1D)-adrenoceptor antagonist) competitively antagonized the phenylephrine-induced contraction (pA(2) values, 8.60+/-0.07, 9.44+/-0.06 and 5.75+/-0.07, respectively).
113	CPRFalse	We hypothesize that L0 interacts with the K(IR) N terminus in ligand-inhibited K(@CHEMICAL$) channels and put forward a model, based on the architecture of BtuCD, MsbA, and the KcsA channel, in which TMD0-L0 links the @GENE$-like core of SUR with the K(IR) pore.
114	CPRFalse	However, @CHEMICAL$ blockers differ from ACE inhibitors with respect to side effects, and induce less cough, a side effect which may be related to @GENE$ or other mediators such as substance P.
115	CPRFalse	We examined the specificity and initial sites of recruitment of @CHEMICAL$-dependent adaptors (AP-1 and GGAs) in response to the Golgi or endosomal localization of specific cargo proteins (furin, mannose-6-phosphate receptor (M6PR) and M6PR lacking a @GENE$-terminal domain M6PRDC).
116	CPRFalse	These studies have helped to elucidate some of the renal tubular mechanisms regulating mineral homeostasis and the role of @CHEM-GENE$.
117	CPRFalse	@CHEMICAL$ coadministration could inhibit the uptake of cefadroxil in @GENE$(+/+) mice (p < 0.01) but not PEPT2(-/-) mice.
118	CPRFalse	Effects of venlafaxine on extracellular concentrations of @CHEMICAL$ and noradrenaline in the rat frontal cortex: augmentation via @GENE$ receptor antagonism.
119	CPRFalse	PURPOSE: To compare phenelzine (@CHEMICAL$), an antidepressant drug with anxiolytic properties which inhibits monoamine oxidase (MAO) but also elevates rat brain levels of the amino acids ?-aminobutyric acid (GABA) and alanine (ALA), with vigabatrin (VIG), an anticonvulsant which elevates brain GABA by inhibition of @GENE$ (GABA-T), with regard to their actions on brain levels of GABA and ALA and on activities of MAO, GABA-T and ALA transaminase (ALA-T).
120	CPRFalse	Total blood count, blood indices of creatine kinase (@CHEMICAL$), gamma-glutamyltranspeptidase (g-GT), superoxide dismutase (SOD), nitric oxide (NO), malondialdehyde (@GENE$), interleukin (IL)-2, tumor necrosis factors (TNF)a, alpha-fetoprotein (AFP), carbohydrate antigen (CA) 19.9 and carcinoembrionic antigen (CEA) were assayed.
121	CPR:4	Many clinical studies, both pre- and post-marketing, have demonstrated the clinical efficacy and safety of sildenafil (@CHEMICAL$, Pfizer) - the first approved selective @GENE$ inhibitor for the treatment of ED.
122	CPRFalse	Since plasma concentrations of prothrombin, factor VII, protein C, or protein S did not by themselves potentiate factor Xa generation and did not interfere with the potentiation of the reaction of factor IX, the effect is specific for @CHEMICAL$ and is not attributable to the Gla domain of all @GENE$-dependent proteins.
123	CPR:4	In Alexander cells, only when they were transfected with FXR+RXR, @CHEMICAL$ caused up-regulation of SHP and OSTb, and a down-regulation of @GENE$.
124	CPRFalse	We confirm the existence of a second NO site in the oxygenase domain of the @CHEMICAL$ as previously hypothesized [A. Slama-Schwok, M. Negrerie, V. Berka, J.C. Lambry, A.L. Tsai, M.H. Vos, J.L. Martin, Nitric oxide (NO) traffic in endothelial @GENE$ synthase.
125	CPR:9	In kidneys, stimulation of adenylyl cyclase causes egress of cAMP, conversion of cAMP to AMP by ecto-phosphodiesterase, and metabolism of @CHEMICAL$ to adenosine by @GENE$.
126	CPR:9	Inhibition studies revealed that the multidrug resistance-associated proteins (@CHEMICAL$) are involved in the transport of @GENE$ conjugates.
127	CPR:9	Leukotriene A(4) hydrolase (@CHEMICAL$) is a cystolic enzyme that stereospecifically catalyzes the transformation of LTA(4) to @GENE$.
128	CPR:4	Subsequently, @CHEMICAL$ suppressed the nuclear translocation of @GENE$, one of downstream molecules of PI3K/Akt/GSK-3b signaling, and these events led to the sequential downregulation of b-catenin-mediated transcription of target genes including BMP4, ID2, survivin, cyclin D1, MMP7, and c-Myc.
129	CPR:6	@CHEMICAL$, a @GENE$ antagonist, reduces Na(+) influx into cortical synaptosomes by direct interaction with Na(+) channels: comparison with other beta-adrenoceptor antagonists.
130	CPR:4	The results suggest that the suppression of @CHEMICAL$ activity by @GENE$ may be the molecular mechanism through which auranofin exerts anti-rheumatic activity.
131	CPR:4	"@CHEMICAL$ also inhibited other channels including Cav1.2, @GENE$, and HCN2; however, the Kv11.1 (hERG) channel was minimally affected."
132	CPR:9	@CHEMICAL$ (MCTs) are proton-linked membrane carriers involved in the transport of monocarboxylates such as lactate, pyruvate, as well as @GENE$ bodies.
133	CPR:4	Comparison of the monoamine oxidase inhibiting properties of two reversible and selective @CHEMICAL$ inhibitors moclobemide and @GENE$, and assessment of their effect on psychometric performance in healthy subjects. 1.
134	CPR:9	Cytochrome P450 epoxygenase 2J2 (@CHEMICAL$) metabolizes @GENE$ to form epoxyeicosatrienoic acids (EETs), which possess various beneficial effects on the cardiovascular system.
135	CPR:4	@CHEMICAL$ inhibited the kinase activity of both C-RAF and B-RAF (wild type and @GENE$ mutant).
136	CPR:4	SC-51089 (10(-5) M), a selective EP1-receptor antagonist, showed no effect on the PGE1- or PGE2-induced inhibition of the HVA ICa, thereby indicating that @CHEMICAL$- and PGE2-induced inhibition of the @GENE$ is possibly mediated by the EP3 receptor.
137	CPR:3	@CHEMICAL$ also induces the rapid phosphorylation of Protein Kinase D1 (@GENE$).
138	CPR:4	@CHEMICAL$ inhibits @GENE$ activation in breast cancer cells by a reactive oxygen species-mediated mechanism and independently of janus tyrosine kinase 2 and p-rex1.
139	CPR:4	@CHEMICAL$ also down-regulated the expression of STAT3 target genes, including the anti-apoptotic proteins @GENE$ and Mcl-1, leading to the up-regulation of mitochondrial apoptosis pathway-related proteins (Bax, Bak, cytosolic Cytochrome c, and cleaved Caspase3) and cyclin-dependent kinase inhibitors such as p21 and p27.
140	CPR:3	Together, our findings suggest the critical role of 'Rac and subsequent activation of @CHEMICAL$' in @GENE$-signalling to nucleus.
141	CPR:4	Different mechanisms of acquired resistance to fluorinated pyrimidines in human colorectal cancer cells. 5-Fluorouracil (5-FU), 5-fluoro-2'-deoxyuridine (FdUrd) and 5-trifluorothymidine (@CHEMICAL$) are antimetabolites which are metabolized to their corresponding active forms which inhibit DNA synthesis via inhibition of thymidylate synthase (@GENE$).
142	CPR:3	Crocin (25 and 50mg/kg) or @CHEMICAL$ improved histopathological damages, decreased MDA and CK-MB, increased GSH content and attenuated the increase of Bax/Bcl2 ratio, activation of @GENE$ and release of cytochrome c to the cytosol induced by DZN.
143	CPR:4	A series of @CHEMICAL$ and phenol natural products, such as p-hydroxybenzoic acid, p-coumaric acid, caffeic acid, ferulic acid, gallic acid, syringic acid, quercetin, and ellagic acid, were investigated for their inhibitory effects against the metalloenzyme carbonic anhydrase (@GENE$, EC 4.2.1.1).
144	CPR:9	Hydrogen sulphide (H(2)S) is synthesized from @CHEMICAL$ via the action of cystathionine-gamma-lyase (@GENE$) and cystathionine-beta-synthase (CBS).
145	CPR:4	When further examined for its anticancer mechanism, @CHEMICAL$ effectively suppressed the @GENE$/mTOR pathway both in vitro and in vivo.
146	CPR:4	@CHEMICAL$, a lipid-lowering drug, inhibits the induction of @GENE$ in human astrocytes.
147	CPR:3	"@CHEMICAL$ mediates cardiostimulation by activation of the 'putative' @GENE$; however, it has recently been reported that disruption of the beta(1)-adrenoceptor gene abolishes this effect."
148	CPR:9	Adenylosuccinate synthetase (@CHEMICAL$) catalyzes the Mg2+ dependent condensation of a molecule of IMP with aspartate to form @GENE$, in a reaction driven by the hydrolysis of GTP to GDP.
149	CPR:4	Existing ion channel blockers, such as @CHEMICAL$, dronedarone, bepridil, aprindine, and cibenzoline, have been found to have an @GENE$ inhibitory action.
150	CPR:4	@CHEMICAL$ forestalls cigarette smoke induced @GENE$ activation in alveolar epithelial cells.
151	CPR:4	We evaluated the effects of @CHEMICAL$ and an angiotensin-converting enzyme inhibitor (@GENE$) on nerve blood flow (NBF) and electrophysiology in control and diabetic rats.
152	CPR:4	CONCLUSION: A long-term intake of @CHEMICAL$ solution down-regulates the phosphorylation of @GENE$ in the nucleus accumbens, and those changes can be reversed by naloxone, which may be one kind of the molecular mechanisms associated with ethanol dependence.
153	CPR:4	Also, @CHEMICAL$ showed anti-angiogenic activity by decreasing the expression of HIF-1a and @GENE$.
154	CPR:9	However, the loss of proliferative capacity of @CHEMICAL$ cells challenged with levels of @GENE$ associated with severe oxidative stress indicates a role of other aldehyde metabolizing enzymes, and/or GSH-electrophile transporter proteins, in providing full cellular protection against 4-HNE toxicity.
155	CPR:4	"The antipsychotic drugs sertindole and @CHEMICAL$ are known to prolong the QT interval on the electrocardiogram via a high affinity block of the cardiac K(+) channel known as @GENE$ (human ether-a-go-go-related gene; erg1)."
156	CPR:4	Beta-glucogallin (@CHEMICAL$), a recently described @GENE$ inhibitor, was purified from extracts of the Indian gooseberry (Emblica officinalis).
157	CPR:4	@CHEMICAL$ inhibit @GENE$ function by inducing protein oligomerization.
158	CPR:4	A series of @CHEMICAL$ have been synthesised, characterised and tested for their in vitro EGFR @GENE$ inhibitory activity.
159	CPR:9	The beta subunit has been cloned and shown to lower the K(m) of methionine adenosyltransferase II alpha2 (the @CHEMICAL$ product) for @GENE$ and to render the enzyme more susceptible to S-adenosylmethionine inhibition.
160	CPR:4	Troglitazone inhibited LTB(4) production by the supernatant fraction of RBL-2H3 cell lysate with similar potency to @CHEMICAL$, suggesting that troglitazone inhibits LT production by direct inhibition of @GENE$ activity. 4.
161	CPR:3	@CHEMICAL$-induced @GENE$ and basal Na(+)/K(+)-ATPase trafficking via protein kinase D1-phosphatidylinositol 4-kinaseIIIb trans Golgi signalling in M1 cortical collecting duct cells.
162	CPR:4	"The results showed that IR tyrosine phosphorylation (pIR) was reduced by 42 % in MSG-obese mice (MSG, 6.7 + 0.2 arbitrary units (a.u.); control, 11.5 + 0.4 a.u.); on the other hand, exercise training increased @CHEMICAL$ by 76 % in MSG mice without affecting control mice (@GENE$, 11.8 + 0.3; control, 12.8 + 0.2 a.u.)."
163	CPR:4	Additionally, @CHEMICAL$ levels in the cytosol decreased due to @GENE$ but not due to calpeptin.
164	CPR:5	The involvement of @CHEMICAL$ and EP2 receptors is indicated by studies with the EP1 selective agonist @GENE$, and the EP2 selective agonist butaprost (which stimulate), as well as by studies with the antagonists SC-51089 (EP1 specific) and AH 6809 (EP1 and EP2 specific).
165	CPR:3	Upon co-exposure to V(5+) and @CHEMICAL$, V(5+) significantly potentiated the TCDD-mediated induction of the Cyp1a1, Cyp1a2, and @GENE$ mRNA, protein, and catalytic activity levels at 24 h. In vitro, V(5+) decreased the TCDD-mediated induction of Cyp1a1 mRNA, protein, and catalytic activity levels.
166	CPR:4	@CHEMICAL$ inhibits @GENE$-induced inflammatory responses in vitro and in vivo.
167	CPR:4	@CHEMICAL$ inhibited the @GENE$ activity of both C-RAF and B-RAF (wild type and V600E mutant).
168	CPR:4	Comparison of the monoamine oxidase inhibiting properties of two reversible and selective @CHEMICAL$ inhibitors @GENE$ and toloxatone, and assessment of their effect on psychometric performance in healthy subjects. 1.
169	CPR:4	However, combination of rasagiline (10 mg x kg(-1) i.p.) with L-DOPA or L-tryptophan (50 mg x kg(-1) i.p.), or rasagiline (10 mg x kg(-1) p.o.) with fluoxetine (10 mg x kg(-1) p.o.), did not induce the behavioural hyperactivity syndrome which is seen following inhibition of both MAO-A and @CHEMICAL$ by @GENE$ together with the monoamine precursors.
170	CPR:6	Betaxolol inhibited specific [(3)H]-batrachotoxinin-A 20-alpha-benzoate ([(3)H]-BTX-B) binding to neurotoxin site 2 in a concentration-dependent manner with an IC(50) value of 9.8 microM. Comparison of all the @CHEMICAL$ antagonists tested revealed a potency order of propranolol>betaxolol approximately levobetaxolol>levobunolol approximately carteolol>/=@GENE$>atenolol.
171	CPR:4	CRH caused a rise in plasma ACTH after both loperamide (from 30 +/- 16.6 to a peak of 108 +/- 31 pmol/l) and placebo (from 98.5 +/- 47 to 211 +/- 61.7 pmol/l): the interaction between treatments and time was significant, and the first phase of @CHEMICAL$-induced ACTH secretion was significantly lower after @GENE$.
172	CPR:4	RESULTS: @CHEMICAL$ was six times more active against COX-1 (IC(50) = 0.02 microM) than COX-2 (IC(50) = 0.12 microM) while bromfenac was approximately 32 times more active against COX-2 (IC(50) = 0.0066 microM) than @GENE$ (IC(50) = 0.210 microM).
173	CPR:4	Levels of @CHEMICAL$ protein were also decreased in a dose- and time-dependent manner following @GENE$ treatment.
174	CPR:6	@CHEMICAL$ (10 microM), another @GENE$ antagonist without significant 5-HT receptor binding affinity, did not produce any inhibition of the eNANC contraction.
175	CPR:9	Immunohistochemical characterization of @CHEMICAL$ synthetic enzymes, @GENE$ and thymidylate synthase, in various types of cancer.
176	CPR:4	These results suggested that @CHEMICAL$ could inhibit invasion and angiogenesis by downregulation of @GENE$and MMP-9, resulting from the inhibition of Akt pathway.
177	CPR:6	In the rabbit pulmonary artery, rilmenidine and @CHEMICAL$ are potent full agonists, whereas in the human atrial appendages they are antagonists at the @GENE$, sharing this property with rauwolscine, phentolamine, and idazoxan.
178	CPR:9	Reduced synthesis of @CHEMICAL$ (NO) contributes to the endothelial dysfunction and may be related to limited availability of L-arginine, the common substrate of constitutive nitric-oxide synthase (NOS) and cytosolic arginase I and @GENE$.
179	CPR:4	FCEO significantly inhibited nitric oxide (NO) and @CHEMICAL$ (PGE2) by suppressing the protein expression of inducible nitric oxide synthase (iNOS) and @GENE$, respectively.
180	CPR:4	This hypothesis was tested by investigating whether, in subjects with essential hypertension, the natriuretic response to specific @CHEMICAL$-angiotensin-aldosterone system (RAAS) blockade by renin-inhibitor @GENE$ could be predicted from pretreatment renal vascular tone.
181	CPR:4	In the in vitro assay, @CHEMICAL$ (20 and 50mg/mL) markedly inhibited changes in various biochemical substances (nitric oxide (NO), @GENE$ (LDH), superoxide dismutase (SOD), and catalase (CAT)) in human umbilical vein endothelial cells (HUVECs) damaged by high glucose (35mM) and restored vascular endothelial structure by balancing the matrix metalloproteinases-the tissue inhibitors of matrix metalloproteinases (MMP-TIMP) system.
182	CPR:3	Combined treatment of @CHEMICAL$ and DA further augments cell toxicity, ROS production and @GENE$ phosphorylation in LRRK2 deficient cells compared to controls.
183	CPR:4	BACKGROUND: Since the introduction of the first @CHEMICAL$ inhibitor (ChEI) in 1997, most clinicians and probably most patients would consider the cholinergic drugs, donepezil, galantamine and @GENE$, to be the first line pharmacotherapy for mild to moderate Alzheimer's disease.
184	CPR:4	"The antipsychotic drugs sertindole and @CHEMICAL$ are known to prolong the QT interval on the electrocardiogram via a high affinity block of the @GENE$ known as HERG (human ether-a-go-go-related gene; erg1)."
185	CPR:6	Synthesis and antagonistic activity at @CHEMICAL$ subtypes of some @GENE$ derivatives of diphenidol.
186	CPR:9	@CHEMICAL$ (MCTs) are proton-linked membrane carriers involved in the transport of monocarboxylates such as @GENE$, pyruvate, as well as ketone bodies.
187	CPR:9	One major route involves the tetrahydrofolate (THF)-dependent activities of the glycine decarboxylase complex (GDC, EC 2.1.1.10) and serine hydroxymethyltransferase (@CHEMICAL$, EC 2.1.2.1) with @GENE$ (Gly) as one-carbon (1-C) source.
188	CPR:9	"We concluded that FDH has no direct role in the regulation of the above two pathways of Ser synthesis; the breakdown of formate to @CHEMICAL$ by the @GENE$ reaction is the primary and preferred fate of the organic acid in Arabidopsis."
189	CPR:9	Transfection of HepG2 cells with hGSTA4 provides protection against 4-hydroxynonenal-mediated oxidative injury. 4-Hydroxynonenal (4-HNE) is a mutagenic @CHEMICAL$ produced during oxidative injury that is conjugated by several @GENE$ (GST) isoforms.
190	CPR:4	Clinical utility of @CHEMICAL$, an @GENE$ inhibitor in cardiometabolic disorders.
191	CPR:4	Sixteen of 34 @CHEMICAL$ inhibited @GENE$-mediated E217bG uptake by >50% (IC50's 0.7-7.6 mM).
192	CPR:4	"They included the COX-1 inhibitor indomethacin; the @CHEMICAL$ inhibitor @GENE$; the mixed COX-1/COX-2 inhibitor ibuprofen; the nitric oxide (NO) derivatives of indomethacin, ibuprofen and flurbiprofen; the 5-LOX inhibitor REV 5901; and the 5-LOX activating protein (FLAP) inhibitor MK-886."
193	CPR:3	Subsequent analysis revealed that @CHEMICAL$ strongly activates RhoA and the Rho effector Rho kinase (@GENE$) in breast cancer cells and induces the formation of stress fibers.
194	CPR:4	Thus, the @CHEMICAL$-induced reduction in canonical Wnt signaling is associated with a decrease in activators (Rspo2 and Rspo3) rather than an increase in inhibitors (Dkk1 and @GENE$) of the pathway.
195	CPR:4	AIM: To assess the efficacy and safety of a 24-week treatment with @CHEMICAL$, a highly selective once-daily oral dipeptidyl peptidase-4 (@GENE$) inhibitor, in patients with type 2 diabetes who had inadequate glycaemic control [glycosylated haemoglobin (HbA(1c)) >or=7.5% and <or=10.5%] while on glimepiride alone or in combination with metformin.
196	CPR:4	The activities of @CHEMICAL$ and other ATP binding cassette superfamily members are inhibited by the drug @GENE$, and SR-BI-mediated lipid transport is blocked by small molecule inhibitors called BLTs.
197	CPR:4	Promoter assay revealed that @CHEMICAL$ inhibits LPS-induced nitric oxide and prostaglandin E2 production through the suppression of iNOS and @GENE$ at the transcriptional level.
198	CPR:4	Given that @CHEMICAL$, present in all H. pylori strains, is immunogenic in H. pylori -infected patients and H. pylori growth in vitro can be inhibited by three anthelmintics (morantel, @GENE$ and thiabendazole), this enzyme could potentially be used both as a novel drug target as well as in the development of vaccines for H. pylori prevention and eradication.
199	CPR:9	Aldo-keto reductases (@CHEMICAL$) metabolize a wide range of substrates, including polycyclic aromatic hydrocarbons (@GENE$), generating metabolites (o-quinones) and reactive oxygen species (ROS), which are capable of initiating and promoting carcinogenesis.
200	CPR:9	One of the enzymes responsible for the production of @CHEMICAL$, kynurenine aminotransferase I (@GENE$), also catalyses the reversible transamination of glutamine to oxoglutaramic acid (GTK, EC 2.6.1.15).
201	CPR:9	UGT1A6 exhibited a significantly higher Vmax and Km values toward both HFC and @CHEMICAL$-glucuronic acid than the other @GENE$. 5.  Human, pig and rabbit, but not rat liver microsomes, catalyzed HFC glucuronidation at high rates. 6.  This new method is particularly suitable for fast activity screenings of UGTs 1A6, 1A7, 1A10 and 2A1 and HFC glucuronidation activity determination from various samples.
202	CPR:9	@CHEMICAL$ encodes phosphatidylinositol 4-phosphate 5-kinase b type I (pip5k1b), an enzyme functionally linked to actin cytoskeleton dynamics that phosphorylates phosphatidylinositol 4-phosphate [PI(4)P] to generate @GENE$ [PI(4,5)P2].
203	CPR:4	"ZD1839 (""@CHEMICAL$""), a quinazoline @GENE$ inhibitor selective for the EGFR, has shown good activity in preclinical studies and in the early phase of clinical trials."
204	CPR:4	Moreover, co-treatment with @CHEMICAL$ and a specific PKCb inhibitor prevented endocytosis of gap junctions, downregulation of @GENE$, and inhibition of GJIC.
205	CPR:4	Different mechanisms of acquired resistance to fluorinated pyrimidines in human colorectal cancer cells. 5-Fluorouracil (5-FU), 5-fluoro-2'-deoxyuridine (FdUrd) and @CHEMICAL$ (F3(d)Thd) are antimetabolites which are metabolized to their corresponding active forms which inhibit DNA synthesis via inhibition of @GENE$ (TS).
206	CPR:4	@CHEMICAL$ has been shown to produce dose-related suppression of plasma renin activity (PRA) and @GENE$ when administered intravenously.
207	CPR:4	The pretreatment with 20 mg L(-1) @CHEMICAL$ could alleviate the effects of UV-B radiation on the activities of @GENE$, glutamine synthetase, glutamate synthase, and glutamate dehydrogenase, promoting amino acid conversion and protein synthesis in soybean seedlings.
208	CPR:4	Coexpression of GRK2 or GRK2 and arrestin-2 permitted @CHEMICAL$ to induce down-regulation of the @GENE$, although expression of arrestin-2 or dynamin I alone did not.
209	CPR:4	Nitrogen-containing @CHEMICAL$ (N-BPs) induce apoptosis in tumor cells by inhibiting the prenylation of small @GENE$.
