210	CPR:4	OBJECTIVES: The alkaloid @CHEMICAL$ (GAL), which exhibits a combined @GENE$ and direct parasympathomimetic mechanism of action, is employed in conjunction with therapeutic interventions in the stimulation of central cholinergic transfer in cognitive diseases.
211	CPR:9	Interestingly, the allele of PRO1 was shown to enhance the activities of @CHEMICAL$ and gamma-glutamyl phosphate reductase, both of which catalyze the first two steps of L-proline synthesis from @GENE$ and which together may form a complex in vivo.
212	CPR:3	Further, 5HHMF increased specific DNA-binding activity of @CHEMICAL$, and transient knockdown with Nrf2 siRNA subsequently reversed @GENE$-induced NO inhibition, which was followed by suppression of HO-1 activity.
213	CPR:3	@CHEMICAL$ inhibited the proliferation of HCT 116 cells by arresting transition of cell cycle from G1 to S phase along with the downregulation of cyclin D1, cyclin E, cyclin A, cyclin dependent kinase 2 (CDK2), CDK4, c-Myc, and retinoblastoma protein (pRb), and the upregulation of p21(WAF1/CIP1) and @GENE$.
214	CPR:3	Notably, @CHEMICAL$ treatment reduced adipose tissue expression of inflammatory cytokines, increased adiponectin expression and improved glucose tolerance parallel to @GENE$ sensitivity in obese mice.
215	CPR:4	Reserpine-induced ptosis was reversed by @CHEMICAL$ at doses above 2 mg x kg(-1) i.p., which inhibit MAO-A as well as @GENE$, but not at MAO-B-selective doses.
216	CPR:9	Favorable enzyme profiles (high @CHEMICAL$ and low DPD) generate high intratumor levels of @GENE$ that are effective against many tumors, especially those with low TS.
217	CPR:4	Our findings indicate that @CHEMICAL$ suppresses AGE-mediated inflammation by inhibiting ROS production and @GENE$ activity.
218	CPR:4	We previously employed a chemical genomic strategy to identify a novel small molecule, @CHEMICAL$, as a likely inhibitor of the @GENE$ targeting chaperone, LolA. Here, we report on the degradation of MAC13243 into the active species, S-(4-chlorobenzyl)isothiourea.
219	CPR:9	Carnitine acetyltransferases (@CHEMICAL$) catalyze the reversible conversion of acetyl-CoA and @GENE$ to acetylcarnitine and free CoA. To redesign the specificity of rat CrAT toward its substrates, we mutated Met564.
220	CPR:4	Suppression of @CHEMICAL$ by the pharmacological inhibitor (@GENE$) markedly reduced VEGF release by HFL-1 in response to CSE and this effect was confirmed by TbR1 siRNA.
221	CPR:4	A series of phenolic acids and phenol natural products, such as p-hydroxybenzoic acid, p-coumaric acid, @CHEMICAL$, ferulic acid, gallic acid, syringic acid, quercetin, and ellagic acid, were investigated for their inhibitory effects against the metalloenzyme carbonic anhydrase (@GENE$, EC 4.2.1.1).
222	CPR:4	The acetylcholinesterase (AChE) and @CHEMICAL$ (BuChE) inhibitory activities of a series of pyrano[2,3-b]quinolines (2, 3), @GENE$ (5, 6), 4-amino-2,3-diaryl-5,6,7,8-tetrahydrofuro[2,3-b]quinolines (11-13)/ 4-amino-6,7,8,9-tetrahydro-2,3-diphenyl-5H-cyclohepta[e]furo[2,3-b]pyridine (14), 4-amino-5,6,7,8-tetrahydro-2,3-diphenylthieno[2,3-b]quinoline (15)/ 4-amino-6,7,8,9-tetrahydro-2,3-diphenyl-5H-cyclohepta[e]thieno[2,3-b]pyridine (16) are described.
223	CPR:9	Specifically, @CHEMICAL$ cells had significantly higher GSH concentrations when exposed to 5-15 microM 4-HNE, but not at 20 microM @GENE$, suggesting extensive GSH utilization at high concentrations of 4-HNE.
224	CPR:5	The identification of the @CHEMICAL$ SUCNR1 in platelets is of particular interest, because physiologically relevant concentrations of @GENE$ were shown to potentiate the effect of low doses of a variety of platelet agonists.
225	CPR:3	In a cell-based model, @CHEMICAL$ suppressed Nrf2 activation via @GENE$ phosphorylation, enhancing intracellular reactive oxygen species in lung fibroblasts and stimulating abnormal cell proliferation and collagen secretion.
226	CPR:4	Our studies shed light on the possible in vivo potency of the @CHEMICAL$ and provide a foundation for future studies aimed at creating more potent @GENE$ inhibitors and at understanding the physiological significance of QR2.
227	CPR:9	Constitutive and inducible forms of human cyclo-oxygenase (hCOX-1 and hCOX-2) were cloned and expressed in insect cells, utilizing a baculovirus expression system. @CHEMICAL$ had a specific activity of 18.8 mumol of O2/mg with a Km of 13.8 microM for @GENE$ and Vmax. of 1500 nmol of O2/nmol of enzyme, whereas hCOX-2 had a specific activity of 12.2 mumol of O2/mg with a Km of 8.7 microM for arachidonate and a Vmax. of 1090 nmol of O2/nmol of enzyme.
228	CPR:4	The mRNA levels of @CHEMICAL$ (MITF) and its downstream genes tyrosinase, tyrosinase-related protein (TRP)-1, and TRP-2 were reduced by @GENE$ treatment.
229	CPR:4	We hypothesized that the @CHEMICAL$ compounds would be most potent at the @GENE$ (NET) compared to the serotonin or dopamine transporters and that the 1R diastereomers would be more effective than 1S diastereomers.
230	CPR:4	The selective PDE 4 inhibitors, and to a certain extent the PDE3 inhibitors @CHEMICAL$ and milrinone, reduced the @GENE$ release in a concentration dependent manner.
231	CPR:4	However, a lower concentration of @CHEMICAL$ (3 microM) that blocks PDE9, @GENE$, and PDE11, but not PDE8, did not inhibit ecto-phosphodiesterase activity.
232	CPR:9	@CHEM-GENE$ are a critical component of electrically excitable cells.
233	CPR:4	Moreover, overexpressed CYP2J2 and @CHEMICAL$ inhibited @GENE$-induced macrophage migration in a VSMC-macrophage coculture system.
234	CPR:9	The @CHEMICAL$ homeostasis proteins sarcoendoplasmic reticulum ATPase 2a (@GENE$), sodium calcium exchanger-1, phospholamban (PLB), phospho-PLB, and calsequestrin 2 are important for contraction and relaxation.
235	CPR:4	The acetylcholinesterase (AChE) and butyrylcholinesterase (@CHEMICAL$) inhibitory activities of a series of pyrano[2,3-b]quinolines (2, 3), [1,8]naphthyridines (5, 6), 4-amino-2,3-diaryl-5,6,7,8-tetrahydrofuro[2,3-b]quinolines (11-13)/ @GENE$ (14), 4-amino-5,6,7,8-tetrahydro-2,3-diphenylthieno[2,3-b]quinoline (15)/ 4-amino-6,7,8,9-tetrahydro-2,3-diphenyl-5H-cyclohepta[e]thieno[2,3-b]pyridine (16) are described.
236	CPR:4	"DBS was measured by using the pH-stat method and by using CO2-sensitive electrodes. 5-(N,N-dimethyl)-amiloride (50 microM; @CHEMICAL$), a concentration that selectively inhibits the NHE isoforms @GENE$ and NHE2, but not NHE3, did not affect DBS."
237	CPR:3	The @CHEMICAL$ treatment was associated with a 2-fold increase in @GENE$ activity as well as a 70% reduction in endothelial O(2)(-) production compared with those in fructose-fed rats.
238	CPR:4	Similarly, pretreatment with @CHEMICAL$ blocks the ability of @GENE$ to induce ERK1/2 and Bad phosphorylation, but also down-regulates total Bad but not ERK1/2 protein levels.
239	CPR:3	@CHEMICAL$ also increased @GENE$ (Hb) levels in animals treated for 24 h.
240	CPR:4	@CHEMICAL$ also suppressed AGE-induced phosphorylation of @GENE$, degradation of IkBa and the nuclear localization of NF-kB.
241	CPR:4	Effects of some mono- and bisquaternary ammonium compounds on the reactivatability of soman-inhibited human acetylcholinesterase in vitro. @CHEMICAL$ (AChE) inhibited by the organophosphate soman (@GENE$) rapidly becomes resistant to reactivation by oximes due to dealkylation of the soman-enzyme complex.
242	CPR:4	Nevertheless, coperfusion with 0.1 and 0.3 mM @CHEMICAL$, which inhibits the cystic fibrosis transmembrane conductor regulator (@GENE$), dose dependently inhibited S3226-induced DBS.
243	CPR:4	@CHEMICAL$ and gliclazide block the K(ATP) channel @GENE$/Sur1, causing membrane depolarization and stimulating insulin secretion in pancreatic beta cells.
244	CPR:4	Our results demonstrated that @CHEMICAL$ suppressed TLR4-mediated activation of transcription factors, NF-kappaB and @GENE$, and expression of COX-2, a pro-inflammatory enzyme.
245	CPR:9	Introduction: @CHEMICAL$ (5-LO) is a crucial enzyme of the @GENE$ (AA) cascade and catalyzes the formation of bioactive leukotrienes (LTs) with the help of FLAP, the 5-LO-activating protein.
246	CPR:5	The beta(2)-adrenoceptor (@CHEMICAL$) agonists @GENE$ and fenoterol have similar beneficial effects in animal models of heart failure.
247	CPR:4	@CHEMICAL$ block of recombinant N-methyl-D-aspartate receptors: selectivity for the @GENE$ subunit.
248	CPR:4	@CHEMICAL$ channels were less sensitive to pentobarbital inhibition than Ca(v)1.2 channels, similar to @GENE$ (DHP) L-VGCC antagonists.
249	CPR:4	@CHEMICAL$ treatment showed a significant decline in the levels of blood glucose, glycosylated hemoglobin (HbA1c), NF-kB @GENE$ unit (in pancreas) and IL-1b (plasma), serum nitric oxide (NO) with an elevation in plasma insulin.
250	CPR:4	@CHEMICAL$ inhibitors p-bromophenacyl bromide and @GENE$ suppressed interleukin-2 (IL-2) expression in murine primary splenocytes.
251	CPR:3	@CHEMICAL$ also down-regulated the expression of STAT3 target genes, including the anti-apoptotic proteins Bcl-xL and Mcl-1, leading to the up-regulation of mitochondrial apoptosis pathway-related proteins (Bax, Bak, cytosolic Cytochrome c, and cleaved Caspase3) and cyclin-dependent kinase inhibitors such as p21 and @GENE$.
252	CPR:5	Labetalol (> or = 3 x 10(-8) M) and dilevalol (> or = 10(-8) M) caused surmountable antagonism of the @CHEMICAL$ responses of the atria and the pA2 values were 8.60 and 8.98 at the @GENE$ of the rat left atria and 7.90 and 8.31, respectively, on the guinea-pig left atria which has functional beta 1- and beta 2-adrenoceptors.
253	CPR:3	Independent of dietary @CHEMICAL$, supplemental Met increased hepatic @GENE$ activity approximately 30%.
254	CPR:4	"@CHEMICAL$ (""Iressa""), a quinazoline @GENE$ inhibitor selective for the EGFR, has shown good activity in preclinical studies and in the early phase of clinical trials."
255	CPR:9	Cytochrome P450 epoxygenase 2J2 (@CHEMICAL$) metabolizes arachidonic acids to form @GENE$ (EETs), which possess various beneficial effects on the cardiovascular system.
256	CPR:4	BDZs and other positive GABA(A)R modulators, including @CHEMICAL$, ethanol, and neurosteroids, can also inhibit @GENE$ (L-VGCCs), which could contribute to reduced neuronal excitability.
257	CPR:4	Disposition and Metabolism of GSK2251052 in Humans: A Novel Boron-Containing Antibiotic. (S)-3-(Aminomethyl)-7-(3-hydroxypropoxy)-1-hydroxy-1,3-dihydro-2,1-benzoxaborole (@CHEMICAL$) is a novel boron-containing antibiotic that inhibits @GENE$, and that has been in development for the treatment of serious Gram-negative infections.
258	CPR:4	@CHEMICAL$ blocked @GENE$ in a use/frequency-dependent manner, indicating preferential binding to states visited during depolarization.
259	CPR:6	The @CHEMICAL$ antagonist @GENE$ facilitated hyperglycemia induced by clomipramine, although the 5-HT(2A)-receptor antagonist ketanserin was without effect.
260	CPR:4	Reactivators showed different activity in the reactivation of @CHEMICAL$ after dichlorvos, paraoxon and @GENE$ inhibition.
261	CPR:6	Pretreatment with tropisetron (1 microM), a 5-HT3 antagonist, @CHEMICAL$ (10 microM), a @GENE$ antagonist, thioperamide (10 microM), a histamine H3 antagonist, or phentolamine (10 microM), an alpha-adrenergic antagonist, however, had no effect.
262	CPR:3	These findings suggest that @CHEMICAL$ activates the PI3K/Akt signaling pathway leading to the promotion of nuclear translocation of b-catenin in osteoblast-like cells, resulting in the upregulation of @GENE$ and osteoblast differentiation markers including alkaline phosphatase, probably relating to the inhibition of osteoclast formation and the mineralization, respectively.
263	CPR:3	@CHEMICAL$ expression was increased in all BPA males and @GENE$ 0.5 females and reduced in BPA 200 females.
264	CPR:3	Effects of some mono- and bisquaternary ammonium compounds on the reactivatability of soman-inhibited human acetylcholinesterase in vitro. @CHEMICAL$ (AChE) inhibited by the organophosphate soman (1,2,2-trimethyl-propylmethylphosphonofluoridate) rapidly becomes resistant to reactivation by @GENE$ due to dealkylation of the soman-enzyme complex.
265	CPR:3	In addition, @CHEMICAL$ induces the DNA-binding activities of the transcription factor NF-kB, @GENE$, AP-1, and ATF-2, together with the expression of HSP70 and Bax proteins.
266	CPR:9	The acute toxicity of organophosphorus (OP) compounds in mammals is due to their irreversible inhibition of @CHEMICAL$ (AChE) in the nervous system, which leads to increased synaptic @GENE$ levels.
267	CPR:4	@CHEMICAL$ also suppressed AGE-induced phosphorylation of mitogen activated protein (MAP) kinases, degradation of IkBa and the nuclear localization of @GENE$.
268	CPR:3	In the CCl4 hepatotoxicity model, pre-treatment with PSM or silymarin resulted in significantly increased activities of ethylmorphine-N-demethylase and @CHEMICAL$ activity and cytochrome P450, compared to the @GENE$ only group.
269	CPR:9	The M564G mutated @CHEMICAL$ showed higher activity toward longer chain acyl-CoAs: activity toward @GENE$ was 1250-fold higher than that of the wild-type CrAT, and lower activity toward its natural substrate, acetyl-CoA. Kinetic constants of the mutant CrAT showed modification in favor of longer acyl-CoAs as substrates.
270	CPR:9	The alpha class @CHEMICAL$ enzyme (hGSTA4-4) has a particularly high catalytic efficiency toward @GENE$ conjugation.
271	CPR:9	The primary aim of these studies was to test the hypothesis that @CHEMICAL$-derived @GENE$ has a biological role in endometrial function and conceptus development during early pregnancy in sheep.
272	CPR:3	In the present study, we investigated the effect of @CHEMICAL$-induced constitutive @GENE$ activity on muscarinic receptor agonist- and histamine-induced bovine tracheal smooth muscle contractions.
273	CPR:6	It is concluded that labetalol and @CHEMICAL$ are @GENE$ selective antagonists.
274	CPR:3	Polymorphisms in dopamine transporter (@CHEMICAL$) are associated with stimulant effects of @GENE$: an exploratory pharmacogenetic study using healthy volunteers.
275	CPR:9	These unexpected and intriguing complexities seem likely to have some as yet undefined role in regulating @CHEMICAL$ activity or stability as a part of @GENE$ homeostasis.
276	CPR:3	Moreover, BH(4) treatment of the fructose-fed rats markedly reduced the lipid peroxide content of both aortic and cardiac tissues and inhibited the activation of 2 redox-sensitive transcription factors, @CHEMICAL$ and activating protein-1, which were increased in @GENE$-fed rats.
277	CPR:3	Treatment with diclofenac resulted in nuclear condensation (a morphological change due to apoptosis of NSCs) 24hr after the treatment and activated caspase-3 after 6 hr, indicating that @CHEMICAL$ may cause apoptosis of neuronal cells via activation of the @GENE$ cascade.
278	CPR:3	Similarly, pelargonidin induced the expression of CYP1A1 mRNA up to 5-fold in HepG2 and LS174T cells relative to the induction by 5 nM 2,3,7,8-tetrachlorodibenzodioxin (TCDD), the most potent activator of AhR. @CHEMICAL$ and CYP1A2 mRNAs were also increased by @GENE$ in three primary human hepatocytes cultures (approximately 5% of TCDD potency) and the increase in CYP1A1 protein in HepG2 and LS174T cells was comparable to the increase in catalytic activity of CYP1A1 enzyme.
279	CPR:9	The @CHEMICAL$ (cytochrome c oxidase) is a multi-subunit enzyme that transfers electrons from cytochrome c to molecular @GENE$, yielding water.
280	CPR:6	"The effects of D-1997 in the basilar artery were not modified by incubation with either the 5-HT2 receptor antagonist ketanserin (0.01-1 microM), the 5-HT3 and 5-HT4 receptor antagonist ICS205930 (tropisetron; 0.1-10 microM), the @CHEMICAL$ receptor antagonist @GENE$ (0.01-1 microM), the beta-adrenoceptor blocker with high affinity for 5-HT1A and 5-HT1B binding sites (+/-)-pindolol (0.01-1 microM), or the alpha 1-adrenoceptor antagonist prazosin (0.01-1 microM)."
281	CPR:9	Purified @CHEMICAL$/SMO oxidizes both spermine (K(m)=1.6 microM) and @GENE$ (K(m)=51 microM), but does not oxidize spermidine.
282	CPR:3	It is concluded that @CHEMICAL$ contracts the canine basilar artery by stimulating @GENE$ unrelated to either the 5-HT1A or 5-HT1B receptor subtypes.
283	CPR:9	The protein exhibited modest H(2)O(2)-dependent @CHEMICAL$ activities with guaiacol, @GENE$, and 2,2(')-azino-bis(3-ethylbenzothiazoline-6-sulfonic acid (ABTS).
284	CPR:3	Upon co-exposure to @CHEMICAL$ and TCDD, V(5+) significantly potentiated the TCDD-mediated induction of the @GENE$, Cyp1a2, and Cyp1b1 mRNA, protein, and catalytic activity levels at 24 h. In vitro, V(5+) decreased the TCDD-mediated induction of Cyp1a1 mRNA, protein, and catalytic activity levels.
285	CPR:9	The beta subunit has been cloned and shown to lower the K(m) of @CHEMICAL$ (the MAT2A product) for @GENE$ and to render the enzyme more susceptible to S-adenosylmethionine inhibition.
286	CPR:3	Time-dependent changes in hepatic and intestinal induction of @CHEMICAL$ after administration of @GENE$ to rats.
287	CPR:3	"Although the treatment with @CHEMICAL$ increased IRS-1 tyrosine phosphorylation (@GENE$) by 96 % (MSG, 17.02 + 0.6; control, 8.7 + 0.2 a.u.), exercise training also increased it in both groups (control, 13.6 + 0.1; MSG, 22.2 + 1.1 a.u.)."
288	CPR:3	Platelet-induced COX-2-dependent PGE2 synthesis in HT29 cells was involved in downregulation of p21(WAF1/@CHEMICAL$) and upregulation of cyclinB1, since these effects were prevented by @GENE$(a selective COX-2 inhibitor) and rescued by exogenous PGE2.
289	CPR:9	@CHEMICAL$ (SSAT) is a key enzyme in the control of polyamine levels in human cells, as acetylation of @GENE$ and spermine triggers export or degradation.
290	CPR:9	BACKGROUND AND AIMS: Glutamic acid decarboxylase (@CHEMICAL$, EC 4.1.1.15) catalyses the conversion of glutamate to @GENE$ (GABA).
291	CPR:9	On the basis of our findings with structurally similar arylhydroxylamine metabolites of therapeutic drugs, we hypothesized that the reductive detoxification of @CHEMICAL$ carcinogens was catalyzed by NADH cytochrome b5 reductase (b5R) and cytochrome b5 (@GENE$).
292	CPR:3	@CHEMICAL$ treatment led to an increase in lipid peroxidation, @GENE$ and glucose-6-phosphate dehydrogenase activities and to a decrease in catalase activity and glutathione levels in gastric mucosa.
293	CPR:5	In the DRN, @CHEMICAL$ completely inhibited the firing of 5-HT neurons via @GENE$ agonism and was more potent than aripiprazole (ED50 = 230 and 700 mug/kg, respectively).
294	CPR:3	These results showed that @CHEMICAL$ and Cav1 are upregulated by chemotherapeutics and enhance the resistance of GC cells to @GENE$ drugs.
295	CPR:5	OBJECTIVES: The aim of this study was to determine whether cocaine's sympathomimetic actions can be reversed by a potent centrally acting @CHEMICAL$ (AR) agonist (@GENE$).
296	CPR:9	In this study, we investigated the presence of H(2)S and the expression of @CHEMICAL$ synthesizing enzymes, CSE and @GENE$, in isolated mouse pancreatic acini.
297	CPR:9	One major route involves the tetrahydrofolate (THF)-dependent activities of the glycine decarboxylase complex (GDC, EC 2.1.1.10) and serine hydroxymethyltransferase (SHMT, @CHEMICAL$) with @GENE$ (Gly) as one-carbon (1-C) source.
298	CPR:3	The data show that CP[c]Ph is less potent at inducing @CHEMICAL$ gene expression in rainbow trout than @GENE$ (B[a]P), a well-known Ah-receptor agonist.
299	CPR:3	@CHEMICAL$ treatment also results in modest improvements in total cholesterol, @GENE$, blood pressure, and fasting glucose and insulin concentrations.
300	CPR:9	@CHEMICAL$ (H(2)S) is synthesized from L-cysteine via the action of cystathionine-gamma-lyase (CSE) and @GENE$ (CBS).
301	CPR:3	In this study, using reverse transcriptase PCR (RT-PCR) and ELISA, we showed that @CHEMICAL$ up-regulated the expression and secretion of @GENE$ (TNF-a) in a time-dependent manner in cultured HAPI microglial cells.
302	CPR:9	@CHEMICAL$ (H(2)S) is synthesized from L-cysteine via the action of @GENE$ (CSE) and cystathionine-beta-synthase (CBS).
303	CPR:9	The protein exhibited modest H(2)O(2)-dependent @CHEMICAL$ activities with @GENE$, potassium iodide, and 2,2(')-azino-bis(3-ethylbenzothiazoline-6-sulfonic acid (ABTS).
304	CPR:6	Synthesis and in Vitro Characterisation of Ifenprodil-Based @CHEMICAL$ Conjugates as GluN1/GluN2B @GENE$ Antagonists.
305	CPR:6	Effects of a @CHEMICAL$ antagonist @GENE$ on gastrointestinal motor and sensory function in humans.
306	CPR:9	@CHEMICAL$ (IDO), a @GENE$ catabolizing enzyme, has been implicated in the pathogenesis of various neurological disorders.
307	CPR:5	Lisuride dose dependently decreased body temperature in rats with a potency similar to that of the selective @CHEMICAL$ agonist @GENE$.
308	CPR:6	Synthesis and in Vitro Characterisation of Ifenprodil-Based @CHEMICAL$ Conjugates as @GENE$/GluN2B N-Methyl-D-aspartate Receptor Antagonists.
309	CPR:9	Leukotriene A(4) hydrolase (@CHEMICAL$) is a cystolic enzyme that stereospecifically catalyzes the transformation of @GENE$ to LTB(4).
310	CPR:3	Galanin attenuates cyclic AMP regulatory element-binding protein (@CHEMICAL$) phosphorylation induced by chronic morphine and @GENE$ challenge in Cath.a cells and primary striatal cultures.
311	CPR:3	In this study, aldosterone (@CHEMICAL$)-induced apoptosis of cardiomyocyte was evaluated based on the previous studies, and the roles of @GENE$ signaling were clarified.
312	CPR:3	Mutation of arginine 228 to @CHEMICAL$ enhances the @GENE$ activity of bovine beta-1,4-galactosyltransferase I. Beta-1,4-galactosyltransferase I (beta4Gal-T1) normally transfers Gal from UDP-Gal to GlcNAc in the presence of Mn(2+) ion (Gal-T activity) and also transfers Glc from UDP-Glc to GlcNAc (Glc-T activity), albeit at only 0.3% efficiency.
313	CPR:3	Upon activation by @CHEMICAL$, @GENE$ CAR binds the 97-bp response element (-2441/-2345) within the Kcnk1 promoter.
314	CPR:9	Here, we demonstrate that peptidyl-prolyl cis/trans-isomerase A1 (@CHEMICAL$), an enzyme that catalyzes the conversion of the peptide bond of pSer/pThr-@GENE$ moieties in signaling proteins from cis to trans, is highly susceptible to HNE modification.
315	CPR:3	However, Ca(2+) blockers also obviously attenuated @CHEMICAL$ activation and transnuclear transport induced by @GENE$.
316	CPR:3	In addition to CYP2B6, @CHEMICAL$ co-treatment potentiated an increase in @GENE$ and CYP2C9 mRNAs but not CYP3A4 or UDP-glucuronosyltransferase 1A1 mRNAs.
317	CPR:9	Growth inhibition of these tumor cell lines was associated with the dephosphorylation of EGFR, HER2, and HER3, accompanied by the loss of association of HER3 with @CHEM-GENE$, and down-regulation of Akt activity.
318	CPR:9	The protein exhibited modest H(2)O(2)-dependent @CHEMICAL$ activities with guaiacol, potassium iodide, and @GENE$ (ABTS).
319	CPR:3	Conversely, AMPK inhibitor compound C or GSK3b inhibitor SB216763 blocked the cleavages of @CHEMICAL$ and caspase 3 induced by @GENE$ in HepG2 cells.
320	CPR:3	These findings suggest that @CHEMICAL$ activates the PI3K/Akt signaling pathway leading to the promotion of nuclear translocation of @GENE$ in osteoblast-like cells, resulting in the upregulation of osteoptotegerin and osteoblast differentiation markers including alkaline phosphatase, probably relating to the inhibition of osteoclast formation and the mineralization, respectively.
321	CPR:5	Adenosine and @CHEMICAL$ (CPA, @GENE$ agonist) constricted MVs but not MAs.
322	CPR:9	"ZD1839 (""Iressa""), a @CHEM-GENE$ inhibitor selective for the EGFR, has shown good activity in preclinical studies and in the early phase of clinical trials."
323	CPR:3	@CHEMICAL$ plus PM(2.5) exposure, however, induced CRP, IL-6, @GENE$, LDH and MDA increase, SOD and HRV decrease significantly in a dose-response way.
324	CPR:9	In the reverse case, mutation of the orthologous glycine (Gly553) to methionine in @CHEMICAL$ (COT) decreased activity toward its natural substrates, medium- and long-chain acyl-CoAs, and increased activity toward short-chain @GENE$.
325	CPR:3	In addition to this evidence (for the involvement of EP2 receptors), evidence for the involvement of EP1 receptors in the PGE1 mediated stimulation of @CHEMICAL$ subunit gene transcription includes the stimulatory effect of @GENE$, as well as the inhibitory effects of SC-51089.
326	CPR:9	@CHEMICAL$ (PtdSer) is made in mammalian cells by two PtdSer synthases, @GENE$ and PSS2.
327	CPR:9	PURPOSE: The @CHEMICAL$ (capecitabine) is converted to 5-fluorouracil (5-FU) by @GENE$ (TP) inside target tissues. 5-FU interferes with DNA synthesis by blocking thymidylate synthase (TS) but is inactivated by dihydropyrimidine dehydrogenase (DPD).
328	CPR:6	In another experiment, @CHEMICAL$, an antagonist of the @GENE$, also prolonged the clearance of 5-HT from the CA3 region.
329	CPR:5	These results indicate that, similar to the sulfonylureas, mitiglinide is highly specific to the Kir6.2/SUR1 complex, i.e., the pancreatic beta-cell @CHEMICAL$, and suggest that @GENE$ may be a clinically useful anti-diabetic drug.
330	CPR:6	Brain but not spinal NR2B receptor is responsible for the anti-allodynic effect of an @CHEMICAL$ subunit-selective antagonist @GENE$ in a rat chronic constriction injury model.
331	CPR:9	Purified PAOh1/@CHEMICAL$ oxidizes both @GENE$ (K(m)=1.6 microM) and N(1)-acetylspermine (K(m)=51 microM), but does not oxidize spermidine.
332	CPR:3	@CHEMICAL$ also caused the phosphorylation of JNK and p38(@GENE$).
