1811	CPR:4	This observation suggests that @CHEMICAL$-induced reductions in @GENE$ density do not represent neuroadaptive responses to decreased levels of brain serotonin, but may occur in response to some other stimulus or to the neurotoxic effects of MDMA.
1812	CPR:4	Discovery and optimization of @CHEMICAL$ as inhibitors of methionine aminopeptidase-2: a structural basis for the reduction of @GENE$ binding.
1813	CPR:4	Increased immunohistochemical labeling of @CHEMICAL$, VEGF, and BNP in the ventricular myocardium was observed in the shunt group and @GENE$ again normalized the labeling.
1814	CPR:3	@CHEMICAL$ efficiently activated PXR and induced @GENE$ target gene expression in vitro and in vivo.
1815	CPR:4	@CHEMICAL$, a second ACS4 inhibitor, inhibited @GENE$ activity <10% in microsomes and mitochondria and 45% in MAM.
1816	CPR:3	Chronic consumption of @CHEMICAL$ also stimulated abrupt increases in pro-inflammatory cytokines such as nuclear factor (NF)-kB, tumor necrosis factor (TNF)-a and @GENE$ in liver otherwise co-administration of CNF effectively suppressed production of these cytokines dose-dependently.
1817	CPR:9	Several active analogues were also evaluated for their ability to block uptake of DA, @CHEMICAL$, and NE and inhibit binding of [(125)I] RTI-55 at HEK-hDAT, HEK-@GENE$, and HEK-hNET cells.
1818	CPR:4	In contrast, @CHEMICAL$, which is a competitive inhibitor with respect to ascorbate, exhibits a low degree of stereospecificity in binding to the ascorbate sites of both PAM and @GENE$.
1819	CPR:4	A series of phenolic acids and phenol natural products, such as p-hydroxybenzoic acid, p-coumaric acid, caffeic acid, ferulic acid, @CHEMICAL$, syringic acid, quercetin, and ellagic acid, were investigated for their inhibitory effects against the @GENE$ carbonic anhydrase (CA, EC 4.2.1.1).
1820	CPR:4	@CHEMICAL$ treatment showed a significant decline in the levels of blood glucose, glycosylated hemoglobin (HbA1c), @GENE$ p65 unit (in pancreas) and IL-1b (plasma), serum nitric oxide (NO) with an elevation in plasma insulin.
1821	CPR:3	Similarly, pelargonidin induced the expression of CYP1A1 mRNA up to 5-fold in HepG2 and LS174T cells relative to the induction by 5 nM 2,3,7,8-tetrachlorodibenzodioxin (TCDD), the most potent activator of AhR. CYP1A1 and CYP1A2 mRNAs were also increased by @CHEMICAL$ in three primary human hepatocytes cultures (approximately 5% of TCDD potency) and the increase in @GENE$ protein in HepG2 and LS174T cells was comparable to the increase in catalytic activity of CYP1A1 enzyme.
1822	CPR:4	@CHEMICAL$ reduced intima/media ratio in injured arteries, the macrophages infiltration in the neointimal area, monocyte chemoattractant protein-1 (MCP-1) gene expression, and the activation of @GENE$ in rabbit atheroma.
1823	CPR:3	Ginsenosides Rb2, Rd and Rg1 significantly decreased @CHEMICAL$ and/or epinephrine-induced increase of @GENE$ level in macrophage cell line (RAW 264.7).
1824	CPR:5	@CHEMICAL$ was previously identified in mammalian brain and was shown to be a co-agonist at the 'glycine' site of the @GENE$.
1825	CPR:9	Cytochrome P450 epoxygenase 2J2 (@CHEMICAL$) metabolizes @GENE$ to form epoxyeicosatrienoic acids (EETs), which possess various beneficial effects on the cardiovascular system.
1826	CPR:4	Moreover, LTD4-induced increases in CysLT(1)R and @CHEMICAL$ p65 in the brain were also attenuated by @GENE$.
1827	CPR:6	@CHEMICAL$, a leukotriene receptor antagonist, inhibits interleukin-5 production via a mechanism distinct from @GENE$ antagonism.
1828	CPR:4	In activated microglia, @CHEMICAL$ suppressed @GENE$ activity, iNOS mRNA, and protein levels.
1829	CPR:4	@CHEMICAL$ (VP-16) is a @GENE$ (topo II) inhibitor chemotherapeutic agent.
1830	CPR:4	@CHEMICAL$ block of recombinant @GENE$: selectivity for the NR2B subunit.
1831	CPR:4	@CHEMICAL$ inhibits the accumulation of HIF-1alpha, the regulatory subunit of @GENE$, and the transcriptional activation of HIF-1alpha via a mechanism that is not dependent on either NO or soluble guanylate cyclase.
1832	CPR:3	DRF 2655 showed body-weight lowering and euglycemic and hypolipidemic effects in various animal models. db/db mice treated with @CHEMICAL$ showed 5- and 3.6-fold inhibition in phosphoenolpyruvate carboxykinase and glucose 6-phosphatase activity and 651% and 77% increases in the beta-oxidation enzymes @GENE$ and carnitine acetyltransferase, respectively.
1833	CPR:9	@CHEMICAL$ (SSAT) is a key enzyme in the control of polyamine levels in human cells, as acetylation of @GENE$ and spermine triggers export or degradation.
1834	CPR:9	Aldose reductase (@CHEMICAL$) catalyzes the reduction of toxic lipid @GENE$ to their alcohol products and mediates inflammatory signals triggered by lipopolysaccharide (LPS).
1835	CPR:4	"DBS was measured by using the pH-stat method and by using CO2-sensitive electrodes. 5-(N,N-dimethyl)-amiloride (50 microM; @CHEMICAL$), a concentration that selectively inhibits the NHE isoforms NHE1 and NHE2, but not @GENE$, did not affect DBS."
1836	CPR:9	Uptake of the radiolabeled model substrates estradiol 17b-glucuronide, estrone 3-sulfate, and @CHEMICAL$ (DHEAS) was determined in the absence and presence of compounds 1-6 using Chinese hamster ovary (CHO) cells stably expressing either @GENE$ or OATP1B3.
1837	CPR:4	However, combination of rasagiline (10 mg x kg(-1) i.p.) with L-DOPA or L-tryptophan (50 mg x kg(-1) i.p.), or rasagiline (10 mg x kg(-1) p.o.) with fluoxetine (10 mg x kg(-1) p.o.), did not induce the behavioural hyperactivity syndrome which is seen following inhibition of both @CHEMICAL$ and MAO-B by tranylcypromine together with the @GENE$ precursors.
1838	CPR:4	Additionally, the expression of hepatic fibrosis-related factors such as a-smooth muscle actin and @CHEMICAL$ (TGF-b1), were reduced in rats treated with @GENE$.
1839	CPR:4	A series of phenolic acids and phenol natural products, such as p-hydroxybenzoic acid, p-coumaric acid, caffeic acid, ferulic acid, gallic acid, syringic acid, quercetin, and @CHEMICAL$, were investigated for their inhibitory effects against the metalloenzyme carbonic anhydrase (CA, @GENE$).
1840	CPR:3	Furthermore, substance P (@CHEMICAL$) concentration in the acini and expression of SP gene (preprotachykinin-A, PPT-A) and neurokinin-1 receptor (NK-1R), the primary receptor for SP, are increased in secretagogue @GENE$-treated acinar cells.
1841	CPR:4	These results suggested that @CHEMICAL$ could inhibit invasion and angiogenesis by downregulation of VEGFand MMP-9, resulting from the inhibition of @GENE$ pathway.
1842	CPR:4	The studies with dThyd rescue from cyclin E-cdk2 protein overexpression and growth inhibition by @CHEMICAL$ indicate that increased cyclin E-cdk2 protein expression is associated with effective inhibition of @GENE$ and resultant dNTP pool imbalance.
1843	CPR:5	METHODS: Part A compared the effects of placebo to four doses of a @CHEMICAL$ receptor antagonist (SB-207266) on the @GENE$ mediated increase in plasma aldosterone (a 5-HT(4) mediated response) and orocaecal transit in 18 subjects.
1844	CPR:3	Also, @CHEMICAL$ enhances the phosphorylation of Ras homologous protein A, the accumulation of reactive oxygen species, the release of intracellular Ca(2+), as well as the activation of apoptosis signal-regulating kinase 1, c-jun-N-terminal kinase, p38, inhibitor of kappaBa (@GENE$) kinase, and inositol requiring enzyme 1a.
1845	CPR:5	Lisuride dose dependently decreased body temperature in rats with a potency similar to that of the selective @CHEMICAL$ agonist @GENE$.
1846	CPR:4	@CHEMICAL$ inhibited the @GENE$ activity of both C-RAF and B-RAF (wild type and V600E mutant).
1847	CPR:9	Here, we demonstrate that peptidyl-prolyl cis/trans-isomerase A1 (@CHEMICAL$), an enzyme that catalyzes the conversion of the peptide bond of @GENE$/pThr-Pro moieties in signaling proteins from cis to trans, is highly susceptible to HNE modification.
1848	CPR:4	The mechanism of action of @CHEMICAL$ was related to the inhibition of the cleavage of pro-caspase-1, pro-IL-1b and pro-IL-18 which in turn suppressed the activation of @GENE$ inflammasome.
1849	CPR:4	Further, activated microglia-mediated apoptosis of PC-12 pheochromocytoma cells was significantly repressed by neoechinulin A. The molecular mechanism studies suggested that @CHEMICAL$ may block the phosphorylation of @GENE$ (MAPK) molecule p38, apoptosis signal-regulating kinase 1 (ASK-1) and nuclear translocation of nuclear factor-kB (NF-kB) p65 and p50 subunits.
1850	CPR:4	ATB-429-induced antinociception was reversed by @CHEMICAL$, a @GENE$ inhibitor.
1851	CPR:6	@CHEMICAL$, a potent @GENE$ antagonist: effect in allergic rhinoconjunctivitis, on antigen and histamine induced skin weal responses and relationship to serum levels.
1852	CPR:4	@CHEMICAL$ effects on osteoblast viability, oleic acid uptake, alkaline phosphatase and osteocalcin production are independent of their effects on @GENE$.
1853	CPR:4	@CHEMICAL$, an @GENE$ inhibitor, delays the absorption of carbohydrate from the small intestine, thereby reducing postprandial hyperglycemia.
1854	CPR:3	Type I deiodinase, liver fatty-acid binding protein and @CHEMICAL$ mRNA levels were significantly induced by @GENE$, while TDCPP induced CYP3A37 and CYP2H1.
1855	CPR:4	Likewise, IL-2 steady-state mRNA expression was inhibited by both @CHEMICAL$ inhibitors in a concentration-dependent fashion with > 90% inhibition at 1 microM @GENE$ and 20 microM AACOCF3.
1856	CPR:4	Block of human NaV1.5 @CHEMICAL$ by novel alpha-hydroxyphenylamide analogues of @GENE$.
1857	CPR:4	Suppression of Src/@CHEMICAL$ and GSK-3/b-catenin signaling by @GENE$ inhibits the growth of human colorectal cancer cells.
1858	CPR:4	Effects of some mono- and bisquaternary ammonium compounds on the reactivatability of @CHEMICAL$-inhibited @GENE$ in vitro. Acetylcholinesterase (AChE) inhibited by the organophosphate soman (1,2,2-trimethyl-propylmethylphosphonofluoridate) rapidly becomes resistant to reactivation by oximes due to dealkylation of the soman-enzyme complex.
1859	CPR:4	This study provided the evidence that the @CHEMICAL$ inhibit stimulated cerebral @GENE$ at multiple levels and are effective at very low doses, offering great potential for therapeutic use.
1860	CPR:4	@CHEMICAL$ (AMD3100, Genzyme Corporation) is a bicyclam molecule that antagonizes the binding of the chemokine stromal cell-derived factor-1 (SDF-1) to its cognate receptor @GENE$.
1861	CPR:6	In contrast, intrathecal injection of a non-selective @CHEMICAL$ antagonist, @GENE$, significantly inhibited CCI-induced mechanical allodynia at a dose of 300 nmol, indicating the difference in the site of action between the non-selective NMDA antagonist and the NR2B-specific NMDA antagonist.
1862	CPR:4	While none of the phenethylamides (n = 2) were active, most of the @CHEMICAL$ (n = 0) turned out to moderately or strongly inhibit @GENE$.
1863	CPR:4	@CHEMICAL$ as Selective @GENE$ Inhibitors.
1864	CPR:3	Although Bak and Bcl-2-associated X protein (Bax), another member of the Bcl-2 family, are generally thought to be functionally redundant, only Bak is necessary and sufficient for @CHEMICAL$-induced @GENE$ (cyt c) release and cell death.
1865	CPR:3	Similarly, pelargonidin induced the expression of CYP1A1 mRNA up to 5-fold in HepG2 and LS174T cells relative to the induction by 5 nM 2,3,7,8-tetrachlorodibenzodioxin (TCDD), the most potent activator of AhR. @CHEMICAL$ and CYP1A2 mRNAs were also increased by pelargonidin in three primary human hepatocytes cultures (approximately 5% of @GENE$ potency) and the increase in CYP1A1 protein in HepG2 and LS174T cells was comparable to the increase in catalytic activity of CYP1A1 enzyme.
1866	CPR:3	Weekly subcutaneous @CHEMICAL$ produces cumulative increases in @GENE$ and total hemoglobin through a noncytotoxic mechanism of action.
1867	CPR:3	Moreover, @CHEMICAL$-induced increases in CysLT(1)R and @GENE$ p65 in the brain were also attenuated by pranlukast.
1868	CPR:9	Depletion of putrescine, @CHEMICAL$, and spermine by DL-alpha-difluoromethylornithine (DFMO), a specific inhibitor of @GENE$ (ODC) that is the first rate-limiting enzyme for polyamine biosynthesis, decreased the apoptotic index.
1869	CPR:4	PURPOSE: Dasatinib (@CHEMICAL$), a potent oral multi-targeted kinase inhibitor against SRC and @GENE$-ABL, has recently been approved for the treatment of chronic myelogenous leukaemia (CML) in imatinib-acquired resistance and intolerance.
1870	CPR:4	New classes of pyrrole-derived nitrooxyalkyl inverse esters, carbonates, and @CHEMICAL$ (7-10) as @GENE$ selective inhibitors and NO donors were synthesized and are herein reported.
1871	CPR:4	All GABA(A)R modulators induced a negative shift in the steady-state inactivation curve of Ca(v)1.3 channels, but only @CHEMICAL$ and pentobarbital induced a negative shift in @GENE$ channel inactivation.
1872	CPR:9	In contrast, there was little change in mRNA levels for @CHEMICAL$ (GTPCH), the rate limiting enzyme in synthesis of the tetrahydrobiopterin (@GENE$), the obligate cofactor for TPH.
1873	CPR:9	We investigated the effects of the dose of and the number of times an inducer was administered and the duration of induction of hepatic and intestinal cytochrome P450 3A (CYP3A) in rats using dexamethasone 21-phosphate (@CHEMICAL$) and midazolam (MDZ) as an inducer and a substrate to @GENE$, respectively. 2.
1874	CPR:4	"The antipsychotic drugs sertindole and @CHEMICAL$ are known to prolong the QT interval on the electrocardiogram via a high affinity block of the cardiac K(+) channel known as HERG (@GENE$; erg1)."
1875	CPR:3	Further, 5HHMF increased specific DNA-binding activity of @CHEMICAL$, and transient knockdown with Nrf2 siRNA subsequently reversed @GENE$-induced NO inhibition, which was followed by suppression of HO-1 activity.
1876	CPR:5	Moreover, in rat hepatoma H4-II-E cells, the esterified-@CHEMICAL$ failed to induce tyrosine aminotransferase, which is regulated by @GENE$-mediated transactivation activity.
1877	CPR:4	Administration of a concentration (100 microM) of @CHEMICAL$ that blocks PDE8 inhibited ecto-@GENE$ activity (by 44%).
1878	CPR:9	@CHEMICAL$ derivatives were not oxidized to products serving as substrates for @GENE$ and,depending on the substituent, were competitive inhibitors of phenylalanine hydroxylase: N(5)-methyl- and N(5)-hydroxymethyl H(4)biopterin inhibited phenylalanine hydroxylase, whereas N(5)-formyl- and N(5)-acetyl H(4)biopterin had no effect.
1879	CPR:4	@CHEMICAL$ 28 showed dose responsive target engagement and provides a useful tool to explore a @GENE$ inhibitor for the treatment of inflammatory diseases, such as asthma and inflammatory bowel disease (IBD).
1880	CPR:3	These results suggest that @CHEMICAL$ increases Ab peptide burden via activation of @GENE$, which further affects APP levels and activity of b- and g-secretases via the NF-kB pathway.
1881	CPR:5	Eight normal males received single oral doses of BRL35135 8 mg (BRL) or the selective @CHEMICAL$ agonist @GENE$ 8 mg (SAL), after pretreatment with either placebo (PL), bisoprolol 5 mg (B5) as a selective beta 1-adrenoceptor antagonist, or nadolol 20 mg (N20) to block beta 1- and beta 2- but not beta 3-receptors.
1882	CPR:4	In this study, we demonstrate significant inhibitory activity of @CHEMICAL$ against both wild-type @GENE$ and the KITD816V mutation in the nanomolar range in in vitro and cell-based kinase assays.
1883	CPR:4	"In this report, we evaluated the growth-inhibitory effects of @CHEMICAL$, a @GENE$ and COX-2 inhibitor; exisulind (sulindac sulfone), a novel proapoptotic agent that does not inhibit COX enzymes; and nordihydroguaiaretic acid (NDGA), a lipoxygenase inhibitor on human lung cancer cell lines."
1884	CPR:3	@CHEMICAL$-induced ENaC and basal @GENE$ trafficking via protein kinase D1-phosphatidylinositol 4-kinaseIIIb trans Golgi signalling in M1 cortical collecting duct cells.
1885	CPR:4	@CHEMICAL$ reduced the expression of pro-inflammatory mediates, such as monocyte chemotactic protein-1 (MCP-1), tumor necrosis factor-a (TNF-a), inducible NO synthase (iNOS), and @GENE$ (RAGE).
1886	CPR:6	@CHEMICAL$ (10 microM), another @GENE$ antagonist without significant 5-HT receptor binding affinity, did not produce any inhibition of the eNANC contraction.
1887	CPR:9	@CHEMICAL$ reduce hydroperoxides to the corresponding @GENE$ by means of glutathione (GSH).
1888	CPR:9	When cultured in liquid minimal medium, yeast cells expressing the mutated @CHEMICAL$ were found to accumulate intracellular @GENE$ and showed a prominent increase in cell viability after freezing at -20 degrees C compared to the viability of cells harboring the wild-type PRO1 gene.
1889	CPR:4	Our recent study has demonstrated that coadministration of monoamine oxidase A (@CHEMICAL$) inhibitor @GENE$ (5 mg/kg) increases systemic exposure to 5-MeO-DMT (2 mg/kg) and active metabolite bufotenine.
1890	CPR:4	Treatment with @CHEMICAL$ reversed both protein and mRNA of HIF-1alpha, VEGF, @GENE$, and NGF-beta to the baseline values.
1891	CPR:3	Recently, it has been shown that the activation of particular @CHEMICAL$ bitter taste receptors is partially involved with the bitter aftertaste sensation of @GENE$ and acesulfame-K. To more fully understand the biology behind these phenomena we have addressed the question of whether AS could stimulate transient receptor potential vanilloid-1 (TRPV1) receptors, as these receptors are activated by a large range of structurally different chemicals.
1892	CPR:4	Although both intracellular and membrane @CHEMICAL$ pools were markedly reduced in cells released from contact inhibition by @GENE$, siRNA-mediated Cx43 knock-down was not sufficient to stimulate proliferation in contact-inhibited cells.
1893	CPR:9	Hydrogen sulphide (H(2)S) is synthesized from @CHEMICAL$ via the action of cystathionine-gamma-lyase (@GENE$) and cystathionine-beta-synthase (CBS).
1894	CPR:4	Inhibition studies demonstrated that the @CHEMICAL$ group on the phenylacetic acid ring is required for @GENE$ selectivity.
1895	CPR:4	Troglitazone inhibited LTB(4) production by the supernatant fraction of RBL-2H3 cell lysate with similar potency to @CHEMICAL$, suggesting that troglitazone inhibits LT production by direct inhibition of @GENE$ activity. 4.
1896	CPR:3	@CHEMICAL$ treatment also increased phosphorylation of @GENE$ and ERK, but not p38, and apoptosis induced by fluoride was notably or partly suppressed by treatment with JNK or ERK inhibitors, respectively.
1897	CPR:4	@CHEMICAL$ (DXM) decreased the expression of @GENE$, VEGF, and iNOS induced by reIL-4, while 1400W dihydrochloride (1400W), a selective inhibitor of iNOS, decreased the expression of E-selectin, VEGF, and iNOS.
1898	CPR:3	At PND35, the medial prefrontal cortex (mPFC) of rats given @CHEMICAL$ showed 55% greater immunoreactivity (-ir) for the catecholamine marker @GENE$ (TH), 60% more Nissl-stained cells, and 40% less norepinephrine transporter (NET)-ir density.
1899	CPR:4	@CHEMICAL$ is the first example of a marketed @GENE$ inhibitor of the arylacetic acid class, and it is reported to be the most selective COXIB in vivo.
1900	CPR:4	CONCLUSION: Oral @CHEMICAL$ is effective in suppressing the gain of function in @GENE$ responsible for some cases of short QT syndrome with a mutation in HERG and thus restoring normal rate dependence of the QT interval and rendering ventricular tachycardia/ventricular fibrillation noninducible.
1901	CPR:5	RESULTS: In drug discrimination studies, lisuride fully mimicked the @CHEMICAL$ agonist @GENE$, only partially substituted for LSD and DOI, and failed to substitute for (+)-amphetamine. Lisuride produced a significant dose-related increase in flat body posture, forepaw treading, and lower-lip retraction which reflect a modulation of behavior by action at central 5-HT(1A) receptors.
1902	CPR:4	Different mechanisms of acquired resistance to fluorinated pyrimidines in human colorectal cancer cells. 5-Fluorouracil (5-FU), 5-fluoro-2'-deoxyuridine (@CHEMICAL$) and 5-trifluorothymidine (F3(d)Thd) are antimetabolites which are metabolized to their corresponding active forms which inhibit DNA synthesis via inhibition of thymidylate synthase (@GENE$).
1903	CPR:4	@CHEMICAL$ (adrenaline, noradrenaline and dopamine) are potent inhibitors of @GENE$ (phenylalanine hydroxylase, EC 1.14.16.1).
1904	CPR:4	@CHEMICAL$ was also found to attenuate the activation of proteins involved in focal adhesion kinase (FAK)/c-Src/extracellular signal-regulated kinase (ERK) signaling, and phosphoinositide 3-kinase (PI3K)/Akt/ @GENE$ (GSK-3b) signaling pathway.
1905	CPR:3	Moreover, BH(4) treatment of the fructose-fed rats markedly reduced the lipid peroxide content of both aortic and cardiac tissues and inhibited the activation of 2 redox-sensitive transcription factors, @CHEMICAL$ and activating protein-1, which were increased in @GENE$-fed rats.
1906	CPR:3	Both @CHEMICAL$ and SAL produced a significant increase in postural finger tremor in keeping with @GENE$ stimulation, and this response was totally abolished by pretreatment with N20.
1907	CPR:4	A significant decrease in @CHEMICAL$ expression was observed in the AP and fractionated @GENE$-treated cells in the presence of ovalbumin (OVA), but no effect on CD86 expression was observed.
1908	CPR:4	These protective effects were abolished by glucocorticoid receptor (GR) antagonist RU486 or @CHEMICAL$ inhibitor @GENE$ rather than estrogen receptor a antagonist ICI 82,780.
1909	CPR:4	Effective treatment requires drugs that can simultaneously protect by reversible binding to the acetylcholinesterase (AChE) and blocking cascades of seizure related brain damage, inflammation, neuronal degeneration as well as promoting induction of neuroregeneration. [-]-Huperzine A (@CHEMICAL$), is a naturally occurring potent reversible @GENE$ inhibitor that penetrates the blood-brain barrier.
1910	CPR:4	@CHEMICAL$ inhibited the proliferation of HCT 116 cells by arresting transition of cell cycle from G1 to S phase along with the downregulation of cyclin D1, cyclin E, @GENE$, cyclin dependent kinase 2 (CDK2), CDK4, c-Myc, and retinoblastoma protein (pRb), and the upregulation of p21(WAF1/CIP1) and p53.
1911	CPR:4	Different mechanisms of acquired resistance to fluorinated pyrimidines in human colorectal cancer cells. 5-Fluorouracil (5-FU), @CHEMICAL$ (FdUrd) and 5-trifluorothymidine (F3(d)Thd) are antimetabolites which are metabolized to their corresponding active forms which inhibit DNA synthesis via inhibition of thymidylate synthase (@GENE$).
1912	CPR:4	Synthesis and Structure-Activity Relationship Studies of Derivatives of the Dual Aromatase-Sulfatase Inhibitor 4-{[(4-Cyanophenyl)(4H-1,2,4-triazol-4-yl)amino]methyl}phenyl sulfamate. @CHEMICAL$ and its ortho-halogenated (F, Cl, Br) derivatives are first-generation dual @GENE$ and sulfatase inhibitors (DASIs).
1913	CPR:6	In the rabbit pulmonary artery, rilmenidine and @CHEMICAL$ are potent full agonists, whereas in the human atrial appendages they are antagonists at the @GENE$, sharing this property with rauwolscine, phentolamine, and idazoxan.
1914	CPR:9	From these data, it is inferred that both the SERT and @CHEMICAL$ contribute to the active clearance of exogenously applied @GENE$ in the dentate gyrus.
1915	CPR:6	In contrast, the selective @CHEMICAL$ antagonists @GENE$ and butoxamine inhibited isoproterenol-mediated enhancement with apparent low affinities (K(b) of 222 +/- 61 and 9268 +/- 512 nM, respectively).
1916	CPR:4	@CHEMICAL$ also partially depressed predominantly @GENE$-mediated EPSCs, but with lower efficacy.
1917	CPR:3	In unstimulated cells, Nor-NOHA dose-dependently reduced the arginase activity with maximal inhibition at 20 microM. When HUVECs were stimulated by thrombin without extracellular L-arginine, Nor-NOHA dose-dependently increased the NOS activity and the NO release with maximal effects at 20 microM. Extracellular @CHEMICAL$ also dose-dependently increased NO release and @GENE$ activity.
1918	CPR:9	"N-Acetylglucosamine-1-phosphodiester alpha-N-Acetylglucosaminidase (@CHEMICAL$; phosphodiester alpha-GlcNAcase) catalyzes the second step in the synthesis of the @GENE$ determinant required for efficient intracellular targeting of newly synthesized lysosomal hydrolases to the lysosome."
1919	CPR:4	First, in the presence of 1 mm ATP or the nonhydrolyzable analog adenosine 5'-(beta,gamma-imino)triphosphate, TOP2-mediated DNA cleavage induced by ATP-sensitive @CHEMICAL$ poisons (e.g. doxorubicin, @GENE$, mitoxantrone, and 4'-(9-acridinylamino)methanesulfon-m-anisidide) was 30-100-fold stimulated, whereas DNA cleavage induced by ATP-insensitive TOP2 poisons (e.g. amonafide, batracylin, and menadione) was only slightly (less than 3-fold) affected.
1920	CPR:5	In further studies, the diuretic effects of the CB1 agonist AM4054 were similar in male and female rats, displayed a relatively rapid onset to action, and were dose-dependently antagonized by 30 minutes pretreatment with rimonabant, but not by the vanilloid receptor type I antagonist capsazepine, nor were the effects of @CHEMICAL$ antagonized by the @GENE$ antagonist AM630 [(6-iodo-2-methyl-1-[2-(4-morpholinyl)ethyl]-1H-indol-3-yl](4-methoxyphenyl) methanone)].
1921	CPR:3	To determine whether H(2)S itself provoked inflammation in acinar cells, the cells were treated with H(2)S donor drug, sodium hydrosulphide (@CHEMICAL$), (10, 50 and 100 muM), that resulted in a significant increase in SP concentration and expression of @GENE$ and NK1-R in acinar cells.
1922	CPR:9	We investigated the effects of the dose of and the number of times an inducer was administered and the duration of induction of hepatic and intestinal cytochrome P450 3A (CYP3A) in rats using @CHEMICAL$ (DEX-P) and midazolam (MDZ) as an inducer and a substrate to @GENE$, respectively. 2.
