852	CPRFalse	DISCUSSION: These results are consistent with previous studies that found that: (1) @CHEMICAL$ had a very low activity in children with autism and (2) @GENE$ (PLP) levels are unusually low in children with autism.
853	CPRFalse	Calmodulin-dependent cyclic nucleotide phosphodiesterase (@CHEMICAL$) is one of the key enzymes involved in the complex interaction between the cyclic nucleotide and @GENE$ second-messenger systems.
854	CPRFalse	In the present study, we measured the enzyme activity of thymidine kinase (TK), thymidine phosphorylase (TP) and @CHEMICAL$ synthase (@GENE$) in human cancer xenografts to investigate the contribution of these enzymes to the sensitivity of TAS-102.
855	CPRFalse	Opioid receptors are the membrane proteins that mediate the pain-relieving effect of opioid drugs, such as morphine and fentanyl as well as endogenous opioid peptides @CHEMICAL$ and @GENE$.
856	CPRFalse	Sitagliptin, an oral dipeptidyl peptidase-4 (DPP-4) inhibitor, improves glycaemic control by inhibiting DPP-4 inactivation of the incretin hormones glucagon-like peptide-1 and @CHEM-GENE$.
857	CPRFalse	Anti-diabetic Activity of @CHEMICAL$ is due to an Active Metabolite, Gentianine, that Upregulates @GENE$ Gene Expression in 3T3-L1 cells.
858	CPRFalse	The modulating effect of peroxisome proliferator-activated receptor a ligand on haemodynamic effects of phenylepherine (PE), angiotensin II (AII), @CHEMICAL$ (ET1), acetylcholine (Ach), @GENE$ (SNP) and isoproterenol (ISO) were evaluated in glycerol-induced acute kidney injury in rats.
859	CPRFalse	The effect of manganese on @CHEMICAL$ toxicity and dopamine transporter (@GENE$) in control and DAT transfected HEK cells.
860	CPRFalse	Fasting plasma @CHEMICAL$ (FPG), fasting plasma insulin, C-peptide (@GENE$ secretory rate [ISR]), fasting plasma glucagon, and bioactive glucagon-like peptide (GLP-1) and gastrointestinal insulinotropic peptide (GIP) was measured.
861	CPRFalse	"In DM groups, @CHEMICAL$ activity, ALDH2 mRNA and protein levels were reduced, @GENE$ content was increased compared with control group; which decreased further as diabetes progressed."
862	CPRFalse	BDZs and other positive @CHEMICAL$ modulators, including barbiturates, ethanol, and neurosteroids, can also inhibit L-type voltage-gated @GENE$ channels (L-VGCCs), which could contribute to reduced neuronal excitability.
863	CPRFalse	The animal's liver was assessed using biomarkers as activities of @CHEMICAL$ dismutase (@GENE$), catalase (CAT), glutathione S-transferase (GST), and glutathione peroxidase (GPx), and concentrations of reduced glutathione (GSH) and lipoperoxidation (LPO) and protein carbonylation (PCO).
864	CPR:4	Pretreatment with @CHEMICAL$ significantly suppressed nasal allergy-like behaviors, up-regulation of histamine content, HDC activity and @GENE$ mRNA induced by TDI in TDI-sensitized rats.
865	CPRFalse	We show that cytosolic aspartate aminotransferase (@CHEMICAL$) is involved in adipocyte glyceroneogenesis, a regulated pathway that controls @GENE$ homeostasis by promoting glycerol 3-phosphate formation for fatty acid re-esterification during fasting. cAspAT activity, as well as the incorporation of [(14)C]aspartate into the neutral lipid fraction of 3T3-F442A adipocytes was stimulated by the thiazolidinedione (TZD) rosiglitazone.
866	CPRFalse	Phosphorylation of ER-stress marker eIF2a was also increased but only at 30 min of @CHEMICAL$ exposure. 2-Deoxyglucose increased phosphorylation of tuberous sclerosis complex 2 (TSC2) on AMPK consensus sites but did not change the amount of TSC1 bound to @GENE$.
867	CPR:4	Comparison of the effect of @CHEMICAL$ (a @GENE$ inhibitor), ibuprofen, and placebo on the gastroduodenal mucosa of patients with osteoarthritis: a randomized, double-blind, placebo-controlled trial.
868	CPRFalse	Patch-clamp analysis using inside-out recording configuration showed that @CHEMICAL$ inhibits the Kir6.2/SUR1 channel currents in a dose-dependent manner (IC50 value, 100 nM) but does not significantly inhibit either Kir6.2/@GENE$ or Kir6.2/SUR2B channel currents even at high doses (more than 10 microM).
869	CPRFalse	Pretreatment with tropisetron (1 microM), a 5-HT3 antagonist, ketanserin (10 microM), a @CHEMICAL$ antagonist, @GENE$ (10 microM), a histamine H3 antagonist, or phentolamine (10 microM), an alpha-adrenergic antagonist, however, had no effect.
870	CPRFalse	We investigated the involvement of the @CHEMICAL$ (FXR), a nuclear receptor for bile acids, in the chenodeoxycholic acid (@GENE$)-induced expression of Cdx2 and MUC2 in normal rat gastric epithelial cells (RGM-1 cells).
871	CPR:9	These data suggest that endothelial @CHEMICAL$ synthesis depends on the activity of @GENE$ in mitochondria and l-arginine carriers in cell membrane.
872	CPRFalse	Reduced synthesis of nitric oxide (NO) contributes to the endothelial dysfunction and may be related to limited availability of L-arginine, the common substrate of constitutive @CHEMICAL$ synthase (NOS) and cytosolic arginase I and @GENE$.
873	CPRFalse	AdSS from the thermophilic archaea, Methanocaldococcus jannaschii (MjAdSS) is 345 @CHEMICAL$ long against an average length of 430-457 amino acids for most mesophilic @GENE$.
874	CPRFalse	@CHEMICAL$ protects human dental pulp cells from hydrogen peroxide-induced oxidative toxicity via Nrf2 pathway-dependent @GENE$ expressions.
875	CPRFalse	To address this issue and taking into account that effects of synthetic progestins are not only referable to action through the progesterone receptor but may also be mediated by other @CHEM-GENE$, we characterized cardiovascular function and inflammatory gene expression in aldosterone salt-treated rats on long-term administration of 17beta-estradiol, medroxyprogesterone acetate, and drospirenone, a new progestogen exhibiting antimineralocorticoid activity.
876	CPRFalse	To determine whether these responses were common to other amphetamines of abuse, effects of methylenedioxymethamphetamine (MDMA) on the plasmalemmal DA transporter (DAT) and vesicular @CHEMICAL$ transporter-2 (@GENE$) were assessed.
877	CPRFalse	PURPOSE: To compare phenelzine (PLZ), an antidepressant drug with anxiolytic properties which inhibits monoamine oxidase (MAO) but also elevates rat brain levels of the amino acids ?-aminobutyric acid (GABA) and alanine (ALA), with vigabatrin (VIG), an anticonvulsant which elevates brain GABA by inhibition of GABA transaminase (GABA-T), with regard to their actions on brain levels of GABA and ALA and on activities of MAO, @CHEMICAL$ and @GENE$ transaminase (ALA-T).
878	CPRFalse	Functional and biochemical studies indicated that TES signaling involved activity of the @CHEMICAL$ 3 (PI3) kinase-@GENE$ (Akt) cascade initiated by activation of the androgen receptor and culminated in enhanced production of cGMP and microvascular vasodilation.
879	CPRFalse	Moreover, green tea extract administration significantly increased (p<0.05) the activities of @CHEMICAL$, @GENE$ peroxidase (GSH-Px) and glutathione reductase (GSH-Rd) in the liver.
880	CPRFalse	In the present study, the ability of different concentrations of @CHEMICAL$ to modify @GENE$ (Ang II)-induced vascular responses was examined, with the use of an organ bath system, in endothelium-denuded aortic rings from spontaneously hypertensive rats.
881	CPRFalse	DXM and @CHEMICAL$ attenuated the mRNA expression of E-selectin and iNOS induced by the costimulation of reIL-4, @GENE$, and LPS.
882	CPRFalse	METHODS: In 304 Caucasian American NTD families with myelomeningocele or anencephaly, we examined 28 polymorphisms in 11 genes: folate receptor 1, folate receptor 2, solute carrier family 19 member 1, transcobalamin II, methylenetetrahydrofolate dehydrogenase 1, @CHEMICAL$, 5,10-methylenetetrahydrofolate reductase (MTHFR), 5-methyltetrahydrofolate-homo-cysteine methyltransferase, 5-methyltetrahydrofolate-homocysteine methyltransferase reductase, @GENE$-homocysteine methyltransferase (BHMT), and cystathionine-beta-synthase.
883	CPR:6	"The effects of D-1997 in the basilar artery were not modified by incubation with either the 5-HT2 receptor antagonist ketanserin (0.01-1 microM), the 5-HT3 and 5-HT4 receptor antagonist ICS205930 (tropisetron; 0.1-10 microM), the @CHEMICAL$ receptor antagonist @GENE$ (0.01-1 microM), the beta-adrenoceptor blocker with high affinity for 5-HT1A and 5-HT1B binding sites (+/-)-pindolol (0.01-1 microM), or the alpha 1-adrenoceptor antagonist prazosin (0.01-1 microM)."
884	CPRFalse	DATA SYNTHESIS: Albiglutide is a long-acting GLP-1 RA that lowers glycosylated hemoglobin (@CHEMICAL$) and reduces weight by stimulating @GENE$-dependent insulin secretion, suppressing glucagon secretion, delaying gastric emptying, and promoting satiety.
885	CPRFalse	Functional divergence of a unique @CHEMICAL$-terminal domain of @GENE$ to accommodate its splicing and aminoacylation roles.
886	CPR:9	Transport by OATP1B1 and @CHEMICAL$ enhances the cytotoxicity of epigallocatechin 3-O-gallate and several @GENE$ derivatives.
887	CPRFalse	Effects of 2-amino-1-methyl-6-phenylimidazo [4, 5-b] pyridine (PhIP) on histopathology, oxidative stress, and expression of c-fos, c-jun and @CHEMICAL$ in rat stomachs. 2-Amino-1-methyl-6-phenylimidazo [4, 5-b] pyridine (PhIP) is one of the most abundant @GENE$ (HCAs) generated from overcooking meat at high temperatures.
888	CPR:4	We then showed that static exposure of embryos to @CHEMICAL$ (31.2-500 nM) from 5 to 96 hpf resulted in significant stage- and concentration-dependent @GENE$ inhibition, albeit these effects were fully reversible within 48 h following transfer to clean water.
889	CPRFalse	Biomarkers of systemic inflammation and injuries (CRP, IL-6, LDH, CK), heart oxidative stress (@CHEMICAL$, SOD) and endothelial function (@GENE$, VEGF) were analyzed after the 6th exposure.
890	CPRFalse	Knockdown of @CHEMICAL$ oxidase, NOX5-S, a variant lacking calcium-binding domains, by @GENE$ siRNA significantly inhibited acid-induced increase in mPGES1 expression, thymidine incorporation, and PGE2 production.
891	CPRFalse	In further studies, the diuretic effects of the CB1 agonist AM4054 were similar in male and female rats, displayed a relatively rapid onset to action, and were dose-dependently antagonized by 30 minutes pretreatment with rimonabant, but not by the @CHEMICAL$ antagonist capsazepine, nor were the effects of WIN 55,212 antagonized by the CB2 antagonist @GENE$ [(6-iodo-2-methyl-1-[2-(4-morpholinyl)ethyl]-1H-indol-3-yl](4-methoxyphenyl) methanone)].
892	CPRFalse	To address this issue and taking into account that effects of synthetic @CHEMICAL$ are not only referable to action through the @GENE$ but may also be mediated by other steroid receptors, we characterized cardiovascular function and inflammatory gene expression in aldosterone salt-treated rats on long-term administration of 17beta-estradiol, medroxyprogesterone acetate, and drospirenone, a new progestogen exhibiting antimineralocorticoid activity.
893	CPRFalse	"Hepatic function was assessed by evaluating the following parameters: liver histology; plasma levels of @CHEM-GENE$ (ALT), triglyceride (TG), malondialdehyde (MDA), and reduced glutathione (GSH); expression levels of TNF-a and IL-6; and levels of caspase-3 and pJNK/JNK protein."
894	CPRFalse	The data indicate that bovine @CHEMICAL$ is a 272,000-Da complex of four identical 68,000-Da glycoprotein subunits arranged as two @GENE$-linked homodimers.
895	CPRFalse	"@CHEMICAL$ also inhibited other channels including Cav1.2, Cav3.2, and HCN2; however, the Kv11.1 (@GENE$) channel was minimally affected."
896	CPR:3	@CHEMICAL$ activates @GENE$ and antagonizes the effect of the specific carbonic anhydrase inhibitor acetazolamide, by a direct mechanism of action.
897	CPRFalse	METHODS: Sedative and cardiovascular responses to @CHEMICAL$ and the alpha2-agonist, dexmedetomidine, were determined in mice deficient in @GENE$ subtypes.
898	CPR:4	Nitrogen-containing @CHEMICAL$ (N-BPs) induce apoptosis in tumor cells by inhibiting the prenylation of small @GENE$.
899	CPRFalse	Moreover, use of the pharmacological AMP-activated protein kinase (AMPK) inhibitor @CHEMICAL$ revealed that AMPK is essential for suppressing @GENE$ expression in phillyrin-treated cells.
900	CPRFalse	The increased activities of the most important intestinal efflux (P-glycoprotein - Pgp, Multidrug Resistance Associated Protein 2 - MRP-2, @CHEMICAL$ - BCRP) and uptake (@GENE$ Transporter 1 - MCT1, Organic Anion Transporting Polypeptide - OATP, Peptide transporter 1 - PepT1) transporters were caused by changes in electrophysiological membrane properties and by allosteric modifications.
901	CPRFalse	This study focuses on determining whether treatment of @CHEMICAL$-exposed UGS organ cultures with RSPO2 and/or @GENE$ is capable of rescuing the inhibitory effects of TCDD on canonical Wnt signaling and prostatic bud formation.
902	CPRFalse	Absorption and secretion of fluoride increase at acid pH levels, possibly because of its non-ionized state at these pHs and/or because of participation of a F(-)/H(+) cotransporter or a @CHEM-GENE$.
903	CPRFalse	In addition, ADP was shown to strongly antagonize TOP2-mediated DNA cleavage induced by @CHEMICAL$-sensitive but not ATP-insensitive @GENE$ poisons.
904	CPRFalse	The affinity estimate for @CHEMICAL$ on human prostate was lower than the corresponding binding affinity determined at alpha 1A adrenoceptors and RS 17053 was a very weak antagonist on human prostate (pA2 = 6.0) relative to the high affinity (pKi = 8.6) determined at cloned @GENE$. 5.
905	CPRFalse	Diclofenac-b-d-glucuronide, @CHEMICAL$, ibuprofen-b-d-glucuronide, (R)-naproxen-b-d-glucuronide, and (S)-naproxen-b-d-glucuronide selectively inhibited hCES1, with Ki values of 4.32 + 0.47, 24.8 + 4.2, 355 + 38, 468 + 21, 707 + 64 mM, respectively, but did not significantly inhibit @GENE$.
906	CPRFalse	"Both the non-specific phospholipase A(2) inhibitor, @CHEMICAL$, and an inhibitor of cPLA(2) and @GENE$, AACOF3, counteracted the effect; in contrast, a selective iPLA(2) inhibitor, BEL, and a selective sPLA(2) inhibitor, TAPC, were ineffective."
907	CPRFalse	Autoradiographs of PAGE-separated reactions containing either (125)I-labeled @CHEMICAL$ or @GENE$-labeled factor X showed that the increased factor X activation was not due to factor Xa-mediated feedback activation of factor IX and that there was increased cleavage of factor X heavy chain in the presence of factor IX in comparison with control reactions but only in the presence of both the enzyme and the surface.
908	CPRFalse	Synthesis and in vitro pharmacology at AMPA and kainate preferring glutamate receptors of 4-heteroarylmethylidene glutamate analogues. @CHEMICAL$ (1) is a potent AMPA receptor agonist with moderate affinity for native kainic acid (KA) receptors, whereas (S)-E-4-(2,2-dimethylpropylidene)glutamic acid (3) show high affinity for the GluR5 subtype of KA receptors and much lower affinity for the @GENE$ subtype of AMPA receptors.
909	CPRFalse	Finally, the Pak1(-/-) mice exhibited reduced brainstem gcg level and abolished b-cat @CHEMICAL$675 phosphorylation in brain neurons after insulin treatment. We suggest that Pak1 mediates the cross talk between @GENE$ and Wnt signaling pathways on gut and brain gcg expression, and its ablation impairs glucose homeostasis.
910	CPRFalse	Indomethacin treatment led to an increase in lipid peroxidation, @CHEMICAL$ peroxidase and glucose-6-phosphate dehydrogenase activities and to a decrease in @GENE$ activity and glutathione levels in gastric mucosa.
911	CPR:3	RORalpha ectopic expression activated the @CHEMICAL$ gene transcription in absence of rosiglitazone, and its protein amount in nuclear extracts is 1.8-fold increased by @GENE$ treatment of adipocytes.
912	CPRFalse	Pinosylvin was also found to attenuate the activation of proteins involved in focal adhesion kinase (FAK)/c-Src/extracellular signal-regulated kinase (@CHEMICAL$) signaling, and @GENE$ 3-kinase (PI3K)/Akt/ glycogen synthase kinase 3b (GSK-3b) signaling pathway.
913	CPRFalse	Evidence indicates that nerve gas toxins operate in ways in addition to inhibition of @CHEM-GENE$.
914	CPRFalse	No effects were observed when @CHEMICAL$ was assessed for @GENE$-dependent and P450-independent cytotoxicity to THLE cell lines, time-dependent inhibition of five major human cytochrome P450 enzymes, inhibition of the biliary efflux transporters BSEP and MRP2 or mitochondrial toxicity to THLE or HepG2 cells.
915	CPRFalse	Analysis of splice variants and site-directed mutants of the @CHEMICAL$ receptor GluR3 expressed in Xenopus oocytes has shown that lithium produces a large potentiation of the @GENE$ splice variant and suggested that lithium might inhibit rapid desensitization, which is characteristic of this receptor (Karkanias, N. and Papke, R., Subtype-specific effects of lithium on glutamate receptor function.
916	CPRFalse	RS 17053 showed high affinity and selectivity for alpha 1A adrenoceptors (pKi 8.6) relative to alpha 1B (pKi = 7.3) and @CHEMICAL$ (pKi = 7.1) subtypes. 3. (+)-Tamsulosin, @GENE$, SL 89,0591, Rec 15/2739, SNAP 1069 and RS 17053 appeared to act as competitive antagonists of noradrenaline-mediated contractions of rat aorta yielding pA2 affinity estimates which were similar to binding affinities at cloned human alpha 1D adrenoceptors.
917	CPRFalse	Norethisterone metabolites modulate the @CHEMICAL$ and @GENE$ receptor gene expression in prepubertal rabbits.
918	CPR:4	The activity of CYP3A in excised liver samples from rats following multiple baicalin treatment was significantly decreased compared to that of the control group (P<0.05), whereas multiple doses of baicalin had no obvious effect on the activity of CYP2D. Taken together, these data demonstrate that @CHEMICAL$ inhibits the metabolism of DXM in a concentration-dependent manner in rats, possibly through inhibiting hepatic @GENE$ and CYP3A activities.
919	CPRFalse	Mutation of @CHEMICAL$-530 to Ala or @GENE$ abolished the potent inhibition observed with wild-type human COX-2 and key lumiracoxib analogs.
920	CPRFalse	"On days 0 and 35, patients' nutritional status was assessed by BMI, normalized protein catabolic rate, predialytic creatinine, serum albumin and transthyretin; lipid metabolism by plasma LDL- and HDL-@CHEMICAL$, triacylglycerols, phospholipids, apo A-I, A-II, B, C-II, C-III, E and lipoprotein (a); oxidative status by alpha-tocopherol, retinol, selenium, glutathione peroxidase, malondialdehyde and advanced oxidized protein products; inflammatory status by serum C-reactive protein, @GENE$, IL-2 and IL-6."
921	CPR:9	Phenytoin (diphenylhydantoin, DPH) is an established @CHEM-GENE$ blocker and is a useful anticonvulsant and class 1b antiarrhythmic, and has been effectively used in the treatment of neuropathic pain.
922	CPRFalse	A variety of pharmacological agents have been used to inhibit @CHEMICAL$, and this inhibition occurs mostly via @GENE$-dependent association with the proteins.
923	CPRFalse	The binding of @CHEMICAL$ to @GENE$ in the cerebral cortex of NET-/- mice was also decreased, most probably as an adaptive response to the sustained elevation of extracellular NE levels observed in these mice.
924	CPRFalse	"Interestingly, two categories of clones were distinguished based on the effects of @CHEMICAL$ on @GENE$ production and IL-2R alpha expression and proliferation; 1) In low IL-2 producers DEX blocked IL-2 production and decreased IL-2R alpha expression and proliferation; 2) In high IL-2 producers DEX inhibited IL-2 production partially and enhanced IL-2R alpha expression and proliferation."
925	CPRFalse	In this study, we examined the effects of @CHEMICAL$ on various cloned K(ATP) channels (Kir6.2/@GENE$, Kir6.2/SUR2A, and Kir6.2/SUR2B) reconstituted in COS-1 cells, and compared them to another meglitinide-related compound, nateglinide.
926	CPRFalse	They all expressed ASS, but not ornithine transcarbamylase (OTC), the enzyme that converts @CHEMICAL$, the product of degradation of arginine with rhArg, to citrulline, which is converted back to arginine via @GENE$.
927	CPRFalse	The @CHEMICAL$ structure, which is composed of seven a-helixes and eleven b-strands, contains the b-strand/eSer/a-helix structural motif, which contains the Gly-X-Ser-X-@GENE$ consensus sequence.
928	CPRFalse	As predicted, TES enhanced the production of both @CHEMICAL$ precursors (i.e., superoxide and nitic oxide), and @GENE$ was identified as the likely source of TES-stimulated superoxide production.
929	CPRFalse	Baseline cortisol (Cor0), DHEA-S (DHEA-S0), cortisol binding globulin (@CHEMICAL$), ACTH, calculated free cortisol (by Coolen's equation = CFC), free cortisol index (FCI), 60-min @GENE$ (Cor60), and DHEA-S (DHEA-S60), delta cortisol (DCor), delta DHEA-S (DDHEA-S) responses were evaluated.
930	CPRFalse	It is noteworthy that the binding of @CHEMICAL$ causes loss of the divalent metal ions that have been observed in all the previously published @GENE$ structures.
931	CPR:4	At a low pH (pH 7.4), but not pH 7.9, @CHEMICAL$ reduces the mean open time of @GENE$/GluN2B receptors, which may be responsible for its usefulness as a context-dependent inhibitor in conditions like ischemia and stroke, when the pH of the extracellular milieu becomes acidic.
932	CPR:4	It was also antagonized by the non-specific cyclooxygenase (COX) inhibitor, indomethacin, and by the selective COX-2 inhibitor, NS-398, but not by the specific @CHEMICAL$ inhibitor, @GENE$.
933	CPRFalse	"The animals were divided into thirteen groups (n=4 each) receiving an i.v. bolus injection of, either physiological saline (0.3 ml/kg; control), or the antagonists @CHEMICAL$ (300 microg/kg; 5-HT1B), BRL15572 (300 microg/kg; @GENE$), rauwolscine (300 microg/kg; alpha2), SB224289 + BRL15572 (300 microg/kg each), SB224289 + rauwolscine (300 microg/kg each), BRL15572 + rauwolscine (300 microg/kg each), rauwolscine (300 microg/kg) + prazosin (100 microg/kg; alpha1), SB224289 (300 microg/kg) + prazosin (100 microg/kg), SB224289 (300 microg/kg) + rauwolscine (300 microg/kg) + prazosin (100 microg/kg), SB224289 (300 microg/kg) + prazosin (100 microg/kg) + BRL44408 (1,000 microg/kg; alpha2A), SB224289 (300 microg/kg) + prazosin (100 microg/kg)+ imiloxan (1,000 microg/kg; alpha2B), or SB224289 (300 microg/kg) + prazosin (100 microg/kg) + MK912 (300 microg/kg; alpha2C)."
934	CPRFalse	@CHEMICAL$ (IRS) @GENE$ phosphorylation is a time-controlled physiological feedback mechanism in insulin signaling that is hijacked by metabolic and inflammatory stresses to promote insulin resistance.
935	CPRFalse	We found that CORT, @CHEM-GENE$ and CRF all appear to play some role in these changes in the male brain.
936	CPR:4	@CHEMICAL$ affects aromatic amino acid biosynthesis by inhibiting @GENE$ (EPSPS).
937	CPRFalse	In this study, we show for the first time that medulloblastoma (MB), the most common malignant childhood brain tumor, expresses high levels of @CHEMICAL$, microsomal @GENE$ synthase-1, and EP(1) through EP(4) and secretes PGE(2).
938	CPRFalse	A significant decrease of @CHEMICAL$ aminotransferase, alanine aminotransferase, @GENE$ (LDH) activities and glutathione (GSH) levels and an increase of malondialdehyde (MDA) quantity was observed after CCl4 and PC administration alone.
939	CPR:4	@CHEMICAL$, isolated from Juglans mandshurica Maxim, induces apoptosis via down-regulation of @GENE$ expression in human prostate cancer LNCaP cells.
940	CPRFalse	UNLABELLED: Therapeutic interventions that block the @CHEMICAL$-angiotensin-@GENE$ system (RAAS) have an important role in slowing the progression of cardiovascular risk actors to established cardiovascular diseases.
941	CPR:6	Betaxolol inhibited specific [(3)H]-batrachotoxinin-A 20-alpha-benzoate ([(3)H]-BTX-B) binding to neurotoxin site 2 in a concentration-dependent manner with an IC(50) value of 9.8 microM. Comparison of all the @CHEMICAL$ antagonists tested revealed a potency order of propranolol>betaxolol approximately levobetaxolol>levobunolol approximately carteolol>/=@GENE$>atenolol.
942	CPR:4	Etoposide (@CHEMICAL$) is a @GENE$ (topo II) inhibitor chemotherapeutic agent.
943	CPRFalse	RATIONALE: Recent studies provide evidence for reduced phosphodiesterase-4B (PDE4B) as a genetic susceptibility factor as well as suggesting an association of several single @CHEMICAL$ polymorphisms (SNPs) in @GENE$ that are associated with an increased incidence of schizophrenia.
944	CPRFalse	In human GC cells, WNT6 expression was enhanced by caveolin-1 (Cav1), a scaffold protein of plasma membrane caveolae. @CHEMICAL$ knock-down and overexpression experiments demonstrated that WNT6 increased the resistance to apoptotic cell death induced by the anthracycline chemotherapeutics @GENE$ (Epi) and doxorubicin (Dox).
945	CPRFalse	A Role for Cargo in the Activation of @CHEM-GENE$ (Arf) and Adaptor Recruitment.
946	CPRFalse	Among the [Fe-S] cluster biosynthetic proteins are included a pyridoxal phosphate-dependent enzyme (NifS) that is involved in the activation of sulphur from @CHEMICAL$, and a molecular scaffold protein (@GENE$) upon which [Fe-S] cluster precursors are formed.
947	CPRFalse	The affinity estimate for prazosin on human prostate was lower than the corresponding binding affinity determined at @CHEMICAL$ and @GENE$ was a very weak antagonist on human prostate (pA2 = 6.0) relative to the high affinity (pKi = 8.6) determined at cloned human alpha 1A adrenoceptors. 5.
948	CPRFalse	Conformational variations of both @CHEMICAL$ and inhibitors provide the structural basis for the physiological effects of @GENE$ and sildenafil.
949	CPRFalse	Felodipine and the @CHEMICAL$ analogue inhibited Ca2+/@GENE$-dependent caldesmon kinase with similar potencies (IC50 = 17.4 microM), whereas the oxidized and t-butyl analogues caused no inhibition.
