2856	CPR:6	Prazosin (nonselective alpha(1)-adrenoceptor antagonist), silodosin (selective alpha(1A)-adrenoceptor antagonist) and @CHEMICAL$ (8-[2-[4-(2-methoxyphenyl)-1-piperazinyl]ethyl]-8-azaspiro[4.5]decane-7,9-dione dihydrochloride) (selective @GENE$ antagonist) competitively antagonized the phenylephrine-induced contraction (pA(2) values, 8.60+/-0.07, 9.44+/-0.06 and 5.75+/-0.07, respectively).
2857	CPR:3	@CHEMICAL$ administration triggered inflammatory response in mice livers by activating nuclear factor-kappaB (NF-kB), which coincided with the induction of tumor necrosis factor-alpha (TNF-a) and @GENE$ (COX-2).
2858	CPR:9	@CHEMICAL$ (SDH), a member of the beta-family of pyridoxal phosphate-dependent (PLP) enzymes, catalyzes the deamination of L-serine and L-threonine to yield pyruvate or @GENE$.
2859	CPR:3	Similarly, pelargonidin induced the expression of CYP1A1 mRNA up to 5-fold in HepG2 and LS174T cells relative to the induction by 5 nM 2,3,7,8-tetrachlorodibenzodioxin (TCDD), the most potent activator of AhR. CYP1A1 and CYP1A2 mRNAs were also increased by pelargonidin in three primary human hepatocytes cultures (approximately 5% of @CHEMICAL$ potency) and the increase in CYP1A1 protein in HepG2 and LS174T cells was comparable to the increase in catalytic activity of @GENE$ enzyme.
2860	CPR:9	Because gastric AADC and @CHEMICAL$ degrade @GENE$, the drug is given with inhibitors of AADC (carbidopa or benserazide), and inhibitors of COMT will also enter clinical use.
2861	CPR:9	These findings demonstrate that @CHEMICAL$ is the primary transporter responsible for @GENE$ uptake in the choroid plexus.
2862	CPR:3	@CHEMICAL$ expression was increased in all @GENE$ males and BPA 0.5 females and reduced in BPA 200 females.
2863	CPR:9	The @CHEMICAL$ (NCX) is a bidirectional transporter that normally extrudes Ca(2+) from the cell (forward mode), but also brings @GENE$ into the cell (reverse mode) under special conditions such as intracellular Na(+) (Na(+)(i)) accumulation or membrane depolarization.
2864	CPR:3	@CHEMICAL$ also induces the rapid phosphorylation of @GENE$ (PKD1).
2865	CPR:5	Prazosin (nonselective alpha(1)-adrenoceptor antagonist), silodosin (selective @CHEMICAL$ antagonist) and BMY-7378 (8-[2-[4-(2-methoxyphenyl)-1-piperazinyl]ethyl]-8-azaspiro[4.5]decane-7,9-dione dihydrochloride) (selective alpha(1D)-adrenoceptor antagonist) competitively antagonized the @GENE$-induced contraction (pA(2) values, 8.60+/-0.07, 9.44+/-0.06 and 5.75+/-0.07, respectively).
2866	CPR:3	Meanwhile, the serum level of KC (a functional homolog of @CHEMICAL$ and the main proinflammatory alpha chemokine in mice) in apoE(-/-) mice was up to 357pg/ml in @GENE$-HD treated group.
2867	CPR:5	Antiarrhythmic effects of @CHEMICAL$, a novel @GENE$ agonist in cultured neonatal rat ventricular myocytes. (-)-Epicatechin-3-gallate (ECG), a polyphenol extracted from green tea, has been proposed as an effective compound for improving cardiac contractility.
2868	CPR:9	We isolated partial cDNAs that codified for enzymes implicated in the @CHEMICAL$ biosynthesis such as l-phenylalanine ammonia-lyase (PAL) and chalcone synthase (@GENE$), and an antioxidant enzyme such as ascorbate peroxidase (APX).
2869	CPR:9	@CHEMICAL$ is involved in hepatic @GENE$ secretion.
2870	CPR:3	In general, rifampicin can act on a pattern: @CHEMICAL$ activates the @GENE$ that in turn affects cytochromes P450, glucuronosyltransferases and p-glycoprotein activities.
2871	CPR:3	In control cells, pretreatment with 100 mM NaHS shifted the EC(50) for LEV-induced currents from 2838 (n = 6) to 154 (n = 8) nM. Sulfhydration of sulfonylurea receptor 2B (@CHEMICAL$) was induced by @GENE$ and colonic inflammation.
2872	CPR:3	Here, we have determined the molecular mechanism of this male-specific activation of the Kcnk1 gene and characterized @CHEMICAL$ as a @GENE$-inducible antihyperplasia factor.
2873	CPR:9	We investigated the effects of the dose of and the number of times an inducer was administered and the duration of induction of hepatic and intestinal cytochrome P450 3A (@CHEMICAL$) in rats using dexamethasone 21-phosphate (DEX-P) and midazolam (@GENE$) as an inducer and a substrate to CYP3A, respectively. 2.
2874	CPR:3	We also found that @CHEMICAL$ receptors are activated by @GENE$, ZnSO(4), and FeSO(4), three salts known to produce a metallic taste sensation.
2875	CPR:3	In this study, @CHEMICAL$ (ALD)-induced apoptosis of cardiomyocyte was evaluated based on the previous studies, and the roles of @GENE$ signaling were clarified.
2876	CPR:9	@CHEMICAL$ (PtdSer) is made in mammalian cells by two @GENE$, PSS1 and PSS2.
2877	CPR:3	We investigated the involvement of the farnesoid X receptor (FXR), a nuclear receptor for bile acids, in the @CHEMICAL$ (CDCA)-induced expression of Cdx2 and @GENE$ in normal rat gastric epithelial cells (RGM-1 cells).
2878	CPR:6	@CHEMICAL$ and EP(3) receptor antagonists @GENE$ and ONO-AE3-240, but not the EP(4) antagonists ONO-AE3-208 and AH 23848, inhibited tumor cell proliferation, indicating the significance of EP(1) and EP(3) but not EP(4) for MB growth.
2879	CPR:6	This selectivity could, in part, account for the more favorable clinical profile of @CHEMICAL$ in comparison with @GENE$ antagonists that do not show subunit selectivity.
2880	CPR:3	Furthermore, treatment with spironoclactone not only attenuated the pro-apoptotic effect of ALD but reversed the @CHEMICAL$-induced increase of @GENE$ and AIF levels.
2881	CPR:9	The @CHEMICAL$ homeostasis proteins @GENE$ (SERCA2a), sodium calcium exchanger-1, phospholamban (PLB), phospho-PLB, and calsequestrin 2 are important for contraction and relaxation.
2882	CPR:9	Different substrates were used as the relative specific substrates for the determination of aminopeptidase enzymatic activity: 4-methoxy-2-naphthylamide of @CHEMICAL$ for @GENE$, 4-methoxy-2-naphthylamide of L-leucine for leucine aminopeptidase, 4-methoxy-2-naphthylamide of L-glutamic acid for aminopeptidase A and 4-methoxy-2-naphthylamide of L-arginine for aminopeptidase B. The vaginal aminopeptidase enzymatic activity of different species was determined spectrofluorometrically.
2883	CPR:6	The selective GluR5 kainate receptor agonist ATPA induces spontaneous epileptiform bursting that is sensitive to the @CHEMICAL$ kainate receptor antagonist @GENE$.
2884	CPR:9	@CHEMICAL$ hydrolyze esters, amides, and @GENE$ to produce carboxylic acids and resulting alcohols, amines, and thiols, respectively.
2885	CPR:9	Dopamine D(2) receptor-induced @CHEMICAL$-mediated production of @GENE$ in D(2)-transfected Chinese hamster ovary cells without simultaneous administration of a Ca(2+)-mobilizing agent.
2886	CPR:3	In addition, @CHEMICAL$ induces the DNA-binding activities of the transcription factor NF-kB, HSF1, AP-1, and @GENE$, together with the expression of HSP70 and Bax proteins.
2887	CPR:9	@CHEMICAL$ are colocalized with carboxylesterases and have the potential to further metabolize carboxylic acids to @GENE$, but it is currently unknown if acyl glucuronides, being esters, also interact with carboxylesterases.
2888	CPR:3	These results indicate that @CHEMICAL$ prevents lipid accumulation in HepG2 cells by blocking the expression of SREBP-1c and FAS through @GENE$/AMPK activation, suggesting that phillyrin is a novel AMPK activator with a role in the prevention and treatment of obesity.
2889	CPR:6	Only pMPPI [@CHEMICAL$], a selective @GENE$ antagonist, was effective in inhibiting all 5-HT syndrome behaviors produced by lisuride, whereas pMPPI was without effect on any behavior induced by LSD.
2890	CPR:9	In vitro accumulation studies conducted in Madin-Darby canine kidney II cells indicate that @CHEMICAL$ is an avid substrate for both P-gp and @GENE$.
2891	CPR:9	These results indicate a major role of CYP2B6 in ketamine N-demethylation in vitro and a significant impact of the @CHEMICAL$ allele on enzyme-@GENE$ binding and catalytic activity.
2892	CPR:6	RS 17053 showed high affinity and selectivity for alpha 1A adrenoceptors (pKi 8.6) relative to alpha 1B (pKi = 7.3) and alpha 1D (pKi = 7.1) subtypes. 3. (+)-Tamsulosin, (-)-tamsulosin, SL 89,0591, @CHEMICAL$, SNAP 1069 and RS 17053 appeared to act as competitive antagonists of noradrenaline-mediated contractions of rat aorta yielding pA2 affinity estimates which were similar to binding affinities at cloned @GENE$.
2893	CPR:9	Glycylsarcosine coadministration could inhibit the uptake of @CHEMICAL$ in PEPT2(+/+) mice (p < 0.01) but not @GENE$(-/-) mice.
2894	CPR:3	@CHEMICAL$ activates carbonic anhydrase and antagonizes the effect of the specific @GENE$ inhibitor acetazolamide, by a direct mechanism of action.
2895	CPR:3	Human and rat renin and @CHEMICAL$ genes were downregulated in dTGR and were increased by @GENE$ and cilazapril treatments, whereas no changes in the expression of rat ACE and AT1A receptor genes were observed.
2896	CPR:3	@CHEMICAL$ (PB), a typical @GENE$ activator, increased the gene expression of HIF-target genes in the livers of mice, including erythropoietin, heme oxygenase-1 and vascular endothelial growth factor-a.
2897	CPR:6	The @CHEMICAL$ antagonist @GENE$ facilitated hyperglycemia induced by clomipramine, although the 5-HT(2A)-receptor antagonist ketanserin was without effect.
2898	CPR:3	Furthermore, compared with control groups, the plaque endothelium level of p75(NTR) was 3-fold increased and the liver level of @CHEMICAL$ was 17.4-fold increased by @GENE$-HD.
2899	CPR:9	In kidneys, stimulation of adenylyl cyclase causes egress of cAMP, conversion of cAMP to AMP by ecto-phosphodiesterase, and metabolism of @CHEMICAL$ to adenosine by @GENE$.
2900	CPR:3	Activation of @CHEMICAL$ mediates the cardiovascular effects of @GENE$.
2901	CPR:3	"Results: The administration of @CHEMICAL$ 1.6% w/w created significant increased changes in the levels of total WBC, lymphocytes, RBC, hemoglobin, packed cell volume, platelets, mean corpuscular volume, and mean corpuscular @GENE$ in rats after 24, 48, and 72 h of continuous inhalation; however, there was a significant reduction in neutrophils at transient reduction in the monocytes after 24 and 48 h to return to normal after 72 h. Significant increases in the levels of CK, g-GT, SOD, NO, MDA, AFP, IL-2, and TNFa were recorded."
2902	CPR:6	At 100 nM and higher, it suppressed the maximal response to phenylephrine. (+/-)-Tamsulosin effectively antagonized the positive inotropic effect of phenylephrine even after inactivation of alpha 1B-adrenoceptors by treatment with chlorethylclonidine, which is an indication that the (+/-)-tamsulosin-sensitive subtype belongs to a class resistant to chlorethylclonidine. @CHEMICAL$, over the range of concentrations at which it antagonized the positive inotropic effect mediated by @GENE$, did not affect the accumulation of [3H]inositol phosphates that was induced by 10 microM phenylephrine.
2903	CPR:5	OBJECTIVE: Preclinical evaluation of @CHEMICAL$, a @GENE$ (PPARalpha) and PPARgamma agonist, as a body-weight lowering, hypolipidemic and euglycemic agent.
2904	CPR:3	@CHEMICAL$ exposure resulted in a sustained increase in mRNA expression for @GENE$ and PDE3A, but PDE4D gene expression was unchanged.
2905	CPR:6	Compared pharmacological characteristics in humans of racemic @CHEMICAL$ and levocetirizine, two @GENE$ antagonists.
2906	CPR:9	BACKGROUND AND AIMS: @CHEMICAL$ (GAD, EC 4.1.1.15) catalyses the conversion of @GENE$ to gamma-aminobutyric acid (GABA).
2907	CPR:9	"Present results of point mutations of full-length PDE5 showed that maximum catalysis was decreased 2650-fold in H613A and 55-fold in F820A. Catalytic-site affinities for cGMP, vardenafil, sildenafil, @CHEMICAL$, or 3-isobutyl-1-methylxanthine (IBMX) were respectively weakened 14-, 123-, 30-, 51-, and 43-fold for Y612A; 63-, 511-, 43-, 95- and 61-fold for @GENE$; and 59-, 448-, 71-, 137-, and 93-fold for F820A."
2908	CPR:9	Hydrogen sulphide (H(2)S) is synthesized from @CHEMICAL$ via the action of cystathionine-gamma-lyase (CSE) and cystathionine-beta-synthase (@GENE$).
2909	CPR:9	To determine whether @CHEMICAL$ modulate the endothelial @GENE$ synthesis, we investigated the effects of the competitive arginase inhibitor N(omega)-hydroxy-nor-L-arginine (Nor-NOHA) on the activity of NOS, arginases, and L-arginine transporter and on NO release at surface of human umbilical vein endothelial cells (HUVECs).
2910	CPR:6	RS 17053 showed high affinity and selectivity for alpha 1A adrenoceptors (pKi 8.6) relative to alpha 1B (pKi = 7.3) and alpha 1D (pKi = 7.1) subtypes. 3. (+)-Tamsulosin, (-)-tamsulosin, SL 89,0591, Rec 15/2739, SNAP 1069 and @CHEMICAL$ appeared to act as competitive antagonists of noradrenaline-mediated contractions of rat aorta yielding pA2 affinity estimates which were similar to binding affinities at cloned @GENE$.
2911	CPR:6	The potent @CHEMICAL$ antagonist cetirizine (Zyrtec) is a racemic mixture of levocetirizine (now available under the trademark Xyzal and @GENE$.
2912	CPR:3	Furthermore, proteosomal inhibitor MG132 suppressed @CHEMICAL$ activation, GSK3b phosphorylation, cleaved PARP and deceased AEG-1 induced by @GENE$ in HepG2 cells.
2913	CPR:5	These results indicate that, similar to the sulfonylureas, mitiglinide is highly specific to the Kir6.2/SUR1 complex, i.e., the pancreatic beta-cell @CHEMICAL$, and suggest that @GENE$ may be a clinically useful anti-diabetic drug.
2914	CPR:5	The results suggested that both the EtOAc extract and berberine were able to activate @CHEMICAL$, and Rhizoma Coptis contains potential natural agonists of PPARs besides @GENE$.
2915	CPR:9	@CHEMICAL$ hydrolyze @GENE$, amides, and thioesters to produce carboxylic acids and resulting alcohols, amines, and thiols, respectively.
2916	CPR:3	Furthermore, @CHEMICAL$ treatment caused nuclear accumulation of nuclear factor-E2-related factor 2 (Nrf2) and increased the promoter activity of antioxidant response elements (@GENE$).
2917	CPR:3	Finally, the amounts of RORalpha and @CHEMICAL$ mRNAs were similarly increased by @GENE$ treatment of human adipose tissue explants, confirming coordinated regulation.
2918	CPR:3	There was also an increase in c-kit, Trio, Rho-A, @CHEMICAL$, EGFR, Notch-4, Dvl-2, Ezrin, beta catenin and mutant p53 protein expression in the @GENE$-treated cells.
2919	CPR:3	Furthermore, @CHEMICAL$ treatment caused nuclear accumulation of nuclear factor-E2-related factor 2 (@GENE$) and increased the promoter activity of antioxidant response elements (AREs).
2920	CPR:6	In contrast, the D-1997-induced responses were potently and concentration-dependently antagonized by the mixed @CHEMICAL$ and 5-HT2 receptor antagonist @GENE$ (0.01-1 microM).
2921	CPR:3	Activating glucocorticoid receptor-@CHEMICAL$ signaling pathway contributes to @GENE$ protection against b-amyloid peptide-induced human endothelial cells apoptosis.
2922	CPR:3	Overall, our findings suggest that @CHEMICAL$ induced apoptosis in HepG2 cells via AMPK activation and @GENE$ phosphorylation as a potent chemopreventive agent.
2923	CPR:3	There was also an increase in c-kit, Trio, Rho-A, Rac-3, EGFR, Notch-4, Dvl-2, Ezrin, @CHEMICAL$ and mutant p53 protein expression in the @GENE$-treated cells.
2924	CPR:3	@CHEMICAL$ attenuates high glucose-induced lipid accumulation in human HepG2 hepatocytes through the activation of @GENE$/AMP-activated protein kinase-dependent signalling.
2925	CPR:6	In many countries, a @CHEMICAL$ antagonist @GENE$ has been used in the treatment of alcohol dependence.
2926	CPR:9	"We found that reduction of the carcinogenic hydroxylamines of the aromatic amine 4-aminobiphenyl (4-ABP; found in cigarette smoke) and the heterocyclic amine @CHEMICAL$ (PhIP; found in grilled meats) was indeed catalyzed by a purified system containing only human b5R and @GENE$."
2927	CPR:3	It was concluded that @CHEMICAL$ selectively reduces both N- and R-type Ca2+ currents by activating a @GENE$ probably through the EP3 receptor in paratracheal ganglion cells.
2928	CPR:9	Abstract 1.  UDP-glucuronosyltransferases (UGTs) are versatile and important conjugation enzymes in the metabolism of drugs and other xenobiotics. 2.  We have developed a convenient quantitative multi-well plate assay to measure the glucuronidation rate of @CHEMICAL$ (HFC) for several @GENE$. 3.  We have used this method to screen 11 recombinant human UGTs for HFC glucuronidation activity and studied the reaction kinetics with the most active enzymes.
2929	CPR:9	In the reverse case, mutation of the orthologous glycine (Gly553) to methionine in carnitine octanoyltransferase (@CHEMICAL$) decreased activity toward its natural substrates, medium- and long-chain acyl-CoAs, and increased activity toward short-chain @GENE$.
2930	CPR:3	These results suggest that the megabase DNA fragmentation is induced as a consequence of inhibition of thymidylate synthase by @CHEMICAL$ and kilobase DNA fragmentation may correlate with the reduction of p27(kip1) expression and the increase in cyclin E and @GENE$ kinase activities.
2931	CPR:9	@CHEMICAL$ (IDO), a @GENE$ catabolizing enzyme, has been implicated in the pathogenesis of various neurological disorders.
2932	CPR:9	Stable ABCC1, ABCC2 and ABCC3 knockdown cell lines were generated, thus making it possible to demonstrate that ABCC1 mediates the basolateral and @CHEMICAL$ the apical excretion of @GENE$ conjugates.
2933	CPR:9	Depletion of putrescine, spermidine, and @CHEMICAL$ by DL-alpha-difluoromethylornithine (DFMO), a specific inhibitor of @GENE$ (ODC) that is the first rate-limiting enzyme for polyamine biosynthesis, decreased the apoptotic index.
2934	CPR:3	@CHEMICAL$ also down-regulated the expression of STAT3 target genes, including the anti-apoptotic proteins Bcl-xL and Mcl-1, leading to the up-regulation of mitochondrial apoptosis pathway-related proteins (Bax, Bak, cytosolic Cytochrome c, and cleaved Caspase3) and cyclin-dependent kinase inhibitors such as @GENE$ and p27.
2935	CPR:3	Little is known in terms of multi-matrix @CHEMICAL$ activity induction under repeated oral exposure to planar halogenated and polycyclic aromatic hydrocarbons (PHH, @GENE$).
2936	CPR:5	The recent development of H1-receptor antagonists devoid of clinical sedative effects has enabled the administration of doses of H1-antihistamines which achieve a greater degree of @CHEMICAL$ blockade within the airways, thus permitting a better appraisal of the role of @GENE$ in this condition.
2937	CPR:9	@CHEMICAL$ (TK-1) and thymidylate synthase (TS) are key enzymes for salvage and de novo @GENE$ synthesis, respectively.
2938	CPR:3	@CHEMICAL$ activated phosphatidylinositol 3-kinase (@GENE$)/Akt signaling, leading to the inhibition of glycogen synthase kinase-3b and the nuclear translocation of b-catenin, followed by the increase of the transcriptional activity by b-catenin/T-cell factor complex formation in both SaOS-2 cells and MC3T3-E1 cells.
2939	CPR:6	The influence of @CHEMICAL$, a selective @GENE$ antagonist, on the positive inotropic effect and the accumulation of inositol phosphates that are induced via alpha 1-adrenoceptors was studied in comparison with that of another alpha 1A-adrenoceptor ligand oxymetazoline in the rabbit ventricular myocardium.
2940	CPR:5	Pharmacology of @CHEMICAL$, a selective MT1/@GENE$ receptor agonist: a novel therapeutic drug for sleep disorders.
2941	CPR:3	Upon co-exposure to V(5+) and @CHEMICAL$, V(5+) significantly potentiated the TCDD-mediated induction of the Cyp1a1, @GENE$, and Cyp1b1 mRNA, protein, and catalytic activity levels at 24 h. In vitro, V(5+) decreased the TCDD-mediated induction of Cyp1a1 mRNA, protein, and catalytic activity levels.
2942	CPR:6	In the lateral geniculate nucleus, @CHEMICAL$ displayed @GENE$ antagonistic action.
2943	CPR:9	They all expressed ASS, but not ornithine transcarbamylase (@CHEMICAL$), the enzyme that converts @GENE$, the product of degradation of arginine with rhArg, to citrulline, which is converted back to arginine via ASS.
2944	CPR:9	@CHEMICAL$ is absorbed in the small bowel and is rapidly catabolized by aromatic-L-amino-acid decarboxylase (AADC) and catechol-O-methyltransferase (@GENE$).
2945	CPR:3	@CHEMICAL$ induces cognitive impairment through enhancement of CysLT1 R-mediated @GENE$ generation in mice.
2946	CPR:3	Activation of @CHEMICAL$ and Phosphorylation of Glycogen Synthase Kinase3 b Mediate @GENE$ Induced Apoptosis in HepG2 Liver Cancer Cells.
2947	CPR:3	These findings suggest that @CHEMICAL$ activates the @GENE$/Akt signaling pathway leading to the promotion of nuclear translocation of b-catenin in osteoblast-like cells, resulting in the upregulation of osteoptotegerin and osteoblast differentiation markers including alkaline phosphatase, probably relating to the inhibition of osteoclast formation and the mineralization, respectively.
2948	CPR:9	@CHEMICAL$ (carnitine palmitoyltransferase I) catalyses the conversion of palmitoyl-CoA into @GENE$ in the presence of L-carnitine, facilitating the entry of fatty acids into mitochondria.
2949	CPR:5	The @CHEMICAL$ (beta(2)-AR) agonists clenbuterol and @GENE$ have similar beneficial effects in animal models of heart failure.
2950	CPR:3	Among these differentially expressed lncRNAs, the greatest change was noted for @CHEMICAL$, which had more than 300 folds induction upon @GENE$ treatment.
2951	CPR:3	In contrast to parenteral delivery of rBChE, which currently requires posttranslational modification for good plasma stability, an unmodified aer-rBChE pretreatment given 1-40h prior to >1 LD50 of aer-@CHEMICAL$ (Px) was able to prevent inhibition of circulating @GENE$ in a dose-dependent manner.
2952	CPR:6	Pharmacological properties of lorglumide as a member of a new class of cholecystokinin antagonists. Derivatives of @CHEMICAL$ are a new class of non-peptide cholecystokinin (@GENE$) antagonists.
2953	CPR:9	OBJECTIVE: To compare the cyclooxygenase (COX) activity and anti-inflammatory effects of the nonsteroidal anti-inflammatory drugs (NSAIDs) ketorolac tromethamine (ketorolac) and bromfenac sodium (bromfenac). METHODS: @CHEMICAL$ activity and selectivity was determined in vitro by measuring prostaglandin E(2) (@GENE$) production following incubation of varying concentrations of NSAID with human recombinant COX-1 or COX-2 and arachidonic acid.
2954	CPR:3	For AII and @CHEMICAL$, MAP was also increased for the @GENE$ group but not in a dose-dependent fashion.
2955	CPR:9	PURPOSE: The fluoropyrimidine carbamate (capecitabine) is converted to 5-fluorouracil (@CHEMICAL$) by thymidine phosphorylase (@GENE$) inside target tissues. 5-FU interferes with DNA synthesis by blocking thymidylate synthase (TS) but is inactivated by dihydropyrimidine dehydrogenase (DPD).
2956	CPR:3	However, Ca(2+) blockers also obviously attenuated @CHEMICAL$ activation and transnuclear transport induced by @GENE$.
2957	CPR:6	The potentiation of the contractile effect induced by 5-HT is only somewhat modified by deendothelialization, but abolished by the @CHEMICAL$ antagonists GR32191 and @GENE$.
2958	CPR:5	Real-time quantitative reverse-transcription polymerase chain reaction and immunohistochemical analysis were performed to determine mRNA levels and receptor protein expressions respectively, for alpha(1A)-, alpha(1B)- and alpha(1D)-adrenoceptors in hamster ureteral smooth muscle. alpha(1)-Adrenoceptor antagonists were tested against the @CHEMICAL$ (@GENE$ agonist)-induced contraction in isolated hamster ureteral preparations using a functional experimental approach.
2959	CPR:3	Upon co-exposure to V(5+) and @CHEMICAL$, V(5+) significantly potentiated the TCDD-mediated induction of the Cyp1a1, Cyp1a2, and @GENE$ mRNA, protein, and catalytic activity levels at 24 h. In vitro, V(5+) decreased the TCDD-mediated induction of Cyp1a1 mRNA, protein, and catalytic activity levels.
2960	CPR:9	PURPOSE: The @CHEMICAL$ (capecitabine) is converted to 5-fluorouracil (5-FU) by @GENE$ (TP) inside target tissues. 5-FU interferes with DNA synthesis by blocking thymidylate synthase (TS) but is inactivated by dihydropyrimidine dehydrogenase (DPD).
2961	CPR:6	In further studies, the diuretic effects of the CB1 agonist AM4054 were similar in male and female rats, displayed a relatively rapid onset to action, and were dose-dependently antagonized by 30 minutes pretreatment with rimonabant, but not by the vanilloid receptor type I antagonist capsazepine, nor were the effects of WIN 55,212 antagonized by the @CHEMICAL$ antagonist AM630 [@GENE$].
2962	CPR:6	RS 17053 showed high affinity and selectivity for alpha 1A adrenoceptors (pKi 8.6) relative to alpha 1B (pKi = 7.3) and alpha 1D (pKi = 7.1) subtypes. 3. (+)-Tamsulosin, (-)-tamsulosin, SL 89,0591, Rec 15/2739, @CHEMICAL$ and RS 17053 appeared to act as competitive antagonists of noradrenaline-mediated contractions of rat aorta yielding pA2 affinity estimates which were similar to binding affinities at cloned @GENE$.
2963	CPR:3	Thus, the increase in mPFC @CHEMICAL$ function was an SHR-specific long term consequence of @GENE$ treatment during adolescence, which may be responsible for the treatment-induced alterations in behavior including the observed increases in cocaine self-administration.
2964	CPR:9	@CHEMICAL$ (MTRR) is an enzyme involved in the conversion of Hcy to @GENE$.
2965	CPR:3	@CHEMICAL$ induction in the liver increased depending on the dose of @GENE$, whereas that in intestine showed a mild increase, but the induction level was almost constant regardless of the dose of DEX-P. 4.
2966	CPR:3	These results indicate that phillyrin prevents lipid accumulation in HepG2 cells by blocking the expression of SREBP-1c and FAS through LKB1/AMPK activation, suggesting that @CHEMICAL$ is a novel @GENE$ activator with a role in the prevention and treatment of obesity.
2967	CPR:3	@CHEMICAL$ expression was increased by @GENE$ but not by losartan.
2968	CPR:3	Combined treatment of @CHEMICAL$ and DA further augments cell toxicity, ROS production and @GENE$ phosphorylation in LRRK2 deficient cells compared to controls.
