0	CPR:4	@CHEMICAL$ and the p-chloro analogue inhibited the actin-activated @GENE$ activity of smooth muscle myosin (IC50 = 25.1 microM).
1	CPRFalse	In membranes of control but not of @CHEMICAL$-treated cells, @GENE$ via alpha 2-adrenoceptors stimulated incorporation of the photo-reactive GTP analog [alpha-32P]GTP azidoanilide into pertussis toxin substrates comigrating with the alpha-subunits of Gi2, Go2, and the not further identified Go subtype.
2	CPRFalse	Growth factor receptor-bound protein 10(Grb10)is a Src homology 2 (SH2) domain-containing protein and one of the binding partners for several trans-membrane @CHEM-GENE$, including insulin receptor (IR) and insulin-like growth factor-1 receptor (IGF1-R).
3	CPRFalse	These results indicate that, similar to the sulfonylureas, mitiglinide is highly specific to the Kir6.2/SUR1 complex, i.e., the pancreatic beta-cell @CHEM-GENE$, and suggest that mitiglinide may be a clinically useful anti-diabetic drug.
4	CPRFalse	However, @CHEMICAL$ receptor blockers differ from ACE inhibitors with respect to side effects, and induce less cough, a side effect which may be related to @GENE$ or other mediators such as substance P.
5	CPRFalse	S1P activated @CHEM-GENE$ (PI3K)/Akt signaling, leading to the inhibition of glycogen synthase kinase-3b and the nuclear translocation of b-catenin, followed by the increase of the transcriptional activity by b-catenin/T-cell factor complex formation in both SaOS-2 cells and MC3T3-E1 cells.
6	CPR:3	Upon co-exposure to @CHEMICAL$ and TCDD, V(5+) significantly potentiated the TCDD-mediated induction of the Cyp1a1, @GENE$, and Cyp1b1 mRNA, protein, and catalytic activity levels at 24 h. In vitro, V(5+) decreased the TCDD-mediated induction of Cyp1a1 mRNA, protein, and catalytic activity levels.
7	CPRFalse	@CHEMICAL$, is a synthetic malononitrilamide that targets the critical enzyme of the de novo pyrimidine synthesis, dihydroorotic acid dehydrogenase, and @GENE$ has completed phase II trials.
8	CPRFalse	Change in affinity for cGMP, @CHEMICAL$, sildenafil, or IBMX in Y612F, H613A, @GENE$, or F786A was less, but affinity of H613A or F786A for tadalafil was weakened 37- and 17-fold, respectively.
9	CPRFalse	Absorption and secretion of fluoride increase at acid pH levels, possibly because of its non-ionized state at these pHs and/or because of participation of a @CHEM-GENE$ or a F(-)/OH(-) antiporter.
10	CPRFalse	In intact animals, neutralization of the inhibitory feedback action of endogenous @CHEMICAL$ leads to an increased @GENE$ and testosterone secretion, which partly overcomes the direct action of the antiandrogen at the level of the prostate and seminal vesicles.
11	CPRFalse	A GRP targeting ligand, J-G-Abz4-QWAVGHLM-NH(2) (J-G-Abz4-t-BBN), and an Y1 targeting ligand, INP-K[e-J-(a-DO3A-e-DGa)-K]-YRLRY-NH(2)([e-J-(a-DO3A-e-DGa)-K]-BVD-15), were synthesized and coupled to produce the heterobivalent ligand, @CHEMICAL$/BVD15-DO3A. Competitive displacement binding assays using t-BBN/BVD15-DO3A against @GENE$-Tyr(4)-BBN yielded an IC(50) value of 18 + 0.7 nM for GRPR in T-47D cells, a human breast cancer cell line.
12	CPR:4	PURPOSE: Testosterone-to-estradiol ratio levels in infertile men improve during treatment with the @CHEMICAL$ inhibitor, @GENE$, and resulting changes in semen parameters.
13	CPRFalse	Second, @CHEMICAL$ mutant human TOP2alpha, which exhibits reduced ATPase activity, was shown to exhibit cross-resistance to all ATP-sensitive but not @GENE$-insensitive TOP2 poisons.
14	CPRFalse	After only 10-min ischemia followed by 24-h reperfusion, uKIM-1 was significantly elevated by 13-fold, whereas serum creatinine (sCr), blood @CHEMICAL$ nitrogen, N-acetyl-b-glucosaminidase (@GENE$), and proteinuria levels did not change.
15	CPRFalse	"The ratio between the GDC/SHMT and @CHEMICAL$-THF synthase/@GENE$ pathways of Ser synthesis from [alpha-(13)C]Gly and [(13)C]formate, respectively, in Arabidopsis shoots was 21 : 1; in roots, 9 : 1."
16	CPRFalse	Folding pathway of guanidine-denatured disulfide-intact wild-type and mutant bovine pancreatic ribonuclease A. The refolding kinetics of @CHEMICAL$-denatured disulfide-intact bovine pancreatic ribonuclease A (RNase A) and its @GENE$ mutant (Pro42Ala) have been studied by monitoring tyrosine burial and 2'-cytidine monophosphate (2'CMP) inhibitor binding.
17	CPRFalse	However, combination of @CHEMICAL$ (10 mg x kg(-1) i.p.) with L-DOPA or L-tryptophan (50 mg x kg(-1) i.p.), or rasagiline (10 mg x kg(-1) p.o.) with fluoxetine (10 mg x kg(-1) p.o.), did not induce the behavioural hyperactivity syndrome which is seen following inhibition of both @GENE$ and MAO-B by tranylcypromine together with the monoamine precursors.
18	CPRFalse	These findings, and previous descriptions of inactivation of the human type II GnRH receptor and deletions of @CHEM-GENE$ and type II GnRH receptor in laboratory rodents, suggest the GnRH-II system has been replaced by the GnRH-I system or is redundant in certain mammals.
19	CPRFalse	A series of mazindol (2) and homomazindol (3) analogues with a variety of electron-donating and electron-withdrawing groups in the pendant aryl group and the @CHEMICAL$ ring C, as well as H, methoxy, and alkyl groups replacing the hydroxyl group were synthesized, and their binding affinities at the dopamine transporter (@GENE$) on rat or guinea pig striatal membranes were determined.
20	CPR:3	These findings suggest that @CHEMICAL$ activates the PI3K/@GENE$ signaling pathway leading to the promotion of nuclear translocation of b-catenin in osteoblast-like cells, resulting in the upregulation of osteoptotegerin and osteoblast differentiation markers including alkaline phosphatase, probably relating to the inhibition of osteoclast formation and the mineralization, respectively.
21	CPR:6	These results confirm the selective mGlu2 agonist and @CHEMICAL$ antagonist actions of @GENE$.
22	CPRFalse	G6pc2 deletion had little effect on insulin sensitivity and @CHEMICAL$ tolerance, whereas body fat was reduced in female @GENE$ knockout (KO) mice on both a chow and high-fat diet, observations that are all consistent with human GWAS data.
23	CPRFalse	Constitutive and inducible forms of human cyclo-oxygenase (hCOX-1 and @CHEMICAL$) were cloned and expressed in insect cells, utilizing a baculovirus expression system. hCOX-1 had a specific activity of 18.8 mumol of O2/mg with a Km of 13.8 microM for @GENE$ and Vmax. of 1500 nmol of O2/nmol of enzyme, whereas hCOX-2 had a specific activity of 12.2 mumol of O2/mg with a Km of 8.7 microM for arachidonate and a Vmax. of 1090 nmol of O2/nmol of enzyme.
24	CPRFalse	Ntp and Ctp, synthetic peptides based on the N- and @CHEMICAL$-terminal sequences of K(IR)6.0, respectively, were used to probe gating of K(IR)6.0/@GENE$ K(ATP) channels.
25	CPRFalse	The treatment with arsenic exhibited a significant increase in some serum hepatic and renal biochemical parameters (alanine aminotransferase, @CHEMICAL$ aminotransferase, @GENE$, total protein, albumin, bilirubin, cholesterol, urea and creatinine).
26	CPRFalse	Binding sites for @CHEMICAL$ blockers have been mapped within the inner cavity of the channel and include aromatic residues in the S6 helix (Tyr-652, Phe-656) and residues in the pore helix (@GENE$-623, Ser-624, Val-625).
27	CPRFalse	The involvement of EP1 and @CHEMICAL$ is indicated by studies with the EP1 selective agonist @GENE$, and the EP2 selective agonist butaprost (which stimulate), as well as by studies with the antagonists SC-51089 (EP1 specific) and AH 6809 (EP1 and EP2 specific).
28	CPRFalse	To explore the molecular basis for CPT hypersensitivity in @CHEMICAL$-deficient cells, we found that upon @GENE$ exposure, the RNA polymerase II large subunit (RNAP LS) became progressively depleted, followed by recovery to nearly the original level in wild-type MEFs, whereas RNAP LS remained depleted without recovery in Top2b-deficient cells.
29	CPRFalse	"They included the @CHEMICAL$ inhibitor indomethacin; the COX-2 inhibitor NS-398; the mixed COX-1/COX-2 inhibitor ibuprofen; the nitric oxide (NO) derivatives of indomethacin, ibuprofen and flurbiprofen; the 5-LOX inhibitor REV 5901; and the 5-LOX activating protein (FLAP) inhibitor @GENE$."
30	CPRFalse	Pretreatment with lysosomal enzyme inhibitors @CHEMICAL$ or @GENE$ inhibitors (proteasome inhibitor I, MG-132, or lactacystin) decreased the extent of U50,488H-induced down-regulation.
31	CPRFalse	Using temperature block, @CHEMICAL$, and recovery from each, we found that the cytoplasmic tail of M6PR causes the recruitment of @GENE$ and GGAs to recycling endosomes and not at the Golgi, as predicted by steady state staining profiles.
32	CPRFalse	"Subjects were genotyped for the following single @CHEMICAL$ polymorphisms (SNPs): (TNF -308, -238, and + 488); @GENE$ (LTA) (LTA + 249, + 365, and + 720); and Fc gamma receptors FCGR2A 131 H/R; FCGR3A 176 F/V; and FCGR3B NA 1/2 and genotypes were correlated with infections."
33	CPR:9	Carnitine acetyltransferases (@CHEMICAL$) catalyze the reversible conversion of acetyl-CoA and @GENE$ to acetylcarnitine and free CoA. To redesign the specificity of rat CrAT toward its substrates, we mutated Met564.
34	CPRFalse	Furthermore, a combinatory mutation (Pro(7.31)-Pro(7.32)-Ser(7.33) motif to Ser-Glu-Pro in EL3 and @CHEMICAL$(7.38), Leu(7.43), Ala(7.46), and Pro(7.47) to those of rat GnRHR) in @GENE$ exhibited an approximately 500-fold increased sensitivity to GnRH-I, indicating that these residues are critical for discriminating GnRH-II from GnRH-I. [Trp(7)]GnRH-I and [Trp(8)]GnRH-I but not [His(5)]GnRH-I exhibit a higher potency in activating wild-type gmGnRHR-2 than native GnRH-I, indicating that amino acids at positions 7 and 8 of GnRHs are more important than position 5 for differential recognition by type I and type II GnRHRs.
35	CPR:4	A series of @CHEMICAL$ incorporating cyanoacrylamide moieties (tyrphostine analogs) were assayed as inhibitors of the @GENE$ (CA, EC 4.2.1.1) from Saccharomyces cerevisiae, ScCA.
36	CPRFalse	@CHEMICAL$ induces autophagy in MDA-MB-231 cells by regulating @GENE$-mTOR pathway.
37	CPRFalse	@CHEM-GENE$ binds tetrahydrobiopterin cofactor with negative cooperativity, as shown by kinetic analyses and surface plasmon resonance detection.
38	CPRFalse	METHODS: In 304 Caucasian American NTD families with myelomeningocele or anencephaly, we examined 28 polymorphisms in 11 genes: folate receptor 1, folate receptor 2, solute carrier family 19 member 1, transcobalamin II, @CHEMICAL$ dehydrogenase 1, serine hydroxymethyl-transferase 1, @GENE$ (MTHFR), 5-methyltetrahydrofolate-homo-cysteine methyltransferase, 5-methyltetrahydrofolate-homocysteine methyltransferase reductase, betaine-homocysteine methyltransferase (BHMT), and cystathionine-beta-synthase.
39	CPRFalse	Inhibition of TrkB @CHEMICAL$ kinase signaling with k252a, or with the selective BDNF scavenger @GENE$-Fc, both inhibited MF-LTP to the same extent as observed in BDNF+/- mice. Basal synaptic transmission, short-term plasticity, and synaptic fatigue during LTP induction were not significantly altered by treatment with k252a or TrkB-Fc, or by chronic BDNF reduction in BDNF+/- mice.
40	CPRFalse	Cloning and characterization of @CHEMICAL$ adds significantly to our knowledge of the diversity of @GENE$ transporters with regard to primary sequence, pharmacological profile, and permeation properties.
41	CPR:4	These effects were fully counteracted by dietary @CHEMICAL$ which inhibited ROS overproduction and GSH consumption, rendered the reactive transcription of glutathione-associated enzymes unnecessary and blocked the intracellular signals leading to the overexpression and rearrangement of @GENE$ signalling molecule.
42	CPRFalse	The 90% CI for the AUC0-t ratio of @CHEMICAL$ but not for omeprazole/5-OH-omeprazole plasma ratio 3 hours post-dose or omeprazole/5-OH-omeprazole AUC0-t ratio (secondary @GENE$ metrics) was above the predefined threshold of 1.43, probably caused by the inherent high variability of omeprazole pharmacokinetics.
43	CPRFalse	Moreover, the treatment downregulated the protein and gene expressions of inducible @CHEMICAL$ synthase (iNOS), cyclooxygenase-2 (@GENE$), TNF-a, IL-1b and IL-6.
44	CPRFalse	"This study was aimed to compare the in vitro effects of 3-methyl-1-phenyl-2-(phenylseleno)oct-2-en-1-one (C21H2HOSe; organoselenium) and sodium selenate (inorganic @CHEMICAL$) on adenosine deaminase (@GENE$) activity, cell viability, lipid peroxidation, scavenger of nitric oxide (NO) and nonprotein thiols (NP-SH) content in the cerebral cortex slices of the young rats."
45	CPR:4	A series of phenolic acids and phenol natural products, such as p-hydroxybenzoic acid, p-coumaric acid, caffeic acid, ferulic acid, @CHEMICAL$, syringic acid, quercetin, and ellagic acid, were investigated for their inhibitory effects against the metalloenzyme carbonic anhydrase (@GENE$, EC 4.2.1.1).
46	CPRFalse	PURPOSE: To compare phenelzine (PLZ), an antidepressant drug with anxiolytic properties which inhibits monoamine oxidase (MAO) but also elevates rat brain levels of the amino acids ?-aminobutyric acid (GABA) and alanine (ALA), with vigabatrin (VIG), an anticonvulsant which elevates brain @CHEMICAL$ by inhibition of GABA transaminase (GABA-T), with regard to their actions on brain levels of GABA and ALA and on activities of MAO, @GENE$ and ALA transaminase (ALA-T).
47	CPRFalse	In human GC cells, WNT6 expression was enhanced by caveolin-1 (Cav1), a scaffold protein of plasma membrane caveolae. WNT6 knock-down and overexpression experiments demonstrated that @CHEMICAL$ increased the resistance to apoptotic cell death induced by the anthracycline chemotherapeutics epirubicin (Epi) and @GENE$ (Dox).
48	CPRFalse	Hepatic activities of 7-ethoxyresorufin-O-deethylase, 7-pentoxyresorufin-O-depentylase, and @CHEM-GENE$, but not midazolam hydroxylase were also elevated.
49	CPR:9	"We found that reduction of the carcinogenic @CHEMICAL$ of the aromatic amine 4-aminobiphenyl (4-ABP; found in cigarette smoke) and the heterocyclic amine 2-amino-1-methyl-6-phenylimidazo [4,5-b] pyridine (PhIP; found in grilled meats) was indeed catalyzed by a purified system containing only @GENE$ and cyt b5."
50	CPRFalse	In many renal diseases, transforming growth factor b (@CHEMICAL$)-stimulated canonical Smad 3 and noncanonical mechanistic target of @GENE$ (mTOR) promote increased protein synthesis and mesangial cell hypertrophy.
51	CPRFalse	The effects of amphetamine (AMPH) and cocaine (COC), for example, depend on the ability to increase @CHEMICAL$ in the synapse, by effects on either the plasma membrane transporter DAT or the vesicular transporter for monoamine storage, @GENE$.
52	CPRFalse	"The noticeable characteristic that distinguished the different classes was their size (molecular weight) differences and domain structure: Class I (P-I), the small SVMPs, have molecular masses of 20-30 kDa, contain only a pro domain and the @CHEMICAL$; Class II (P-II), the medium size SVMPs, molecular masses of 30-60 kDa, contain the pro domain, proteinase domain and disintegrin domain; Class III (P-III), the large SVMPs, have molecular masses of 60-100 kDa, contain pro, proteinase, disintegrin-like and @GENE$-rich domain structure."
53	CPRFalse	Using a proteomics approach, we demonstrate that @CHEMICAL$ kinase B (CKB) interacts with Asb-9 in a specific, @GENE$-independent manner.
54	CPRFalse	In situ hybridization data and a direct comparison of SN neurons expressing @CHEMICAL$ hydroxylase (TH) and/or the beta-gal marker for EphB1 revealed that EphB1 is not expressed in @GENE$+ neurons of pars compacta (SNc), but is restricted to neurons in pars reticulata (SNr).
55	CPRFalse	In this study, we assessed the effects of clopidogrel and clarithromycin, known CYP2B6 and @CHEMICAL$ inhibitors, respectively, on the enantioselective disposition of @GENE$ in conjunction with CYP2B6 polymorphisms in humans.
56	CPRFalse	In addition, @CHEMICAL$ inhibited the transcriptional activity of NFAT without interfering with the calcium-induced @GENE$ dephosphorylation event, which represents the major signaling pathway for its activation.
57	CPRFalse	Promoter and electromobility shift assays showed that transcriptional activation of NF-kB was significantly reduced by @CHEMICAL$ treatment, while @GENE$ was not.
58	CPRFalse	DRF 2655 showed body-weight lowering and euglycemic and hypolipidemic effects in various animal models. db/db mice treated with DRF 2655 showed 5- and 3.6-fold inhibition in phosphoenolpyruvate carboxykinase and @CHEMICAL$ activity and 651% and 77% increases in the beta-oxidation enzymes carnitine palmitoyltransferase and @GENE$ acetyltransferase, respectively.
59	CPR:4	Similar to gemfibrozil, clofibrate, another @CHEMICAL$ drug, also inhibited the expression of @GENE$.
60	CPRFalse	Structural features of the central cannabinoid CB1 receptor involved in the binding of the specific CB1 antagonist @CHEMICAL$. The antagonist SR 141716A has a high specificity for the central CB1 @GENE$ and negligeable affinity for the peripheral CB2 receptor, making it an excellent tool for probing receptor structure-activity relationships.
61	CPRFalse	"In DM groups, SOD activity, @CHEMICAL$ mRNA and protein levels were reduced, @GENE$ content was increased compared with control group; which decreased further as diabetes progressed."
62	CPR:4	Catecholamines (adrenaline, noradrenaline and @CHEMICAL$) are potent inhibitors of phenylalanine 4-monooxygenase (phenylalanine hydroxylase, @GENE$).
63	CPRFalse	We have expressed and characterized recombinant, @CHEMICAL$-terminally His-tagged @GENE$.
64	CPR:4	However, @CHEMICAL$ at low concentrations causes slow inhibition of GluR5 kainate receptor-mediated synaptic currents in the basolateral amygdala, indicating that it may protect against seizures, at least in part, through suppression of @GENE$ kainate receptor responses.
65	CPRFalse	Transduction with constitutively active forms of @CHEMICAL$ could protect against the downregulation of p65 and upregulation of cleaved-PARP that are induced by @GENE$ treatment.
66	CPR:4	FCEO significantly inhibited nitric oxide (@CHEMICAL$) and prostaglandin E2 (PGE2) by suppressing the protein expression of inducible nitric oxide synthase (@GENE$) and cyclooxygenase (COX)-2, respectively.
67	CPRFalse	Rec 15/2739, @CHEMICAL$, SL 89,0591, (+)- and (-)- tamsulosin showed selectivity for @GENE$ relative to the alpha 1B subtype.
68	CPRFalse	There was also an increase in c-kit, Trio, Rho-A, Rac-3, @CHEMICAL$, Notch-4, Dvl-2, Ezrin, beta catenin and mutant p53 protein expression in the @GENE$-treated cells.
69	CPRFalse	PURPOSE: Testosterone-to-@CHEMICAL$ ratio levels in infertile men improve during treatment with the @GENE$ inhibitor, testolactone, and resulting changes in semen parameters.
70	CPRFalse	"Present results of point mutations of full-length PDE5 showed that maximum catalysis was decreased 2650-fold in H613A and 55-fold in F820A. Catalytic-site affinities for cGMP, vardenafil, @CHEMICAL$, tadalafil, or 3-isobutyl-1-methylxanthine (IBMX) were respectively weakened 14-, 123-, 30-, 51-, and 43-fold for @GENE$; 63-, 511-, 43-, 95- and 61-fold for Q817A; and 59-, 448-, 71-, 137-, and 93-fold for F820A."
71	CPR:4	Thus, @CHEMICAL$ may inhibit tumor growth by a dual mechanism, acting either directly on the tumor (through inhibition of Raf and Kit signaling) and/or on tumor angiogenesis (through inhibition of VEGFR and @GENE$ signaling).
72	CPRFalse	OBJECTIVES: In this paper we investigated the effect of @CHEMICAL$, acetazolamide and their combination in vitro and in vivo on carbonic anhydrase (@GENE$) isozymes.
73	CPRFalse	Pelargonidin activates the AhR and induces CYP1A1 in primary human hepatocytes and human cancer cell lines HepG2 and LS174T. We examined the effects of anthocyanidins (cyanidin, delphinidin, malvidin, peonidin, petunidin, pelargonidin) on the @CHEM-GENE$ (AhR)-CYP1A1 signaling pathway in human hepatocytes, hepatic HepG2 and intestinal LS174T cancer cells.
74	CPRFalse	Three types of opioid receptors (mu, delta and kappa) represent the respective targets of the major opioid peptides (beta-endorphin, @CHEMICAL$ and @GENE$, respectively).
75	CPRFalse	EGa1-PEG functionalized nanoparticles showed a 40-fold higher binding to EGFR-positive @CHEMICAL$ squamous head and neck cancer cells in comparison to PEGylated nanoparticles. 17864-L(x) loaded EGa1-PEG nanoparticles were internalized by @GENE$-mediated endocytosis and ultimately digested in lysosomes.
76	CPR:9	Using a transient heterologous cell expression system, we find that the transport activities of the @CHEMICAL$ variant towards substrates @GENE$ and rosuvastatin are similar to the well-characterized full length variant.
77	CPRFalse	The effects of CDCA and @CHEMICAL$ on expression of @GENE$ and MUC2 were abolished by guggulsterone.
78	CPRFalse	In contrast, intrathecal injection of a non-selective NMDA antagonist, @CHEMICAL$, significantly inhibited CCI-induced mechanical allodynia at a dose of 300 nmol, indicating the difference in the site of action between the non-selective NMDA antagonist and the NR2B-specific @GENE$ antagonist.
79	CPRFalse	@CHEMICAL$ activates the AhR and induces CYP1A1 in primary human hepatocytes and human cancer cell lines HepG2 and LS174T. We examined the effects of anthocyanidins (cyanidin, delphinidin, malvidin, peonidin, petunidin, pelargonidin) on the aryl hydrocarbon receptor (@GENE$)-CYP1A1 signaling pathway in human hepatocytes, hepatic HepG2 and intestinal LS174T cancer cells.
80	CPRFalse	The studies with dThyd rescue from cyclin E-cdk2 protein overexpression and growth inhibition by Tomudex indicate that increased cyclin E-cdk2 protein expression is associated with effective inhibition of @CHEM-GENE$ and resultant dNTP pool imbalance.
81	CPRFalse	We studied null mutant mice for six different @CHEM-GENE$).
82	CPRFalse	The role of drug metabolism in gemcitabine cytotoxicity was examined with inhibitors of @CHEMICAL$ kinase (dCK), 5'-nucleotidase, and cytidine deaminase, whereas the role of pemetrexed targets, thymidylate synthase (TS), dihydrofolate reductase (DHFR), and glycinamide ribonucleotide formyltransferase (@GENE$) in drug chemosensitivity was analyzed in cytotoxicity rescue studies.
83	CPR:4	Other @CHEMICAL$ inhibitors, including @GENE$, with superior properties in terms of specificity of action and low risk of adverse effects, have now been introduced.
84	CPR:9	They all expressed ASS, but not ornithine transcarbamylase (OTC), the enzyme that converts ornithine, the product of degradation of arginine with @CHEMICAL$, to @GENE$, which is converted back to arginine via ASS.
85	CPR:9	We examined the N-demethylation of individual @CHEMICAL$ enantiomers using human liver microsomes (HLMs) genotyped for the @GENE$ allele, insect cell expressed recombinant CYP2B6 and CYP3A4 enzymes and COS-1 cell expressed recombinant CYP2B6.1 and CYP2B6.6 protein variant.
86	CPRFalse	A @CHEMICAL$ gene isolated from Ochrobactrum anthropi has also been employed to encode @GENE$ oxidoreductase to detoxify glyphosate in plants.
87	CPRFalse	Phenylephrine elicited a concentration-dependent positive inotropic effect via @CHEMICAL$ in the presence of either @GENE$ or S(-)-timolol.
88	CPRFalse	The inhibitory effects of iloprost on @CHEMICAL$ expression were also potentiated by isobutylmethylxanthine and mimicked by forskolin and dibutyryl cyclic AMP but not @GENE$.
89	CPRFalse	Alkaptonuria, a rare autosomal recessive disorder caused by mutations in the HGD gene and deficiency of @CHEM-GENE$, is characterized by ochronosis, arthritis, and daily excretion of gram quantities of homogentisic acid (HGA).
90	CPR:4	Further, activated microglia-mediated apoptosis of PC-12 pheochromocytoma cells was significantly repressed by neoechinulin A. The molecular mechanism studies suggested that @CHEMICAL$ may block the phosphorylation of mitogen-activated protein kinase (MAPK) molecule p38, apoptosis signal-regulating kinase 1 (ASK-1) and nuclear translocation of @GENE$ (NF-kB) p65 and p50 subunits.
91	CPRFalse	Bovine tracheal smooth muscle strips were incubated with 10 microM fenoterol or vehicle for various periods of time (5, 30 min, 18 h) at 37 degrees C. After extensive washout (3 h, 37 degrees C), isometric contractions were measured to the full muscarinic receptor agonist @CHEMICAL$, the partial @GENE$ agonist 4-(m-chlorophenyl-carbamoyloxy)-2-butynyltrimethylammonium (McN-A-343) and histamine.
92	CPRFalse	"The effects of D-1997 in the basilar artery were not modified by incubation with either the 5-HT2 receptor antagonist ketanserin (0.01-1 microM), the 5-HT3 and @CHEMICAL$ receptor antagonist ICS205930 (tropisetron; 0.1-10 microM), the 5-HT1A receptor antagonist @GENE$ (0.01-1 microM), the beta-adrenoceptor blocker with high affinity for 5-HT1A and 5-HT1B binding sites (+/-)-pindolol (0.01-1 microM), or the alpha 1-adrenoceptor antagonist prazosin (0.01-1 microM)."
93	CPRFalse	Pharmacogenetic analysis of two genes, the warfarin metabolic enzyme CYP2C9 and @CHEMICAL$ target enzyme, vitamin K epoxide reductase complex 1 @GENE$, confirmed their influence on warfarin maintenance dose.
94	CPR:4	Moreover, the rank order for potency in inhibiting acetylcholinesterase (ambenonium>neostigmine=physostigmine =tacrine>pyridostigmine=edrophonium=galanthamine >@CHEMICAL$>parathion>gramine) indicated that the most effective inhibitors of @GENE$ also displaced [3H]-oxotremorine-M to the greatest extent.
95	CPR:9	We also shortly discuss the ongoing debate on whether @CHEMICAL$ is the actual reaction product of @GENE$ catalysis, as well as the phenomenon of NO-mediated autoinhibition.
96	CPRFalse	We report herein the location of the binding site for the inhaled anesthetic @CHEMICAL$ at the amino acid residue level of resolution in the ligand binding cavity in a prototypical G protein-coupled receptor, @GENE$.
