971	DDI-false	Etonogestrel may interact with the following medications: acetaminophen (Tylenol), antibiotics such as ampicillin and tetracycline, anticonvulsants (Dilantin, Phenobarbital, Tegretol, @DRUG$, Topamax, Felbatol), antifungals (Gris-PEG, Nizoral, Sporanox), atorvastatin (Lipitor), clofibrate (@DRUG$), cyclosporine (Neoral, Sandimmune), HIV drugs classified as protease inhibitors (Agenerase, Crixivan, Fortovase, Invirase, Kaletra, Norvir, Viracept), morphine (Astramorph, Kadian, MS Contin), phenylbutazone, prednisolone (Prelone), rifadin (rifampin), St. Johns wort, temazepam, theophylline (Theo-Dur), and vitamin C.
972	DDI-false	Cimetidine: @DRUG$ plasma concentrations and LDL-C reduction were not altered by coadministration of @DRUG$.
973	DDI-false	In vitro displacement studies with highly protein-bound drugs such as furosemide, propranolol, captopril, nicardipine, pravastatin, glyburide, @DRUG$, @DRUG$, acetylsalicylic acid, tolbutamide, and metformin showed no influence on the extent of nateglinide protein binding.
974	DDI-mechanism	Hormonal contraceptives Co-administration of @DRUG$ with an oral @DRUG$ has been shown to influence the plasma concentrations of the two hormonal components, ethinylestradiol (EE) and levonorgestrel (LNG).
975	DDI-false	The principal drugs given (number of patients in parentheses) were: cardiac glycosides (115), sedatives and @DRUG$ (103), coronary vasodilators (52), oral hypoglycemics (45), cough and cold preparations (45), NSAIDs (38), antihyperlipidemics (29), antigout drugs (24), oral contraceptives (18), bronchodilators (13), @DRUG$ (10), and beta blockers (10).
976	DDI-false	Etonogestrel may interact with the following medications: acetaminophen (Tylenol), antibiotics such as ampicillin and tetracycline, anticonvulsants (Dilantin, Phenobarbital, Tegretol, Trileptal, Topamax, Felbatol), antifungals (Gris-PEG, Nizoral, Sporanox), atorvastatin (Lipitor), clofibrate (Atromid-S), cyclosporine (Neoral, Sandimmune), HIV drugs classified as protease inhibitors (@DRUG$, Crixivan, Fortovase, Invirase, Kaletra, Norvir, Viracept), morphine (Astramorph, @DRUG$, MS Contin), phenylbutazone, prednisolone (Prelone), rifadin (rifampin), St. Johns wort, temazepam, theophylline (Theo-Dur), and vitamin C.
977	DDI-false	The principal drugs given (number of patients in parentheses) were: cardiac glycosides (115), sedatives and hypnotics (103), coronary vasodilators (52), oral hypoglycemics (45), cough and cold preparations (45), NSAIDs (38), antihyperlipidemics (29), @DRUG$ (24), oral contraceptives (18), @DRUG$ (13), insulin (10), and beta blockers (10).
978	DDI-advise	However, because bleeding has been reported when ibuprofen and other nonsteroidal anti-inflammatory agents have been administered to patients on coumarin-type anticoagulants, the physician should be cautious when administering @DRUG$ to patients on @DRUG$.
979	DDI-false	A similar association, though less marked, has been suggested with barbiturates, phenylbutazone, @DRUG$, carbamazepine, griseofulvin, topiramate, and possibly with @DRUG$ and tetracyclines 72.
980	DDI-false	When used in therapeutic doses, azithromycin had a modest effect on the pharmacokinetics of atorvastatin, carbamazepine, cetirizine, didanosine, efavirenz, fluconazole, indinavir, @DRUG$, rifabutin, sildenafil, theophylline (intravenous and oral), triazolam, @DRUG$/sulfamethoxazole or zidovudine.
981	DDI-false	- @DRUG$ (e.g., @DRUG$) Use of sulfapyridine with these medicines may increase the chance of side effects of these medicines
982	DDI-false	Due to high inter-patient variability and limited sampling, the extent of the increase in @DRUG$ levels in patients receiving concurrent @DRUG$ and AVASTIN is uncertain.
983	DDI-false	"Before taking glimepiride, tell your doctor if you are taking any of the following medicines: - aspirin or another salicylate such as magnesium/choline salicylate (Trilisate), @DRUG$ (Disalcid, others), choline salicylate (Arthropan), @DRUG$ (Magan), or bismuth subsalicylate (Pepto-Bismol);"
984	DDI-false	Reports in the literature suggest that plasma levels of doxorubicin (and its active metabolite @DRUG$) may be increased when paclitaxel and @DRUG$ are used in combination.
985	DDI-effect	Drug Interactions: The central anticholinergic syndrome can occur when anticholinergic agents such as @DRUG$ are administered concomitantly with drugs that have secondary anticholinergic actions, e.g., certain narcotic analgesics such as @DRUG$, the phenothiazines and other antipsychotics, tricyclic antidepressants, certain antiarrhythmics such as the quinidine salts, and antihistamines.
986	DDI-false	Etonogestrel may interact with the following medications: acetaminophen (@DRUG$), antibiotics such as ampicillin and tetracycline, anticonvulsants (Dilantin, Phenobarbital, Tegretol, Trileptal, Topamax, Felbatol), antifungals (Gris-PEG, Nizoral, Sporanox), atorvastatin (Lipitor), clofibrate (@DRUG$), cyclosporine (Neoral, Sandimmune), HIV drugs classified as protease inhibitors (Agenerase, Crixivan, Fortovase, Invirase, Kaletra, Norvir, Viracept), morphine (Astramorph, Kadian, MS Contin), phenylbutazone, prednisolone (Prelone), rifadin (rifampin), St. Johns wort, temazepam, theophylline (Theo-Dur), and vitamin C.
987	DDI-mechanism	In a study involving healthy subjects receiving @DRUG$ and @DRUG$ concurrently, plasma flecainide levels were increased about 20% and propranolol levels were increased about 30% compared to control values.
988	DDI-false	Interactions may also occur with the following: anti-depressants/anti-anxiety drugs, drugs used to treat an overactive thyroid, @DRUG$ (e.g., propranolol), @DRUG$, grepafloxacin, guanethidine, guanadrel, metrizamide, cabergoline, lithium, narcotic pain medication (e.g., codeine), drugs used to aid sleep, drowsiness-causing antihistamines (e.g., diphenhydramine), any other drugs that may make you drowsy.
989	DDI-false	During clinical trials, iloprost was used concurrently with anticoagulants, diuretics, cardiac glycosides, @DRUG$, analgesics, @DRUG$, nonsteroidal antiinflammatories, corticosteroids, and other medications.
990	DDI-false	Similarly, nateglinide had no influence on the serum protein binding of @DRUG$, glyburide, @DRUG$, warfarin, phenytoin, acetylsalicylic acid, and tolbutamide in vitro .
991	DDI-false	Concurrent use of @DRUG$ increases the metabolic clearance of ZEBETA, resulting in a shortened elimination half-life of @DRUG$.
992	DDI-false	The following are examples of substances that may reduce the blood-glucose-lowering effect of insulin: @DRUG$, danazol, diuretics, sympathomimetic agents (e.g., epinephrine, albuterol, terbutaline), isoniazid, phenothiazine derivatives, @DRUG$, thyroid hormones, estrogens, progestogens (e.g., in oral contraceptives).
993	DDI-false	Caution should be used when administering or taking TARCEVA with ketoconazole and other strong CYP3A4 inhibitors such as, but not limited to, atazanavir, @DRUG$, indinavir, itraconazole, @DRUG$, nelfinavir, ritonavir, saquinavir, telithromycin, troleandomycin (TAO), and voriconazole .
994	DDI-false	"Interactions for vitamin D analogues (@DRUG$, Vitamin D3, @DRUG$, and Calcidiol): Cholestyramine: Cholestyramine has been reported to reduce intestinal absorption of fat soluble vitamins;"
995	DDI-false	@DRUG$: Magnesium-containing preparations (eg, antacids) may cause hypermagnesemia and should therefore not be taken during therapy with @DRUG$ by patients on chronic renal dialysis.
996	DDI-effect	Because @DRUG$ may enhance the serotonergic effects of @DRUG$, caution should be exercised when LEXAPRO and lithium are coadministered.
997	DDI-false	Insulin: A clinical study in 6 insulin-dependent diabetic patients demonstrated no effect of EXTRANEAL on insulin absorption from the peritoneal cavity or on insulins ability to control blood glucose when @DRUG$ was administered intraperitoneally with @DRUG$.
998	DDI-false	In vivo interaction studies in humans have demonstrated that @DRUG$ and warfarin do not affect the PK properties of anagrelide, nor does @DRUG$ affect the PK properties of digoxin or warfarin.
999	DDI-false	Other drugs which may enhance the neuromuscular blocking action of nondepolarizing agents such as NUROMAX include certain antibiotics (e. g., aminoglycosides, tetracyclines, @DRUG$, polymyxins, lincomycin, clindamycin, colistin, and sodium colistimethate), @DRUG$ salts, lithium, local anesthetics, procainamide, and quinidine.
1000	DDI-false	cimetidine) and many that are substrates for P450 2D6 (many other antidepressants, @DRUG$, and the Type 1C antiarrhythmics propafenone and @DRUG$).
1001	DDI-false	In a study involving healthy subjects receiving @DRUG$ and propranolol concurrently, plasma @DRUG$ levels were increased about 20% and propranolol levels were increased about 30% compared to control values.
1002	DDI-false	Nonetheless, the range of individual Simulect clearance values in the presence of @DRUG$ (12-57 mL/h) or @DRUG$ (7-54 mL/h) did not extend outside the range observed with dual therapy (10-78 mL/h).
1003	DDI-false	Etonogestrel may interact with the following medications: acetaminophen (Tylenol), antibiotics such as ampicillin and tetracycline, anticonvulsants (Dilantin, @DRUG$, Tegretol, Trileptal, Topamax, Felbatol), antifungals (Gris-PEG, Nizoral, Sporanox), atorvastatin (Lipitor), clofibrate (Atromid-S), cyclosporine (Neoral, Sandimmune), HIV drugs classified as protease inhibitors (@DRUG$, Crixivan, Fortovase, Invirase, Kaletra, Norvir, Viracept), morphine (Astramorph, Kadian, MS Contin), phenylbutazone, prednisolone (Prelone), rifadin (rifampin), St. Johns wort, temazepam, theophylline (Theo-Dur), and vitamin C.
1004	DDI-false	Initial doses of adrenergic agents, such as @DRUG$ or @DRUG$, should be reduced and titrated to achieve the desired response.
1005	DDI-false	@DRUG$: @DRUG$ has been reported to cause coronary artery vasospasm, and its effect could be additive with D.H.E. 45  (dihydroergotamine mesylate) Injection, USP.
1006	DDI-false	The possibility of hypotensive effects with @DRUG$ or enalaprilat can be minimized by either discontinuing the diuretic or increasing the salt intake prior to initiation of treatment with enalapril or @DRUG$.
1007	DDI-false	May interact with the following: @DRUG$ (these medicines may make your condition worse and prevent the adrenergic bronchodilators from working properly) and disopyramide, quinidine, @DRUG$, and procainamide (these medicines may increase the risk of heart problems).
1008	DDI-effect	Although there are no study data to evaluate the possibility, nitric oxide donor compounds, including sodium nitroprusside and @DRUG$, may have an additive effect with @DRUG$ on the risk of developing methemoglobinemia.
1009	DDI-false	In vitro displacement studies with highly protein-bound drugs such as furosemide, propranolol, captopril, @DRUG$, pravastatin, @DRUG$, warfarin, phenytoin, acetylsalicylic acid, tolbutamide, and metformin showed no influence on the extent of nateglinide protein binding.
1010	DDI-false	- @DRUG$ and colestipol @DRUG$: Cholestytamine and colestipol resins have the potential of binding thiazide diuretics and reducing diuretic absorption from the gastrointestinal tract
1011	DDI-false	The following are examples of substances that may reduce the blood-glucose-lowering effect of insulin: corticosteroids, danazol, diuretics, sympathomimetic agents (e.g., epinephrine, albuterol, @DRUG$), isoniazid, phenothiazine derivatives, somatropin, thyroid hormones, estrogens, @DRUG$ (e.g., in oral contraceptives).
1012	DDI-false	Etonogestrel may interact with the following medications: acetaminophen (Tylenol), antibiotics such as ampicillin and tetracycline, anticonvulsants (Dilantin, Phenobarbital, Tegretol, Trileptal, Topamax, Felbatol), antifungals (Gris-PEG, Nizoral, Sporanox), atorvastatin (Lipitor), clofibrate (Atromid-S), cyclosporine (Neoral, Sandimmune), HIV drugs classified as protease inhibitors (@DRUG$, Crixivan, Fortovase, Invirase, Kaletra, Norvir, Viracept), morphine (Astramorph, @DRUG$, MS Contin), phenylbutazone, prednisolone (Prelone), rifadin (rifampin), St. Johns wort, temazepam, theophylline (Theo-Dur), and vitamin C.
1013	DDI-false	Valdecoxib caused a statistically significant increase in plasma exposures of R-warfarin and @DRUG$ (12% and 15%, respectively), and in the pharmacodynamic effects (prothrombin time, measured as INR) of @DRUG$.
1014	DDI-false	Although no specific drug interactions with topical glaucoma drugs or systemic medications were identified in clinical studies of IOPIDINE 0.5% Ophthalmic Solution, the possibility of an additive or potentiating effect with @DRUG$ (alcohol, barbiturates, @DRUG$, sedatives, anesthetics) should be considered.
1015	DDI-false	Etonogestrel may interact with the following medications: acetaminophen (Tylenol), antibiotics such as ampicillin and tetracycline, anticonvulsants (Dilantin, Phenobarbital, Tegretol, @DRUG$, Topamax, Felbatol), antifungals (Gris-PEG, Nizoral, Sporanox), atorvastatin (Lipitor), clofibrate (Atromid-S), cyclosporine (Neoral, Sandimmune), HIV drugs classified as protease inhibitors (Agenerase, Crixivan, Fortovase, Invirase, Kaletra, Norvir, Viracept), morphine (Astramorph, Kadian, MS Contin), phenylbutazone, @DRUG$ (Prelone), rifadin (rifampin), St. Johns wort, temazepam, theophylline (Theo-Dur), and vitamin C.
1016	DDI-false	- Drugs that may decrease plasma phenytoin concentrations include: @DRUG$, chronic alcohol abuse, @DRUG$
1017	DDI-false	@DRUG$ (e.g., spironolactone, triamterene, or amiloride), @DRUG$ supplements, or potassium-containing salt substitutes may lead to significant increases in serum potassium.
1018	DDI-effect	@DRUG$ sometimes proves to be fatal when used in combination with @DRUG$.
1019	DDI-false	"- a sulfa-based drug such as sulfamethoxazole-trimethoprim (@DRUG$, Septra), sulfisoxazole (Gantrisin), or sulfasalazine (@DRUG$);"
1020	DDI-effect	@DRUG$ alone had no effect on platelet aggregation, but did slightly enhance the inhibition of platelet aggregation by @DRUG$.
1021	DDI-false	@DRUG$: In a clinical pharmacology study, coadministration of an antacid (aluminum hydroxide, magnesium hydroxide, and @DRUG$) with fosinopril reduced serum levels and urinary excretion of fosinoprilat as compared with fosinopril administered alone, suggesting that antacids may impair absorption of fosinopril.
1022	DDI-effect	@DRUG$ (phenylbutazone, oxyphenbutazone, and possibly dipyrone): Concomitant administration with @DRUG$ may increase the risk of gastrointestinal ulceration.
1023	DDI-false	Tell your doctor if you are taking any of the following drugs: blood thinners (Coumadin) other antidepressants metoprolol antihistamines @DRUG$ (Tegretol) cimetidine (Tagamet) estrogens fluoxetine (Prozac) intraconazole (Sporanox) ketoconazole (Nizoral) levodopa @DRUG$ muscle relaxants birth control pills sleeping pills thyroid medications
1024	DDI-false	"@DRUG$, such as @DRUG$ and isoproterenol;"
1025	DDI-effect	ACE inhibitors: Reports suggest that @DRUG$ may diminish the antihypertensive effect of @DRUG$.
1026	DDI-false	propranolol to healthy volunteers under steady-state conditions had no relevant effect on either drug s bioavailability, AUC and Cmax, differences were  20% between @DRUG$ given singly and in combination with @DRUG$, and between propranolol given singly and in combination with isradipine.
1027	DDI-effect	In ewes given 40 mg of @DRUG$/kg for 5 days intraperitoneally (IP), the anticholinesterase effect of 4 mg of @DRUG$/kg was significantly reduced and signs of toxicity were not present.
1028	DDI-false	Chlorotrianisene may interact with antidepressants, aspirin, barbiturates, bromocriptine, calcium supplements, corticosteroids, corticotropin, cyclosporine, dantrolene, @DRUG$, @DRUG$, tamoxifen, and warfarin.
1029	DDI-int	@DRUG$ may interact with acetaminophen (e.g., Tylenol), chloramphenicol (e.g., Chloromycetin), local anesthetics (e.g., benzocaine and @DRUG$), para-aminobenzoic acid (PABA)-containing preparations (e.g., sunscreens and some multivitamins), procainamide (e.g., Pronestyl), sulfonamides (sulfa medicines), thiazide diuretics (use of these medicines during the test period will affect the test results), and pancreatic supplements (use of pancreatic supplements may give false test results).
1030	DDI-false	Administration of repeat doses of @DRUG$ had no effect on the repeat dose pharmacokinetics of @DRUG$, digoxin or an ethinylestradiol/levonorgestrol oral contraceptive product in healthy subjects.
1031	DDI-false	"- a nonsteroidal anti-inflammatory drug (NSAID) such as ibuprofen (Motrin, Advil, Nuprin, others), ketoprofen (Orudis, Orudis KT, Oruvail), diclofenac (Voltaren, Cataflam), @DRUG$ (Lodine), indomethacin (Indocin), @DRUG$ (Relafen), oxaprozin (Daypro), and naproxen (Anaprox, Naprosyn, Aleve);"
1032	DDI-false	@DRUG$: Elevated serum levels of cyclosporine have been reported with concomitant use of cyclosporine with other members of the @DRUG$.
1033	DDI-false	Lithium: NSAIDs have produced an elevation of plasma @DRUG$ levels and a reduction in renal @DRUG$ clearance.
1034	DDI-false	However, patients on @DRUG$ may show elevations of @DRUG$ concentrations after initiation of therapy with FLOLAN, which may be clinically significant in patients prone to digoxin toxicity.
1035	DDI-false	Also, concomitant administration of quinolones with products containing @DRUG$, multivitamins containing @DRUG$, or Videx (didanosine) chewable/buffered tablets or the pediatric powder for oral solution may result in low urine levels.
1036	DDI-false	The following medications have been administered in clinical trials with Simulect with no increase in adverse reactions: ATG/ALG, azathioprine, corticosteroids, @DRUG$, mycophenolate mofetil, and @DRUG$.
1037	DDI-false	@DRUG$, @DRUG$ and phenytoin concentrations.
1038	DDI-false	In addition to bleeding associated with heparin and @DRUG$, drugs that alter platelet function (such as acetylsalicylic acid, @DRUG$ and Abciximab) may increase the risk of bleeding if administered prior to, during, or after Activase therapy.
1039	DDI-effect	Dose-response curves (derived from the results of using the tablets as well as pure powders) showed that @DRUG$ was responsible for the inhibitory activity, which was partially antagonized by @DRUG$.
1040	DDI-false	Although trough @DRUG$ plasma levels were unaffected, given the enzyme-inducing properties of carbamazepine, the possibility that carbamazepine might increase the clearance of @DRUG$ should be considered if the two drugs are coadministered.
1041	DDI-false	When used in therapeutic doses, azithromycin had a modest effect on the pharmacokinetics of atorvastatin, carbamazepine, cetirizine, didanosine, efavirenz, @DRUG$, indinavir, midazolam, rifabutin, sildenafil, @DRUG$ (intravenous and oral), triazolam, trimethoprim/sulfamethoxazole or zidovudine.
1042	DDI-false	@DRUG$ did not have a statistically significant effect on the pharmacokinetics of @DRUG$ (a CYP 2C9 and CYP 2C19 substrate).
1043	DDI-false	Dopamine Antagonists: Since apomorphine is a @DRUG$, it is possible that dopamine antagonists, such as the neuroleptics (phenothiazines, butyrophenones, @DRUG$) or metoclopramide, may diminish the effectiveness of APOKYN.
1044	DDI-false	@DRUG$: The concomitant use of DURAGESIC  (fentanyl transdermal system) with other central nervous system depressants, including but not limited to other opioids, sedatives, hypnotics, tranquilizers (e.g., benzodiazepines), general @DRUG$, phenothiazines, skeletal muscle relaxants, and alcohol, may cause respiratory depression, hypotension, and profound sedation, or potentially result in coma or death.
1045	DDI-false	Additive adverse effects resulting from cholinergic blockade may occur when LEVSIN is administered concomitantly with other @DRUG$, amantadine, haloperidol, @DRUG$, monoamine oxidase (MAO) inhibitors, tricyclic antidepressants or some antihistamines.
1046	DDI-false	Combination of amiodarone with other @DRUG$ therapy should be reserved for patients with life-threatening ventricular arrhythmias who are incompletely responsive to a single agent or incompletely responsive to @DRUG$.
1047	DDI-false	Acidifying agents: @DRUG$ (guanethidine, @DRUG$, glutamic acid HCl, ascorbic acid, fruit juices, etc.) lower absorption of amphetamines.
1048	DDI-false	@DRUG$: @DRUG$  causes a decrease in the steady-state carbamazepine plasma concentrations and an increase in the steady-state carbamazepine epoxide plasma concentration.
1049	DDI-false	@DRUG$ May Have a Clinically Important Interaction with the Following Other Drugs: Alcohol: When Duloxetine and ethanol were administered several hours apart so that peak concentrations of each would coincide, @DRUG$ did not increase the impairment of mental and motor skills caused by alcohol.
1050	DDI-false	Glyburide: @DRUG$ has no apparent pharmacokinetic interaction when administered with @DRUG$.
1051	DDI-false	Because of the potential for @DRUG$ levels to continue to increase with multiple dosing, caution should be used if patients are to be receiving both @DRUG$ and rifampin.
1052	DDI-false	Use lowest possible dose of atorvastatin with careful monitoring, or consider @DRUG$ that are not primarily metabolized by CYP3A4, such as pravastatin, fluvastatin, or @DRUG$ in combination with CRIXIVAN.
1053	DDI-false	Etonogestrel may interact with the following medications: acetaminophen (Tylenol), antibiotics such as ampicillin and tetracycline, anticonvulsants (Dilantin, Phenobarbital, Tegretol, Trileptal, Topamax, Felbatol), antifungals (Gris-PEG, Nizoral, Sporanox), atorvastatin (Lipitor), clofibrate (Atromid-S), cyclosporine (Neoral, Sandimmune), HIV drugs classified as protease inhibitors (Agenerase, @DRUG$, Fortovase, Invirase, Kaletra, Norvir, Viracept), morphine (Astramorph, Kadian, MS Contin), phenylbutazone, prednisolone (Prelone), rifadin (rifampin), St. Johns wort, temazepam, theophylline (Theo-Dur), and @DRUG$.
1054	DDI-false	Effects of Felbatol  on Low-Dose Combination Oral Contraceptives A group of 24 nonsmoking, healthy white female volunteers established on an oral @DRUG$ regimen containing 30 mg @DRUG$ and 75 mg gestodene for at least 3 months received 2400 mg/day of felbamate from midcycle (day 15) to midcycle (day 14) of two consecutive oral contraceptive cycles.
1055	DDI-false	Benzodiazepines: Combination hormonal contraceptives may decrease the clearance of some benzodiazepines (@DRUG$, chlordiazepoxide, diazepam) and increase the clearance of others (@DRUG$, oxazepam, temazepam).
1056	DDI-false	@DRUG$ (e.g., @DRUG$, trimethoprim and sulfamethoxazole, amoxicillin).
1057	DDI-false	"- a nonsteroidal anti-inflammatory drug (NSAID) such as ibuprofen (Motrin, Advil, Nuprin, others), ketoprofen (Orudis, Orudis KT, @DRUG$), diclofenac (Voltaren, Cataflam), @DRUG$ (Lodine), indomethacin (Indocin), nabumetone (Relafen), oxaprozin (Daypro), and naproxen (Anaprox, Naprosyn, Aleve);"
1058	DDI-false	Cholestyramine resin may delay or reduce the absorption of concomitant oral medication such as phenylbutazone, @DRUG$, @DRUG$ (acidic) or propranolol (basic), as well as tetracycline penicillin G, phenobarbital, thyroid and thyroxine preparations, estrogens and progestins, and digitalis.
1059	DDI-effect	Particular caution should be observed with @DRUG$ since there are conflicting results for the effect of @DRUG$ on the availability of digoxin and digitoxin.
1060	DDI-effect	Using @DRUG$ with @DRUG$ (heart medicine) may cause hypercalcemia (too much calcium in the blood), which could increase the chance of developing an irregular heartbeat.
1061	DDI-effect	The peripheral vasoconstriction caused by high doses of @DRUG$ is antagonized by @DRUG$.
1062	DDI-false	@DRUG$ or Verapamil: The risk of myopathy/rhabdomyolysis is increased when either amiodarone or @DRUG$ is used concomitantly with a closely related member of the HMG-CoA reductase inhibitor class (see WARNINGS, Myopathy/Rhabdomyolysis).
1063	DDI-false	Drug/Laboratory Test Interactions The following drugs or moieties are known to interfere with laboratory tests performed in patients on thyroid hormone therapy: androgens, @DRUG$, estrogens, oral contraceptives containing @DRUG$, iodine-containing preparations and the numerous preparations containing salicylates.
1064	DDI-false	Co-administration of @DRUG$ at steady-state with a single dose of @DRUG$.
1065	DDI-false	@DRUG$- and aluminum-containing @DRUG$, administered concomitantly with lomefloxacin, significantly decreased the bioavailability (48%) of lomefloxacin.
1066	DDI-false	Therefore, co-administration of Duloxetine with other drugs that are extensively metabolized by this isozyme and which have a narrow therapeutic index, including certain antidepressants (tricyclic antidepressants [@DRUG$], such as nortriptyline, @DRUG$, and imipramine), phenothiazines and Type 1C antiarrhythmics (e.g., propafenone, flecainide), should be approached with caution.
1067	DDI-false	For @DRUG$ AUC(0-infinity), AUC(0-24), and Cmax, the geometric mean ratios (90% confidence interval) for (rofecoxib + digoxin/placebo + @DRUG$) were 1.04 (0.94, 1.14), 1.02 (0.94, 1.09), and 1.00 (0.91, 1.10), respectively.
1068	DDI-false	Certain @DRUG$, especially neomycin, streptomycin and @DRUG$, have a mild but definite nondepolarizing blocking action which may accentuate neuromuscular block.
1069	DDI-false	@DRUG$: @DRUG$ may inhibit both synthetic and catabolic enzymes of vitamin D.
1070	DDI-false	@DRUG$ - Although not reported, @DRUG$, via its metabolism to histamine, might decrease the efficacy of H1 and H2 blockers.
1071	DDI-false	"@DRUG$ (NNRTIs): @DRUG$ may decrease plasma levels of combination hormonal contraceptives;"
