1983	DDI-mechanism	Agents that are CYP3A4 inhibitors that have been found, or are expected, to increase plasma levels of @DRUG$ are the following: Acetazolamide, azole antifungals, cimetidine, clarithromycin(1), @DRUG$, danazol, delavirdine, diltiazem, erythromycin(1), fluoxetine, fluvoxamine, grapefruit juice, isoniazid, itraconazole, ketoconazole, loratadine, nefazodone, niacinamide, nicotinamide, protease inhibitors, propoxyphene, quinine, quinupristin, troleandomycin, valproate(1), verapamil, zileuton.
1984	DDI-mechanism	Coadministration with compounds that are potent inducers of CYP3A4 (eg, @DRUG$, phenytoin, dexamethasone, carbamazepine) may result in decreased plasma levels of @DRUG$.
1985	DDI-advise	If these agents are to be administered concurrently, @DRUG$ concentrations should be monitored, especially when @DRUG$ therapy is initiated, adjusted, or discontinued.
1986	DDI-advise	@DRUG$ SHOULD BE USED WITH CAUTION IN THOSE PATIENTS REVEIVING @DRUG$ AND ITS CONGENERS.
1987	DDI-mechanism	Co-administration of @DRUG$, a strong inhibitor of CYP3A4, increased @DRUG$ exposure following a single 90 mg dose of Sensipar by 2.3 fold.
1988	DDI-effect	In post-marketing experience, bleeding has been reported in patients on concomitant treatment with @DRUG$ and @DRUG$.
1989	DDI-effect	Consider additive sedative effects and confusional states to emerge, if @DRUG$ is given with @DRUG$ or barbituates.
1990	DDI-effect	The use of MAO inhibitors or @DRUG$ with @DRUG$ preparations may increase the effect of either the antidepressant or hydrocodone.
1991	DDI-effect	The effectiveness of @DRUG$-only pills is reduced by hepatic enzyme-inducing drugs such as the anticonvulsants phenytoin, @DRUG$, and barbiturates, and the antituberculosis drug rifampin.
1992	DDI-effect	Since @DRUG$ and @DRUG$, including MIDAMOR, may each be associated with increased serum potassium levels, the potential effects on potassium kinetics and renal function should be considered when these agents are administered concurrently.
1993	DDI-advise	however, it adversely affected response duration suggesting that @DRUG$ should not be administered with HEXALEN and/or @DRUG$.1
1994	DDI-advise	Therefore, co-administration of @DRUG$ with drugs that are metabolized by CYP2D6 isoenzyme including certain antidepressants (e.g., nortriptyline, imipramine, desipramine, paroxetine, fluoxetine, sertraline), @DRUG$ (e.g., haloperidol, risperidone, thioridazine), beta-blockers (e.g., metoprolol), and Type 1C antiarrhythmics (e.g., propafenone, flecainide), should be approached with caution and should be initiated at the lower end of the dose range of the concomitant medication.
1995	DDI-int	@DRUG$ may interact with any of the following: - @DRUG$ (e.g., Tylenol) (with long-term, high-dose use) or
1996	DDI-effect	- The action of sulphonylureas and @DRUG$ may be enhanced by @DRUG$ or Bezalip retard.
1997	DDI-effect	Pretreatment of rats with allopurinol (100 mg/kg, ip) or @DRUG$ (100 mg/kg per day, ig, for 3 days and a dose of 40 mg/kg on the 4th day) provided significant protection against the elevation of TBARS levels in cerebral and hepatic tissues, induced by single high dose of oral @DRUG$ administration within 4 h.
1998	DDI-mechanism	Cyclosporine, Digoxin, Methotrexate Lodine, like other @DRUG$, through effects on renal prostaglandins, may cause changes in the elimination of these drugs leading to elevated serum levels of @DRUG$, digoxin, methotrexate, and increased toxicity.
1999	DDI-effect	@DRUG$ may increase slightly the effect of antihypertensive drugs, e.g., @DRUG$, methyldopa, reserpine.
2000	DDI-advise	Aripiprazole dose should be reduced to one-half of its normal dose when concomitant administration of @DRUG$ with @DRUG$ occurs.
2001	DDI-mechanism	Apparent oral clearance and volume of distribution of sirolimus decreased with 38% and 45%, respectively, when @DRUG$ was given with @DRUG$.
2002	DDI-mechanism	Cholestyramine and colestipol resins: Absorption of @DRUG$ is impaired in the presence of @DRUG$.
2003	DDI-mechanism	MAO inhibitors @DRUG$, as well as a metabolite of furazolidone, slow @DRUG$ metabolism.
2004	DDI-mechanism	Barbiturates, @DRUG$, and phenytoin decrease the half-life of @DRUG$.
2005	DDI-effect	Synergism has been shown between @DRUG$ anesthesia and intravenously administered @DRUG$.
2006	DDI-effect	@DRUG$ may increase slightly the effect of antihypertensive drugs, e.g., guanethidine, methyldopa, @DRUG$.
2007	DDI-int	@DRUG$ may interact with antidepressants, aspirin, barbiturates, bromocriptine, calcium supplements, corticosteroids, corticotropin, cyclosporine, dantrolene, @DRUG$, somatropin, tamoxifen, and warfarin.
2008	DDI-mechanism	The most commonly occurring drug interactions are listed below: - Drugs that may increase plasma @DRUG$ concentrations include: acute alcohol intake, amiodarone, chboramphenicol, chlordiazepoxide, cimetidine, diazepam, dicumarol, disulfiram, estrogens, ethosuximide, fluoxetine, H2-antagonists, @DRUG$, isoniazid, methylphenidate, phenothiazines, phenylbutazone, salicylates, succinimides, sulfonamides, tolbutamide, trazodone
2009	DDI-effect	Preliminary studies indicate that the concomitant use of @DRUG$ and @DRUG$ results in a higher cardiac output and, usually, a lower pulmonary wedge pressure than when either drug is used alone.
2010	DDI-mechanism	In addition, higher-than expected steady-state serum concentrations of @DRUG$ have been observed when therapy is initiated in patients already taking @DRUG$.
2011	DDI-int	@DRUG$ may interact with the following medications: acetaminophen (Tylenol), antibiotics such as ampicillin and @DRUG$, anticonvulsants (Dilantin, Phenobarbital, Tegretol, Trileptal, Topamax, Felbatol), antifungals (Gris-PEG, Nizoral, Sporanox), atorvastatin (Lipitor), clofibrate (Atromid-S), cyclosporine (Neoral, Sandimmune), HIV drugs classified as protease inhibitors (Agenerase, Crixivan, Fortovase, Invirase, Kaletra, Norvir, Viracept), morphine (Astramorph, Kadian, MS Contin), phenylbutazone, prednisolone (Prelone), rifadin (rifampin), St. Johns wort, temazepam, theophylline (Theo-Dur), and vitamin C.
2012	DDI-effect	The concomitant administration of @DRUG$ and other @DRUG$ have resulted in previous reports of rhabdomyolysis.
2013	DDI-effect	Increased ectopic pacemaker activity can occur when @DRUG$ is used concomitantly with @DRUG$.
2014	DDI-effect	However, another @DRUG$ has been found to produce a less than two-second increase in prothrombin time in healthy volunteers receiving low doses of @DRUG$.
2015	DDI-effect	If @DRUG$ is to be combined with other psychotropic agents such as @DRUG$ or sedative/hypnotics, careful consideration should be given to the pharmacology of the agents employed since the sedative effects of desipramine and benzodiazepines (e.g., chlordiazepoxide or diazepam) are additive.
2016	DDI-mechanism	@DRUG$, kaolin-pectin, sulfasalazine, neomycin, cholestyramine, certain anticancer drugs, and metoclopramide may interfere with intestinal @DRUG$ absorption, resulting in unexpectedly low serum concentrations.
2017	DDI-mechanism	Ritonavir: Coadministration of @DRUG$ with @DRUG$ resulted in a 152% increase in nelfinavir plasma AUC and very little change in ritonavir plasma A.C.
2018	DDI-mechanism	@DRUG$ resin may delay or reduce the absorption of concomitant oral medication such as phenylbutazone, warfarin, thiazide diuretics (acidic) or propranolol (basic), as well as tetracycline penicillin G, phenobarbital, thyroid and thyroxine preparations, @DRUG$ and progestins, and digitalis.
2019	DDI-effect	Other @DRUG$ that inhibit prostaglandin synthesis have been shown to interfere with thiazide diuretics in some studies and with @DRUG$.
2020	DDI-mechanism	Plasma concentrations (AUC 0-24 hrs) of @DRUG$ decreased 15% with coadministration of @DRUG$ relative to that observed with erythromycin alone.
2021	DDI-effect	In patients receiving nonselective monoamine oxidase inhibitors (MAOIs) (e.g., @DRUG$) in combination with serotoninergic agents (e.g., fluoxetine, fluvoxamine, paroxetine, @DRUG$, venlafaxine), there have been reports of serious, sometimes fatal, reactions.
2022	DDI-effect	In patients receiving nonselective monoamine oxidase inhibitors (@DRUG$) (e.g., selegiline hydrochloride) in combination with serotoninergic agents (e.g., fluoxetine, fluvoxamine, paroxetine, sertraline, @DRUG$), there have been reports of serious, sometimes fatal, reactions.
2023	DDI-mechanism	Concomitant use of @DRUG$ and drugs that inhibit CYP3A4 (eg, ketoconazole, itraconazole, erythromycin, clarithromycin, ritonavir, @DRUG$, indinavir, nefazodone, nelfinavir, saquinavir, telithromycin) may increase exposure to dasatinib and should be avoided.
2024	DDI-mechanism	Milk, milk products, and @DRUG$-rich foods or drugs may impair the absorption of @DRUG$.
2025	DDI-effect	Administering @DRUG$ together with @DRUG$ (100-500 microM) inhibited InsP(3)-induced responses (both Ca(2+) and current responses) in a dose-dependent fashion.
2026	DDI-mechanism	Agents that are CYP3A4 inhibitors that have been found, or are expected, to increase plasma levels of @DRUG$ are the following: Acetazolamide, azole antifungals, cimetidine, clarithromycin(1), dalfopristin, danazol, delavirdine, diltiazem, erythromycin(1), fluoxetine, fluvoxamine, grapefruit juice, isoniazid, itraconazole, ketoconazole, loratadine, nefazodone, niacinamide, nicotinamide, @DRUG$, propoxyphene, quinine, quinupristin, troleandomycin, valproate(1), verapamil, zileuton.
2027	DDI-effect	Coumarin Anticoagulants: There have been rare reports of increased prothrombin time in patients taking @DRUG$ to whom @DRUG$ was administered.
2028	DDI-mechanism	"Although specific studies have not been performed, coadministration with drugs that are mainly metabolized by CYP3A4 (eg, calcium channel blockers, dapsone, disopyramide, @DRUG$, amiodarone, quinidine, warfarin, tacrolimus, cyclosporine, ergot derivatives, pimozide, carbamazepine, fentanyl, alfentanyl, alprazolam, and triazolam) may have elevated plasma concentrations when coadministered with @DRUG$;"
2029	DDI-effect	Concurrent administration of a @DRUG$ with @DRUG$ has been associated with an increased risk of serious infections and no significant additional efficacy over use of the TNF antagonists alone.
2030	DDI-effect	When @DRUG$ was applied to the muscle in the presence of @DRUG$, both first and second contractile responses to PTX were abolished.
2031	DDI-advise	However, when any additional drug, including @DRUG$, is added to the treatment of patients on @DRUG$ therapy, the patients should be observed for alterations of the prothrombin time.
2032	DDI-effect	Imipramine: Coadministration of single doses of @DRUG$ 20 mg and @DRUG$ 75 mg produced additive effects on decreased alertness and impaired psychomotor performance for 2 to 4 hours after administration.
2033	DDI-mechanism	Furthermore it has been proposed that @DRUG$ resulted In induction of P-450IIE1 in the patients liver which, in turn, resulted in a greater proportion of the ingested @DRUG$ being converted to the toxic metabolites.
2034	DDI-mechanism	Quinidine, verapamil, amiodarone, @DRUG$, indomethacin, itraconazole, alprazolam, and spironolactone raise the serum @DRUG$ concentration due to a reduction in clearance and/or in volume of distribution of the drug, with the implication that digitalis intoxication may result.
2035	DDI-effect	Lithium: Increased serum lithium levels and symptoms of lithium toxicity have been reported in patients receiving concomitant @DRUG$ and @DRUG$ therapy.
2036	DDI-mechanism	Fluconazole: Concomitant administration of @DRUG$ at 200 mg QD resulted in a two-fold increase in @DRUG$ plasma concentration.
2037	DDI-mechanism	Other Potentially Important Drug Interactions: Benzodiazepines: Benzodiazepines metabolized by hepatic oxidation (e.g., alprazolam, @DRUG$, triazolam elc.) should be used with caution because the clearance of these drugs is likely to be reduced by @DRUG$.
2038	DDI-mechanism	@DRUG$ may increase the plasma-level of concomitantly given @DRUG$.
2039	DDI-effect	@DRUG$ in combination with other narcotic analgesics, general anesthetics, phenothiazines, tranquilizers, @DRUG$, or other CNS depressants (including alcohol) has additive depressant effects.
2040	DDI-mechanism	However, a crossover study in healthy subjects receiving either @DRUG$ 300 mg q.i.d. or 800 mg h.s. concomitantly with a 300 mg b.i.d. dosage of @DRUG$ (Theo-Dur , Key Pharmaceuticals, Inc.) demonstrated less alteration in steady-state theophylline peak serum levels with the 800 mg h.s. regimen, particularly in subjects aged 54 years and older.
2041	DDI-mechanism	Ingestion of @DRUG$ may increase serum concentrations of digoxin and @DRUG$ and increase cyclosporine s nephrotoxicity.
2042	DDI-effect	Curariform muscle relaxants (eg, tubocurarine) and other drugs, including ether, succinylcholine, @DRUG$, decamethonium and sodium citrate, potentiate the neuromuscular blocking effect and should be used with extreme caution in patients being treated with @DRUG$ Parenteral.
2043	DDI-mechanism	When @DRUG$ was administered concomitantly with @DRUG$ (CYP1A2, CYP3A), a minor increase (10%) in the clearance of theophylline was seen.
2044	DDI-mechanism	Concomitant administration of @DRUG$ Injection and @DRUG$ in a wax matrix may increase the severity of potassium chloride-induced gastrointestinal lesions as a result of a slower gastrointestinal transit time.
2045	DDI-effect	The use of @DRUG$ in patients who are receiving @DRUG$ may potentiate renal disease states.
2046	DDI-effect	Gentamicin - @DRUG$ may protect against the ototoxic effects of @DRUG$.
2047	DDI-advise	Hypersensitivity Reactions: Patients with a history of severe hypersensitivity reactions to products containing Cremophor  EL (eg, cyclosporin for injection concentrate and @DRUG$ for injection concentrate) should not be treated with @DRUG$.
2048	DDI-effect	@DRUG$ may increase slightly the effect of @DRUG$, e.g., guanethidine, methyldopa, reserpine.
2049	DDI-int	Other drugs Drug interactions have been reported with concomitant administration of @DRUG$ and other medications, including cyclosporine, hexobarbital, carbamazepine, alfentanil, disopyramide, @DRUG$, bromocriptine, valproate, astemizole, and lovastatin.
2050	DDI-mechanism	Co-administration of @DRUG$ reduced @DRUG$ Cmax up to 50% after multiple dosing.
2051	DDI-mechanism	Antacids (aluminum- or magnesium-containing): Concomitant administration of 300-mg @DRUG$ capsules with 30 mL @DRUG$ suspension reduces the rate (Cmax) and extent (AUC) of absorption by approximately 40%.
2052	DDI-effect	Dopamine D2 receptor antagonists (e.g., phenothiazines, @DRUG$, risperidone) and isoniazid may reduce the therapeutic effects of @DRUG$.
2053	DDI-effect	Synergism between xanthine bronchodilators (e.g., @DRUG$), ephedrine, and other @DRUG$ has been reported.
2054	DDI-effect	Other drugs which may enhance the neuromuscular blocking action of @DRUG$ such as NIMBEX include certain antibiotics (e. g., aminoglycosides, @DRUG$, bacitracin, polymyxins, lincomycin, clindamycin, colistin, and sodium colistemethate), magnesium salts, lithium, local anesthetics, procainamide, and quinidine.
2055	DDI-effect	Intraventricular injection of @DRUG$ at doses of 1.2 to 12 micrograms equally antagonized in a dose-dependent manner the tail-flick inhibition induced by intraventricular beta-endorphin and @DRUG$.
2056	DDI-advise	We report the case of an adolescent with altered consciousness caused by carbamazepine overdose with a positive tricyclic antidepressant level to alert clinicians to the cross-reactivity of @DRUG$ with a toxicology screen for @DRUG$.
2057	DDI-mechanism	Agents that are CYP3A4 inhibitors that have been found, or are expected, to increase plasma levels of @DRUG$ are the following: Acetazolamide, azole antifungals, cimetidine, clarithromycin(1), dalfopristin, danazol, delavirdine, diltiazem, erythromycin(1), fluoxetine, fluvoxamine, grapefruit juice, isoniazid, itraconazole, ketoconazole, loratadine, nefazodone, niacinamide, nicotinamide, protease inhibitors, propoxyphene, quinine, quinupristin, @DRUG$, valproate(1), verapamil, zileuton.
2058	DDI-effect	"Antidepressants, tricyclic @DRUG$ may enhance the activity of tricyclic antidepressants or @DRUG$;"
2059	DDI-advise	Although no interaction between MAO inhibitors and @DRUG$ has been observed, it is not recommended for use with @DRUG$.
2060	DDI-advise	This interaction, which has not been investigated using higher doses of fluvoxamine, may be more pronounced if a 300 mg daily dose is co-administered, particularly since fluvoxamine exhibits non-linear pharmacokinetics over the dosage range 100-300 mg. If @DRUG$ is co-administered with @DRUG$ Tablets, the initial alprazolam dosage should be at least halved and titration to the lowest effective dose is recommended.
2061	DDI-advise	Therefore, co-administration of @DRUG$ with other drugs that are extensively metabolized by this isozyme and which have a narrow therapeutic index, including certain antidepressants (tricyclic antidepressants [TCAs], such as nortriptyline, amitriptyline, and @DRUG$), phenothiazines and Type 1C antiarrhythmics (e.g., propafenone, flecainide), should be approached with caution.
2062	DDI-mechanism	Cholestyramine and Charcoal Administration of @DRUG$ or activated charcoal in patients (n=13) and volunteers (n=96) resulted in a rapid and significant decrease in plasma M1 (the active metabolite of @DRUG$) concentration .
2063	DDI-effect	The hypoglycemic action of @DRUG$ may be potentiated by certain drugs including nonsteroidal anti-inflammatory agents and other drugs that are highly protein bound, @DRUG$, sulfonamides, chloramphenicol, probenecid, coumarins, monoamine oxidase inhibitors, and beta adrenergic blocking agents.
2064	DDI-mechanism	"In a ten-subject study, coadministration of @DRUG$ (120 mg bid) with @DRUG$ resulted in a 3-4 times increase in mean lovastatin AUC and Cmax vs. lovastatin alone;"
2065	DDI-advise	However, when any additional drug, including @DRUG$, is added to the treatment of patients on @DRUG$ therapy, the patients should be observed for alterations of the prothrombin time.
2066	DDI-effect	@DRUG$: Has a synergistic effect with @DRUG$ in causing gastrointestinal bleeding.
2067	DDI-effect	Theophylline-related adverse effects have occurred in patients when @DRUG$ and @DRUG$ were coadministered.
2068	DDI-int	Possible drug interactions of @DRUG$ with @DRUG$ or with other anticholinesterase agents.
2069	DDI-advise	@DRUG$ and D.H.E. 45  (@DRUG$) Injection, USP should not be taken within 24 hours of each other..
2070	DDI-mechanism	Products containing calcium and other multivalent cations (such as @DRUG$, magnesium, iron) are likely to interfere with absorption of @DRUG$.
2071	DDI-effect	Since @DRUG$ inhibits platelet function, there is a potential for increased risk of bleeding, particularly in patients maintained on @DRUG$.
2072	DDI-mechanism	therefore, it is theoretically possible that @DRUG$ may interfere with the absorption of drugs where gastric pH is an important determinant of bioavailability (e.g. ketoconazole, ampicillin esters, iron salts, @DRUG$).
2073	DDI-mechanism	Effect of AEDs in Pediatric Patients There was about a 22% increase of apparent total body clearance of @DRUG$ when it was co-administered with enzyme-inducing @DRUG$.
2074	DDI-effect	Glyburide: The concomitant administration of @DRUG$ with the sulfonylurea @DRUG$ has, on rare occasions, resulted in severe hypoglycemia.
2075	DDI-effect	The possibility of hypotensive effects with PRINIVIL can be minimized by either discontinuing the @DRUG$ or increasing the salt intake prior to initiation of treatment with @DRUG$.
2076	DDI-int	@DRUG$ may interact with the following medications: acetaminophen (Tylenol), antibiotics such as ampicillin and tetracycline, anticonvulsants (Dilantin, Phenobarbital, Tegretol, Trileptal, Topamax, Felbatol), antifungals (Gris-PEG, Nizoral, Sporanox), atorvastatin (Lipitor), clofibrate (Atromid-S), cyclosporine (Neoral, Sandimmune), HIV drugs classified as protease inhibitors (@DRUG$, Crixivan, Fortovase, Invirase, Kaletra, Norvir, Viracept), morphine (Astramorph, Kadian, MS Contin), phenylbutazone, prednisolone (Prelone), rifadin (rifampin), St. Johns wort, temazepam, theophylline (Theo-Dur), and vitamin C.
2077	DDI-mechanism	Ingestion of @DRUG$ may increase serum concentrations of @DRUG$ and methotrexate and increase cyclosporine s nephrotoxicity.
2078	DDI-advise	Although no specific drug interactions with topical glaucoma drugs or systemic medications were identified in clinical studies of @DRUG$ 0.5% Ophthalmic Solution, the possibility of an additive or potentiating effect with CNS depressants (alcohol, @DRUG$, opiates, sedatives, anesthetics) should be considered.
2079	DDI-mechanism	Blood levels of hydrodolasetron increased 24% when @DRUG$ was coadministered with cimetidine (nonselective inhibitor of cytochrome P-450) for 7 days, and decreased 28% with coadministration of @DRUG$ (potent inducer of cytochrome P-450) for 7 days.
2080	DDI-effect	@DRUG$: Interferes with the contraceptive effect of microdosed @DRUG$-containing minipill preparations.
2081	DDI-int	Other drugs Drug interactions have been reported with concomitant administration of @DRUG$ and other medications, including cyclosporine, hexobarbital, carbamazepine, alfentanil, disopyramide, phenytoin, bromocriptine, @DRUG$, astemizole, and lovastatin.
2082	DDI-effect	Both the magnitude and duration of central nervous system and cardiovascular effects may be enhanced when @DRUG$ is administered in combination with other CNS depressants such as barbiturates, @DRUG$, opioids, or inhalation general anesthetics.
2083	DDI-effect	Calcium Channel Blockers: Isolated cases of conduction disturbance (rarely with hemodynamic compromise) have been observed when @DRUG$ is co-administered with @DRUG$.
2084	DDI-effect	@DRUG$ may have additive effects with alcohol and other @DRUG$, e.g., hypnotics, sedatives, tranquilizers, antianxiety agents.
2085	DDI-mechanism	The following are examples of drugs known to inhibit the metabolism of other related @DRUG$, presumably through inhibition of CYP3A: nefazodone, fluvoxamine, cimetidine, @DRUG$, isoniazide, and some macrolide antibiotics.
2086	DDI-mechanism	The most commonly occurring drug interactions are listed below: - Drugs that may increase plasma @DRUG$ concentrations include: acute @DRUG$ intake, amiodarone, chboramphenicol, chlordiazepoxide, cimetidine, diazepam, dicumarol, disulfiram, estrogens, ethosuximide, fluoxetine, H2-antagonists, halothane, isoniazid, methylphenidate, phenothiazines, phenylbutazone, salicylates, succinimides, sulfonamides, tolbutamide, trazodone
2087	DDI-mechanism	Agents that are CYP3A4 inhibitors that have been found, or are expected, to increase plasma levels of @DRUG$ are the following: Acetazolamide, azole antifungals, cimetidine, clarithromycin(1), dalfopristin, danazol, delavirdine, diltiazem, erythromycin(1), fluoxetine, fluvoxamine, grapefruit juice, isoniazid, itraconazole, ketoconazole, loratadine, nefazodone, niacinamide, nicotinamide, protease inhibitors, propoxyphene, quinine, @DRUG$, troleandomycin, valproate(1), verapamil, zileuton.
2088	DDI-int	Other drugs Drug interactions have been reported with concomitant administration of @DRUG$ and other medications, including cyclosporine, hexobarbital, @DRUG$, alfentanil, disopyramide, phenytoin, bromocriptine, valproate, astemizole, and lovastatin.
2089	DDI-advise	The daily dose of @DRUG$ should not exceed 7.5 mg when coadministered with potent CYP3A4 inhibitors (e.g., ketoconazole, itraconazole, ritonavir, @DRUG$, clarithromycin and nefazadone) .
2090	DDI-effect	If @DRUG$ is to be combined with other psychotropic agents such as tranquilizers or sedative/@DRUG$, careful consideration should be given to the pharmacology of the agents employed since the sedative effects of desipramine and benzodiazepines (e.g., chlordiazepoxide or diazepam) are additive.
2091	DDI-effect	Naproxen and other @DRUG$ can reduce the antihypertensive effect of propranolol and other @DRUG$.
2092	DDI-effect	@DRUG$ has been shown to be antagonistic to @DRUG$, including ceftazidime, based on in vitro studies and time kill curves with enteric gram-negative bacilli.
2093	DDI-mechanism	@DRUG$ increases @DRUG$ AUC values by 14%.
2094	DDI-mechanism	In addition, results from regression analyses of patient pharmacokinetic data suggest that co-administration of other inducers of drug clearance (efavirenz, @DRUG$, phenytoin, dexamethasone, or carbamazepine) with @DRUG$ may result in clinically meaningful reductions in caspofungin concentrations.
2095	DDI-effect	In clinical trials in patients undergoing PTCA/PCI, co-administration of @DRUG$ with heparin, @DRUG$, thrombolytics or glycoprotein IIb/IIIa inhibitors was associated with increased risks of major bleeding events compared to patients not receiving these concomitant medications.
2096	DDI-advise	Exert particular caution in combining @DRUG$ with other anticholinergic drugs (@DRUG$ and antiparkinsonian agents): Particularly the elderly may develop delirium, high fever, severe obstipation, even ileus and glaucoma.
2097	DDI-mechanism	Phenytoin/Phenobarbital: The coadministration of phenytoin or @DRUG$ will not affect plasma concentrations of vitamin D, but may reduce endogenous plasma levels of @DRUG$/ergocalcitriol by accelerating metabolism.
2098	DDI-advise	Caution should be taken when @DRUG$ is used concomitantly with medications that are predominantly metabolized by CYP2D6 and which have a narrow therapeutic window, such as @DRUG$, thioridazine and tricyclic antidepressants (see CLINICAL PHARMACOLOGY).
