3025	DDI-effect	Concurrent administration of drugs possessing nephrotoxic (e.g., @DRUG$, indomethacin), myelotoxic (e.g., cytotoxic chemotherapy), cardiotoxic (e.g., doxorubicin) or hepatotoxic (e.g., methotrexate, asparaginase) effects with @DRUG$ may increase toxicity in these organ systems.
3026	DDI-mechanism	Drugs Demonstrated to be CYP 3A Inhibitors of Possible Clinical Significance on the Basis of Clinical Studies Involving Alprazolam (caution is recommended during coadministration with alprazolam): Coadministration of @DRUG$ with @DRUG$ increased the maximum plasma concentration of alprazolam by 46%, decreased clearance by 21%, increased half-life by 17%, and decreased measured psychomotor performance.
3027	DDI-effect	When @DRUG$ is taken concurrently with oral @DRUG$, attenuation of immunization cannot be excluded.
3028	DDI-effect	The concurrent use of two or more drugs with anticholinergic activity--such as an antipsychotic drug (eg, chlorpromazine), an @DRUG$ (eg, trihexyphenidyl), and/or a tricyclic antidepressant (eg, @DRUG$)--commonly results in excessive anticholinergic effects, including dry mouth and associated dental complications, blurred vision, and, in patients exposed to high temperature and humidity, hyperpyrexia.
3029	DDI-mechanism	Single doses of either @DRUG$ or colestipol resins bind the @DRUG$ and reduce its absorption from the gastrointestinal tract by up to 85 and 43 percent, respectively.
3030	DDI-effect	Moreover, as noted with @DRUG$, the effect of @DRUG$ may even be more pronounced when it is administered at higher doses.
3031	DDI-effect	Cytotoxic Agents: Enhanced bone marrow suppression by cyclophosphamide and other @DRUG$ has been reported among patients with neoplastic disease, except leukemia, in the presence of @DRUG$.
3032	DDI-advise	Experience with co-administration of HMG-CoA reductase inhibitors and Fentanyl in patients is limited,therefore,consideration should be given to temporarily suspending use of @DRUG$ in patients receiving @DRUG$.
3033	DDI-effect	Agents Causing Renin Release: The antihypertensive effect of enalapril and @DRUG$ IV is augmented by @DRUG$ that cause renin release (e.g., diuretics).
3034	DDI-mechanism	@DRUG$ caused a statistically significant increase in plasma exposures of @DRUG$ and S-warfarin (12% and 15%, respectively), and in the pharmacodynamic effects (prothrombin time, measured as INR) of warfarin.
3035	DDI-int	@DRUG$ may interact with the following medications: acetaminophen (Tylenol), antibiotics such as ampicillin and tetracycline, anticonvulsants (Dilantin, Phenobarbital, Tegretol, Trileptal, Topamax, Felbatol), antifungals (Gris-PEG, Nizoral, Sporanox), atorvastatin (Lipitor), clofibrate (Atromid-S), cyclosporine (Neoral, Sandimmune), HIV drugs classified as protease inhibitors (Agenerase, @DRUG$, Fortovase, Invirase, Kaletra, Norvir, Viracept), morphine (Astramorph, Kadian, MS Contin), phenylbutazone, prednisolone (Prelone), rifadin (rifampin), St. Johns wort, temazepam, theophylline (Theo-Dur), and vitamin C.
3036	DDI-effect	In patients receiving nonselective monoamine oxidase inhibitors (MAOIs) (e.g., @DRUG$) in combination with serotoninergic agents (e.g., fluoxetine, fluvoxamine, paroxetine, @DRUG$, venlafaxine), there have been reports of serious, sometimes fatal, reactions.
3037	DDI-mechanism	The serum estrogen concentrations of @DRUG$ + @DRUG$-treated rats decreased by 50%, while those of the endotoxin-treated rats increased (2- to 5-fold).
3038	DDI-effect	Pharmacokinetic data indicate that oral @DRUG$ inhibits the metabolism of @DRUG$, resulting in elevated plasma levels of astemizole and its active metabolite desmethylastemizole which may prolong QT intervals.
3039	DDI-effect	Drugs that reduce the number of blood platelets by causing bone marrow depression (such as antineoplastic agents) or drugs which inhibit platelet function (eg, aspirin and other non-steroidal anti-inflammatory drugs, @DRUG$, hydrochloroquine, clofibrate, dextran) may increase the bleeding tendency produced by @DRUG$ without altering prothrombin time determinations.
3040	DDI-mechanism	There is a significant increase in exposure to imatinib when @DRUG$ is coadministered with @DRUG$ (CYP3A4 inhibitor).
3041	DDI-mechanism	Digoxin: In controlled studies in healthy volunteers, @DRUG$ either had no effect (one study) or was associated with modest increases, about 30% (two studies) in steady-state serum @DRUG$ concentrations.
3042	DDI-effect	Other drugs which may enhance the neuromuscular blocking action of nondepolarizing agents such as @DRUG$ include certain antibiotics (e. g., aminoglycosides, tetracyclines, bacitracin, polymyxins, lincomycin, clindamycin, colistin, and sodium colistemethate), @DRUG$ salts, lithium, local anesthetics, procainamide, and quinidine.
3043	DDI-int	@DRUG$ may interact with the following medications: acetaminophen (Tylenol), antibiotics such as ampicillin and tetracycline, anticonvulsants (Dilantin, Phenobarbital, Tegretol, Trileptal, Topamax, Felbatol), antifungals (Gris-PEG, Nizoral, Sporanox), atorvastatin (Lipitor), clofibrate (Atromid-S), cyclosporine (Neoral, Sandimmune), HIV drugs classified as @DRUG$ (Agenerase, Crixivan, Fortovase, Invirase, Kaletra, Norvir, Viracept), morphine (Astramorph, Kadian, MS Contin), phenylbutazone, prednisolone (Prelone), rifadin (rifampin), St. Johns wort, temazepam, theophylline (Theo-Dur), and vitamin C.
3044	DDI-effect	These results suggest that both dexamethasone and @DRUG$, and possibly other glucocorticoids and retinoids, may regulate the proliferation of prostate epithelium by a dose-dependent modification of the activity of insulin and @DRUG$.
3045	DDI-effect	Injection: @DRUG$ injection, like other injectable benzodiazepines, produces depression of the central nervous system when administered with ethyl alcohol, phenothiazines, barbiturates, MAO inhibitors, and other @DRUG$.When scopolamine is used concomitantly with injectable lorazepam, an increased incidence of sedation, hallucinations, and irrational behavior has been observed.
3046	DDI-effect	therefore, the efficacy of oral @DRUG$ during administration of @DRUG$ may be reduced.
3047	DDI-mechanism	Clofibric acid: Combination @DRUG$ may increase the clearance of @DRUG$.
3048	DDI-effect	"Drugs which may enhance the neuromuscular blocking action of @DRUG$ include: @DRUG$;"
3049	DDI-advise	In patients receiving mercaptopurine (Purinethol) or azathioprine (Imuran), the concomitant administration of 300-600 mg of @DRUG$ per day will require a reduction in dose to approximately one-third to one-fourth of the usual dose of mercaptopurine or @DRUG$.
3050	DDI-effect	During controlled hypotensive anesthesia using @DRUG$ in association with @DRUG$, high concentrations (3% or above) of halothane should not be used because the degree of hypotension will be increased and because of the possibility of a large reduction in cardiac output and an increase in central venous pressure.
3051	DDI-effect	Other drugs which may enhance the neuromuscular blocking action of nondepolarizing agents such as @DRUG$ include certain antibiotics (e. g., aminoglycosides, tetracyclines, bacitracin, polymyxins, lincomycin, clindamycin, colistin, and sodium colistemethate), magnesium salts, @DRUG$, local anesthetics, procainamide, and quinidine.
3052	DDI-mechanism	Probenecid: As with other @DRUG$, probenecid inhibits the renal excretion of @DRUG$, resulting in an approximate doubling in A.C. a 54% increase in peak cefdinir plasma levels, and a 50% prolongation in the apparent elimination half-life.
3053	DDI-advise	It is not known if the effects of @DRUG$ are altered by concomitant medications that affect hepatic metabolism of drugs (@DRUG$, etc.), but physicians should be alert to the possibility that a smaller initial dose and longer intervals between doses may be needed.
3054	DDI-mechanism	The most commonly occurring drug interactions are listed below: - Drugs that may increase plasma @DRUG$ concentrations include: acute alcohol intake, amiodarone, chboramphenicol, chlordiazepoxide, cimetidine, diazepam, dicumarol, @DRUG$, estrogens, ethosuximide, fluoxetine, H2-antagonists, halothane, isoniazid, methylphenidate, phenothiazines, phenylbutazone, salicylates, succinimides, sulfonamides, tolbutamide, trazodone
3055	DDI-effect	@DRUG$ (e.g., phenothiazines, butyrophenones, risperidone) and isoniazid may reduce the therapeutic effects of @DRUG$.
3056	DDI-effect	Dopamine D2 receptor antagonists (e.g., phenothiazines, butyrophenones, risperidone) and @DRUG$ may reduce the therapeutic effects of @DRUG$.
3057	DDI-mechanism	In addition, results from regression analyses of patient pharmacokinetic data suggest that co-administration of other inducers of drug clearance (efavirenz, nevirapine, phenytoin, dexamethasone, or @DRUG$) with @DRUG$ may result in clinically meaningful reductions in caspofungin concentrations.
3058	DDI-mechanism	Coadministration of single, oral doses of @DRUG$ with @DRUG$ (10 mg and 800 mg, respectively), a strong, selective CYP3A4 inhibitor produced a 34% increase in zaleplons maximal plasma concentrations and a 20% increase in the area under the plasma concentration-time curve.
3059	DDI-mechanism	"Tricyclic antidepressants (@DRUG$, imipramine, nortriptyline): Metabolism may be inhibited by @DRUG$, increasing plasma levels of antidepressant;"
3060	DDI-int	@DRUG$ may interact with the following medications: acetaminophen (Tylenol), antibiotics such as ampicillin and tetracycline, anticonvulsants (Dilantin, Phenobarbital, Tegretol, Trileptal, Topamax, Felbatol), antifungals (Gris-PEG, Nizoral, Sporanox), atorvastatin (Lipitor), clofibrate (Atromid-S), cyclosporine (Neoral, Sandimmune), HIV drugs classified as protease inhibitors (Agenerase, Crixivan, Fortovase, Invirase, Kaletra, Norvir, Viracept), morphine (Astramorph, Kadian, MS Contin), phenylbutazone, prednisolone (Prelone), @DRUG$ (rifampin), St. Johns wort, temazepam, theophylline (Theo-Dur), and vitamin C.
3061	DDI-advise	Interactions with Mixed Agonist/Antagonist Opioid Analgesics: Agonist/antagonist analgesics (eg, pentazocine, nalbuphine, butorphanol, dezocine and buprenorphine) should NOT be administered to a patient who has received or is receiving a course of therapy with a @DRUG$ such as @DRUG$.
3062	DDI-mechanism	Corticosteroids: Dexamethasone: Aprepitant, when given as a regimen of 125mg with dexamethasone coadministered orally as 20 mg on Day 1, and @DRUG$ when given as 80 mg/day with @DRUG$ coadministered orally as 8 mg on Days 2 through 5, increased the AUC of dexamethasone, a CYP3A4 substrate by 2.2-fold, on Days 1 and 5.
3063	DDI-effect	Other drugs which may enhance the neuromuscular blocking action of nondepolarizing agents such as @DRUG$ include certain antibiotics (e. g., aminoglycosides, tetracyclines, bacitracin, polymyxins, lincomycin, clindamycin, colistin, and @DRUG$), magnesium salts, lithium, local anesthetics, procainamide, and quinidine.
3064	DDI-mechanism	Concomitant use of @DRUG$ and drugs that inhibit CYP3A4 (eg, ketoconazole, itraconazole, erythromycin, @DRUG$, ritonavir, atazanavir, indinavir, nefazodone, nelfinavir, saquinavir, telithromycin) may increase exposure to dasatinib and should be avoided.
3065	DDI-effect	The administration of local @DRUG$ containing epinephrine or norepinephrine to patients receiving monoamine oxidase inhibitors, @DRUG$ or phenothiazines may produce severe, prolonged hypotension or hypertension.
3066	DDI-effect	Butalbital, @DRUG$ and caffeine may enhance the effects of: other narcotic analgesics, alcohol, general anesthetics, tranquilizers such as @DRUG$, sedative-hypnotics, or other CNS depressants, causing increased CNS depression.
3067	DDI-mechanism	Inhibitors of CYP1A2: Concomitant use of @DRUG$ with @DRUG$, an inhibitor of CYP1A2, results in approximately a 6-fold increase in AUC and about a 2.5-fold increase in Cmax of duloxetine.
3068	DDI-effect	Drug Interactions: Flupenthixol may interact with some drugs, like Monoamine oxidase inhibitors (MAOI): @DRUG$ could theoretically affect @DRUG$ pharmacodynamics - Arecoline - Eproxindine - Ethanol: Flupenthixol and Ethanol cause additive CNS depression - Tricyclic antidepressants: Flupenthixol increases the effect of Tricyclic antidepressants
3069	DDI-advise	Dosage adjustment of @DRUG$ may be necessary when coadministered with CYP2D6 inhibitors, e.g., @DRUG$, fluoxetine, and quinidine.
3070	DDI-int	@DRUG$ may interact with acetaminophen (e.g., Tylenol), chloramphenicol (e.g., @DRUG$), local anesthetics (e.g., benzocaine and lidocaine), para-aminobenzoic acid (PABA)-containing preparations (e.g., sunscreens and some multivitamins), procainamide (e.g., Pronestyl), sulfonamides (sulfa medicines), thiazide diuretics (use of these medicines during the test period will affect the test results), and pancreatic supplements (use of pancreatic supplements may give false test results).
3071	DDI-int	Data from in vitro studies of @DRUG$ other than alprazolam suggest a possible drug interaction for the following: @DRUG$, cyclosporine, amiodarone, nicardipine, and nifedipine.
3072	DDI-mechanism	Hydrochlorothiazide: In normal volunteers, concomitant administration of @DRUG$ and @DRUG$ resulted in significantly increased plasma levels of hydrochlorothiazide.
3073	DDI-effect	@DRUG$, such as reserpine, may have an additive effect when given with @DRUG$.
3074	DDI-int	@DRUG$ may interact with acetaminophen (e.g., Tylenol), chloramphenicol (e.g., Chloromycetin), local anesthetics (e.g., benzocaine and lidocaine), para-aminobenzoic acid (PABA)-containing preparations (e.g., sunscreens and some multivitamins), procainamide (e.g., @DRUG$), sulfonamides (sulfa medicines), thiazide diuretics (use of these medicines during the test period will affect the test results), and pancreatic supplements (use of pancreatic supplements may give false test results).
3075	DDI-mechanism	Agents that are CYP3A4 inhibitors that have been found, or are expected, to increase plasma levels of @DRUG$ are the following: Acetazolamide, azole antifungals, cimetidine, clarithromycin(1), dalfopristin, danazol, delavirdine, diltiazem, erythromycin(1), fluoxetine, fluvoxamine, grapefruit juice, isoniazid, itraconazole, ketoconazole, loratadine, nefazodone, niacinamide, nicotinamide, protease inhibitors, @DRUG$, quinine, quinupristin, troleandomycin, valproate(1), verapamil, zileuton.
3076	DDI-effect	@DRUG$ prolong and intensify the anticholinergic effects of @DRUG$.
3077	DDI-mechanism	Atorvastatin: @DRUG$ increases the AUC for @DRUG$ and ethinyl estradiol.
3078	DDI-effect	@DRUG$ may be active in inhibiting Cryptosporidium parvum growth in vitro upon combination with either @DRUG$ or minocycline.
3079	DDI-advise	Because there is a theoretical basis that these effects may be additive, use of ergotamine-containing or ergot-type medications (like @DRUG$ or methysergide) and @DRUG$ within 24 hours is contraindicated.
3080	DDI-advise	Patients taking both @DRUG$ and a @DRUG$ should be monitored to ensure that a satisfactory hypotensive effect is achieved.
3081	DDI-mechanism	@DRUG$ has also been shown to inhibit P450 1A2, an isoform also involved in @DRUG$metabolism.
3082	DDI-mechanism	Therefore, if @DRUG$ is administered with @DRUG$, the clinician should be alert to the possibility of increases in digoxin levels.
3083	DDI-int	@DRUG$ may interact with the following medications: acetaminophen (Tylenol), antibiotics such as ampicillin and tetracycline, anticonvulsants (Dilantin, Phenobarbital, Tegretol, Trileptal, Topamax, Felbatol), antifungals (Gris-PEG, Nizoral, Sporanox), atorvastatin (Lipitor), clofibrate (Atromid-S), cyclosporine (Neoral, Sandimmune), HIV drugs classified as protease inhibitors (Agenerase, Crixivan, Fortovase, Invirase, Kaletra, Norvir, Viracept), morphine (Astramorph, Kadian, @DRUG$), phenylbutazone, prednisolone (Prelone), rifadin (rifampin), St. Johns wort, temazepam, theophylline (Theo-Dur), and vitamin C.
3084	DDI-advise	"Before taking @DRUG$, tell your doctor if you are taking any of the following medicines: - aspirin or another salicylate such as magnesium/choline salicylate (Trilisate), salsalate (Disalcid, others), choline salicylate (Arthropan), magnesium salicylate (@DRUG$), or bismuth subsalicylate (Pepto-Bismol);"
3085	DDI-effect	Administration of @DRUG$ to patients who are receiving sympathomimetic or @DRUG$ may result in an additive pressor effect .
3086	DDI-int	@DRUG$ may interact with the following medications: acetaminophen (Tylenol), antibiotics such as ampicillin and tetracycline, anticonvulsants (Dilantin, Phenobarbital, Tegretol, Trileptal, Topamax, Felbatol), antifungals (Gris-PEG, Nizoral, Sporanox), atorvastatin (Lipitor), clofibrate (Atromid-S), @DRUG$ (Neoral, Sandimmune), HIV drugs classified as protease inhibitors (Agenerase, Crixivan, Fortovase, Invirase, Kaletra, Norvir, Viracept), morphine (Astramorph, Kadian, MS Contin), phenylbutazone, prednisolone (Prelone), rifadin (rifampin), St. Johns wort, temazepam, theophylline (Theo-Dur), and vitamin C.
3087	DDI-advise	Concomitant administration of @DRUG$ and @DRUG$ is not recommended because naproxen is displaced from its binding sites during the concomitant administration of aspirin, resulting in lower plasma concentrations and peak plasma levels.
3088	DDI-int	@DRUG$ may interact with acetaminophen (e.g., Tylenol), chloramphenicol (e.g., Chloromycetin), local anesthetics (e.g., benzocaine and lidocaine), para-aminobenzoic acid (PABA)-containing preparations (e.g., sunscreens and some multivitamins), procainamide (e.g., Pronestyl), @DRUG$ (sulfa medicines), thiazide diuretics (use of these medicines during the test period will affect the test results), and pancreatic supplements (use of pancreatic supplements may give false test results).
3089	DDI-mechanism	Although trough citalopram plasma levels were unaffected, given the enzyme-inducing properties of carbamazepine, the possibility that @DRUG$ might increase the clearance of @DRUG$ should be considered if the two drugs are coadministered.
3090	DDI-mechanism	Phenytoin: Population pharmacokinetic analyses indicate that @DRUG$ clearance is 60% greater in patients taking @DRUG$ with or without other enzyme- inducing AEDs.
3091	DDI-advise	It is recommended that plasma lithium levels be monitored when @DRUG$ is coadministered with @DRUG$.
3092	DDI-advise	- Perhexiline hydrogen maleate or @DRUG$ (with hepatotoxic potential) must not be administered together with @DRUG$ or Bezalip retard.
3093	DDI-mechanism	When used in therapeutic doses, @DRUG$ had a modest effect on the pharmacokinetics of atorvastatin, carbamazepine, cetirizine, didanosine, efavirenz, fluconazole, indinavir, midazolam, @DRUG$, sildenafil, theophylline (intravenous and oral), triazolam, trimethoprim/sulfamethoxazole or zidovudine.
3094	DDI-effect	Although @DRUG$ or calcium channel blockers and @DRUG$ may be useful in combination to control atrial fibrillation, their additive effects on AV node conduction can result in advanced or complete heart block.
3095	DDI-mechanism	Concomitant administration of @DRUG$ with @DRUG$ has been reported to result in elevated serum levels of carbamazepine (40% to 72% increase), resulting in toxicity in some cases.
3096	DDI-effect	Cyclopropane or @DRUG$ increase cardiac autonomic irritability and may sensitize the myocardium to the action of certain intravenously administered @DRUG$, such as dopamine.
3097	DDI-mechanism	Probenecid: @DRUG$ interferes with renal tubular secretion of @DRUG$ and produces an increase in the level of ciprofloxacin in serum.
3098	DDI-int	@DRUG$ may interact with antidepressants, aspirin, barbiturates, bromocriptine, @DRUG$ supplements, corticosteroids, corticotropin, cyclosporine, dantrolene, nicotine, somatropin, tamoxifen, and warfarin.
3099	DDI-effect	Fentanyl Anesthesia: Severe hypotension has been reported during @DRUG$ anesthesia with concomitant use of a beta blocker and a @DRUG$.
3100	DDI-effect	The prior administration of @DRUG$ does not enhance the duration, but quickens the onset and may increase the depth, of neuromuscular block induced by @DRUG$.
3101	DDI-advise	Therefore, co-administration of @DRUG$ with other drugs that are extensively metabolized by this isozyme and which have a narrow therapeutic index, including certain antidepressants (tricyclic antidepressants [@DRUG$], such as nortriptyline, amitriptyline, and imipramine), phenothiazines and Type 1C antiarrhythmics (e.g., propafenone, flecainide), should be approached with caution.
3102	DDI-mechanism	Benzodiazepines: Combination @DRUG$ may decrease the clearance of some benzodiazepines (alprazolam, chlordiazepoxide, @DRUG$) and increase the clearance of others (lorazepam, oxazepam, temazepam).
3103	DDI-effect	Additive CNS depression may occur when @DRUG$ are administered concomitantly with other CNS depressants including @DRUG$, tranquilizers, and alcohol.
3104	DDI-advise	As a consequence, when @DRUG$ and @DRUG$ are given concomitantly, the patient should be carefully observed for signs of lithium toxicity.
3105	DDI-mechanism	Ketoconazole - Combined administration of racemic @DRUG$ (40 mg) and @DRUG$ (200 mg) decreased the Cmax and AUC of ketoconazole by 21% and 10%, respectively, and did not significantly affect the pharmacokinetics of citalopram.
3106	DDI-effect	@DRUG$, acetaminophen and caffeine may enhance the effects of: other narcotic analgesics, alcohol, general anesthetics, tranquilizers such as chlordiazepoxide, @DRUG$, or other CNS depressants, causing increased CNS depression.
3107	DDI-advise	Caution should be used when @DRUG$ and @DRUG$ are administered concomitantly.
3108	DDI-effect	@DRUG$-induced oxidative stress in rat brain and liver is prevented by @DRUG$ or allopurinol.
3109	DDI-mechanism	Caffeine Theobromine Grepafloxacin, like other @DRUG$, may inhibit the metabolism of caffeine and @DRUG$.
3110	DDI-mechanism	Concomitant use of @DRUG$ and drugs that inhibit CYP3A4 (eg, ketoconazole, itraconazole, erythromycin, clarithromycin, ritonavir, atazanavir, indinavir, nefazodone, @DRUG$, saquinavir, telithromycin) may increase exposure to dasatinib and should be avoided.
3111	DDI-mechanism	DISCUSSION: @DRUG$ is a potent inhibitor of CYP3A4, the major enzyme responsible for @DRUG$ metabolism.
3112	DDI-advise	The consumption of @DRUG$ during treatment with @DRUG$ should be minimized or avoided (also see  a href= bupropz_od.htm#CI CONTRAINDICATIONS)
3113	DDI-advise	"Before taking @DRUG$, tell your doctor if you are taking any of the following medicines: - @DRUG$ or another salicylate such as magnesium/choline salicylate (Trilisate), salsalate (Disalcid, others), choline salicylate (Arthropan), magnesium salicylate (Magan), or bismuth subsalicylate (Pepto-Bismol);"
3114	DDI-effect	When other potent parental @DRUG$, such as diazoxide, are used in combination with @DRUG$, patients should be continuously observed for several hours for any excessive fall in blood pressure.
3115	DDI-effect	In patients receiving nonselective @DRUG$ (MAOIs) (e.g., selegiline hydrochloride) in combination with serotoninergic agents (e.g., @DRUG$, fluvoxamine, paroxetine, sertraline, venlafaxine), there have been reports of serious, sometimes fatal, reactions.
3116	DDI-int	Interactions may occur between @DRUG$ supplements and aspirin and other non-steroidal anti-inflammatory drugs and herbs such as garlic (Allium sativum) and ginkgo (@DRUG$).
3117	DDI-mechanism	After the coadministration of 200 mg oral @DRUG$ twice daily and one 20 mg dose of @DRUG$ to 11 subjects, the AUC and Cmax of loratadine averaged 302% (  142 S.D.) and 251% (  68 S.D.), respectively, of those obtained after co-treatment with placebo.
3118	DDI-advise	Drug-Drug Interactions Given the primary CNS effects of aripiprazole, caution should be used when @DRUG$ is taken in combination with other @DRUG$ and alcohol.
3119	DDI-effect	@DRUG$ (5 mg/kg, s.c.) completely antagonized the inhibitory effect of loperamide and partly antagonized the effect of @DRUG$.
3120	DDI-advise	Caution should be used if @DRUG$ is administered concomitantly with @DRUG$.
3121	DDI-mechanism	Reciprocal interactions may occur with concomitant use of @DRUG$ and drugs that increase or inhibit the cytochrome P450 system (e.g., @DRUG$, carbamazepine, cimetidine, ketoconazole), though this has not been studied
3122	DDI-mechanism	While not systematically studied, certain drugs may induce the metabolism of @DRUG$ (e.g., carbamazepine, phenobarbital, @DRUG$).
3123	DDI-effect	A rare, but serious, constellation of symptoms, termed serotonin syndrome, has been reported with the concomitant use of @DRUG$ (SSRIs) and agents for migraine therapy, such as Imitrex (sumatriptan succinate) and @DRUG$.
3124	DDI-mechanism	Concurrent administration of @DRUG$ and @DRUG$, which competes for tubular secretion, has been shown to increase the plasma half-life of dyphylline .
3125	DDI-mechanism	Agents that are CYP3A4 inhibitors that have been found, or are expected, to increase plasma levels of @DRUG$ are the following: Acetazolamide, azole antifungals, cimetidine, clarithromycin(1), dalfopristin, danazol, delavirdine, diltiazem, erythromycin(1), fluoxetine, fluvoxamine, grapefruit juice, isoniazid, itraconazole, ketoconazole, loratadine, nefazodone, niacinamide, nicotinamide, protease inhibitors, propoxyphene, quinine, @DRUG$, troleandomycin, valproate(1), verapamil, zileuton.
3126	DDI-advise	@DRUG$ and @DRUG$ should not beadministered concomitantly becausedecreases in nevirapine plasmaconcentrations may reduce the efficacy ofthe drug.
3127	DDI-effect	In addition to bleeding associated with heparin and vitamin K antagonists, drugs that alter platelet function (such as acetylsalicylic acid, dipyridamole and @DRUG$) may increase the risk of bleeding if administered prior to, during, or after @DRUG$ therapy.
