190	DDI-advise	Use lowest possible dose of atorvastatin with careful monitoring, or consider @DRUG$ that are not primarily metabolized by CYP3A4, such as pravastatin, fluvastatin, or rosuvastatin in combination with @DRUG$.
191	DDI-effect	@DRUG$, acetaminophen and caffeine may enhance the effects of: other narcotic analgesics, alcohol, general anesthetics, tranquilizers such as chlordiazepoxide, @DRUG$, or other CNS depressants, causing increased CNS depression.
192	DDI-mechanism	however, in a study of 12 normal subjects, concurrent administration of @DRUG$ decreased ketoprofen protein binding and increased @DRUG$ plasma clearance from 0.07 L/kg/h without aspirin to 0.11 L/kg/h with aspirin.
193	DDI-advise	The daily dose of @DRUG$ should not exceed 7.5 mg when coadministered with potent CYP3A4 inhibitors (e.g., @DRUG$, itraconazole, ritonavir, nelfinavir, clarithromycin and nefazadone) .
194	DDI-mechanism	Caffeine Theobromine @DRUG$, like other quinolones, may inhibit the metabolism of caffeine and @DRUG$.
195	DDI-mechanism	While not systematically studied, certain drugs may induce the metabolism of @DRUG$ (e.g., carbamazepine, phenobarbital, @DRUG$).
196	DDI-mechanism	plasma levels of several closely related tricyclic antidepressants have been reported to be increased by the concomitant administration of methylphenidate or hepatic enzyme inhibitors (e.g., @DRUG$, fluoxetine) and decreased by the concomitant administration of hepatic enzyme inducers (e.g., barbiturates, phenytoin), and such an effect may be anticipated with @DRUG$ as well.
197	DDI-effect	Synergism between xanthine bronchodilators (e.g., @DRUG$), ephedrine, and other @DRUG$ has been reported.
198	DDI-mechanism	Agents that are CYP inducers that have been found, or are expected, to decrease plasma levels of @DRUG$ are the following: Cisplatin, doxorubicin HCL, @DRUG$, rifampin, phenobarbital, Phenytoin(2), primidone, methsuximide, and theophylline Thus, if a patient has been titrated to a stable dosage on EQUETROTM, and then begins a course of treatment with one of these CYP3A4 inducers, it is reasonable to expect that a dose increase for EQUETROTM may be necessary.
199	DDI-mechanism	Macrolide Antibiotics (e. g. erythromycin and troleandomycin): Agents of the ergot alkaloid class, of which @DRUG$  (dihydroergotamine mesylate) Injection, USP is a member, have been shown to interact with antibiotics of the @DRUG$, resulting in increased plasma levels of unchanged alkaloids and peripheral vasoconstriction.
200	DDI-mechanism	Erythromycin: In healthy individuals, plasma concentrations of atorvastatin increased approximately 40% with coadministration of @DRUG$ and @DRUG$, a known inhibitor of cytochrome P450 3A4.
201	DDI-mechanism	Concomitant use of @DRUG$ and drugs that inhibit CYP3A4 (eg, ketoconazole, itraconazole, @DRUG$, clarithromycin, ritonavir, atazanavir, indinavir, nefazodone, nelfinavir, saquinavir, telithromycin) may increase exposure to dasatinib and should be avoided.
202	DDI-advise	It is recommended that serum lithium levels be monitored frequently if @DRUG$ is administered concomitantly with @DRUG$.
203	DDI-mechanism	Macrolide Antibiotics (e. g. erythromycin and troleandomycin): Agents of the ergot alkaloid class, of which D.H.E. 45  (@DRUG$) Injection, USP is a member, have been shown to interact with antibiotics of the @DRUG$, resulting in increased plasma levels of unchanged alkaloids and peripheral vasoconstriction.
204	DDI-effect	Platelet inhibitors: Drugs such as acetylsalicylic acid, dextran, @DRUG$, ibuprofen, indomethacin, dipyridamole, hydroxychloroquine and others that interfere with platelet-aggregation reactions (the main hemostatic defense of heparinized patients) may induce bleeding and should be used with caution in patients receiving @DRUG$.
205	DDI-effect	Drugs that reduce the number of blood platelets by causing bone marrow depression (such as antineoplastic agents) or drugs which inhibit platelet function (eg, @DRUG$ and other non-steroidal anti-inflammatory drugs, dipyridamole, hydrochloroquine, clofibrate, dextran) may increase the bleeding tendency produced by @DRUG$ without altering prothrombin time determinations.
206	DDI-advise	@DRUG$ should not be administered concomitantly with amikacin, ciprofloxacin, gentamicin, @DRUG$, or tobramycin.
207	DDI-effect	Both the sedative and anticholinergic effects of the @DRUG$ are also additive to those of @DRUG$.
208	DDI-mechanism	The most commonly occurring drug interactions are listed below: - Drugs that may increase plasma @DRUG$ concentrations include: acute alcohol intake, amiodarone, chboramphenicol, chlordiazepoxide, cimetidine, diazepam, dicumarol, disulfiram, @DRUG$, ethosuximide, fluoxetine, H2-antagonists, halothane, isoniazid, methylphenidate, phenothiazines, phenylbutazone, salicylates, succinimides, sulfonamides, tolbutamide, trazodone
209	DDI-effect	Drugs Decreasing Heparin Effect: Digitalis, tetracyclines, nicotine, or @DRUG$ may partially counteract the anticoagulant action of @DRUG$.
210	DDI-advise	Consequently, @DRUG$ should be avoided in patients receiving ketoconazole and @DRUG$, which are very potent inhibitors of CYP3A.
211	DDI-mechanism	Ingestion of @DRUG$ may increase serum concentrations of digoxin and @DRUG$ and increase cyclosporine s nephrotoxicity.
212	DDI-mechanism	Ketoconazole: When a single 125-mg dose of @DRUG$ was administered on Day5 of a 10-day regimen of 400 mg/day of @DRUG$, a strong CYP3A4 inhibitor, the AUC of aprepitant increased approximately 5-fold and the mean terminal half-life of aprepitant increased approximately 3-fold.
213	DDI-mechanism	Morphine: A literature article reported that when a 60-mg controlled-release @DRUG$ capsule was administered 2 hours prior to a 600-mg @DRUG$  capsule (N=12), mean gabapentin AUC increased by 44% compared to gabapentin administered without morphine.
214	DDI-effect	@DRUG$ have been reported to blunt the hypotensive effect of systemic @DRUG$.
215	DDI-effect	Moreover, as noted with @DRUG$, the effect of @DRUG$ may even be more pronounced when it is administered at higher doses.
216	DDI-advise	@DRUG$ and SUBOXONE should be prescribed with caution to patients on @DRUG$ or other drugs that act on the central nervous system, regardless of whether these drugs are taken on the advice of a physician or are taken as drugs of abuse.
217	DDI-effect	Curariform muscle relaxants (eg, tubocurarine) and other drugs, including ether, succinylcholine, gallamine, decamethonium and @DRUG$, potentiate the neuromuscular blocking effect and should be used with extreme caution in patients being treated with @DRUG$ Parenteral.
218	DDI-int	@DRUG$ may interact with alcohol, blood thinners, decongestant drugs (allergy, cold, and sinus medicines), diabetic drugs, lithium, @DRUG$, NSAIDs like Aleve or Ibuprofen, and high blood pressure medications.
219	DDI-effect	It would be expected that @DRUG$ use during therapy with @DRUG$ would worsen the incidence or severity of diarrhea, but this has not been studied.
220	DDI-mechanism	Agents that are CYP inducers that have been found, or are expected, to decrease plasma levels of @DRUG$ are the following: Cisplatin, doxorubicin HCL, felbamate, rifampin, phenobarbital, Phenytoin(2), primidone, @DRUG$, and theophylline Thus, if a patient has been titrated to a stable dosage on EQUETROTM, and then begins a course of treatment with one of these CYP3A4 inducers, it is reasonable to expect that a dose increase for EQUETROTM may be necessary.
221	DDI-effect	Phenytoin: Serum @DRUG$ levels may be increased by @DRUG$.
222	DDI-advise	When @DRUG$ is co-administered with @DRUG$, anticoagulation levels should be monitored frequently.
223	DDI-mechanism	@DRUG$ concentrations may be decreased in the presence of @DRUG$.
224	DDI-mechanism	@DRUG$ resin may delay or reduce the absorption of concomitant oral medication such as phenylbutazone, warfarin, thiazide diuretics (acidic) or propranolol (basic), as well as tetracycline penicillin G, phenobarbital, thyroid and @DRUG$ preparations, estrogens and progestins, and digitalis.
225	DDI-advise	Caution should be used when administering or taking @DRUG$ with @DRUG$ and other strong CYP3A4 inhibitors such as, but not limited to, atazanavir, clarithromycin, indinavir, itraconazole, nefazodone, nelfinavir, ritonavir, saquinavir, telithromycin, troleandomycin (TAO), and voriconazole .
226	DDI-mechanism	Magnesium- and @DRUG$-containing antacids, administered concomitantly with @DRUG$, significantly decreased the bioavailability (48%) of lomefloxacin.
227	DDI-effect	Non-selective MAO inhibitors including tranylcypromine sulfate, phenelzine sulfate, and pargyline HC1: Concomitant use of @DRUG$ and non-selective @DRUG$ may cause hypertension.
228	DDI-mechanism	In a single-dose crossover study examining lansoprazole 30 mg and omeprazole 20 mg each administered alone and concomitantly with sucralfate 1 gram, absorption of the @DRUG$ was delayed and their bioavailability was reduced by 17% and 16%, respectively, when administered concomitantly with @DRUG$.
229	DDI-mechanism	Terfenadine, @DRUG$ and cisapride are all metabolized by the cytochrome P450IIIA4 isozyme, and it has been demonstrated that @DRUG$, a potent inhibitor of IIIA4, blocks the metabolism of these drugs, resulting in increased plasma concentrations of parent drug.
230	DDI-advise	Therefore, close monitoring of prothrombin time is recommended and adjustment of the anticoagulant dose may be necessary when @DRUG$ Capsules are administered concomitantly with @DRUG$.
231	DDI-effect	There is thus an enhancement effect of @DRUG$ upon the reaction of placental vessels to @DRUG$ in vitro.
232	DDI-effect	"In the presence of @DRUG$ (10(-5) M), @DRUG$ (10(-8) M) failed to cause the first contraction;"
233	DDI-effect	@DRUG$, acetaminophen and caffeine may enhance the effects of: other narcotic analgesics, alcohol, general anesthetics, tranquilizers such as chlordiazepoxide, @DRUG$, or other CNS depressants, causing increased CNS depression.
234	DDI-effect	Concomitant administration of @DRUG$ and other related compounds (eg, @DRUG$, quinidine and chloroquine) may produce electrocardiographic abnormalities and increase the risk of convulsions.
235	DDI-effect	"Drugs which may enhance the neuromuscular blocking action of @DRUG$ include: @DRUG$;isoflurane;halothane;certain antibiotics, especially the aminoglycosides and polymyxins;lithium;magnesium salts;procainamide;and quinidine."
236	DDI-effect	A potential interaction between oral @DRUG$ and oral @DRUG$ leading to severe hypoglycemia has been reported.
237	DDI-effect	Patients taking @DRUG$ concomitantly with @DRUG$ more commonly reported both weight gain and weight loss, compared with patients taking either medication alone.
238	DDI-effect	@DRUG$ may antagonize the hypotensive effects of @DRUG$.
239	DDI-effect	@DRUG$ may increase the ototoxic potential of @DRUG$, especially in the presence of impaired renal function.
240	DDI-effect	"@DRUG$ may interfere with the anti-glaucoma action of carbachol or @DRUG$;"
241	DDI-mechanism	Agents that are CYP3A4 inhibitors that have been found, or are expected, to increase plasma levels of @DRUG$ are the following: Acetazolamide, azole antifungals, cimetidine, clarithromycin(1), dalfopristin, danazol, @DRUG$, diltiazem, erythromycin(1), fluoxetine, fluvoxamine, grapefruit juice, isoniazid, itraconazole, ketoconazole, loratadine, nefazodone, niacinamide, nicotinamide, protease inhibitors, propoxyphene, quinine, quinupristin, troleandomycin, valproate(1), verapamil, zileuton.
242	DDI-advise	Therefore, EXTREME CAUTION should be exercised when administering @DRUG$ to patients receiving @DRUG$ or halogenated hydrocarbon anesthetics.
243	DDI-effect	Injection: @DRUG$ injection, like other injectable benzodiazepines, produces depression of the central nervous system when administered with @DRUG$, phenothiazines, barbiturates, MAO inhibitors, and other antidepressants.When scopolamine is used concomitantly with injectable lorazepam, an increased incidence of sedation, hallucinations, and irrational behavior has been observed.
244	DDI-effect	Other drugs which may enhance the neuromuscular blocking action of @DRUG$ such as NIMBEX include certain antibiotics (e. g., aminoglycosides, tetracyclines, bacitracin, polymyxins, lincomycin, clindamycin, colistin, and sodium colistemethate), @DRUG$ salts, lithium, local anesthetics, procainamide, and quinidine.
245	DDI-effect	Renal clearance measurements of @DRUG$ cannot be made with any significant accuracy in patients receiving sulfonamides, procaine, or @DRUG$.
246	DDI-advise	Because of the small effect on half-life, the coadministration with @DRUG$ to extend the half-life of @DRUG$ is not recommended.
247	DDI-effect	@DRUG$, including norfloxacin, may enhance the effects of oral @DRUG$, including warfarin or its derivatives or similar agents.
248	DDI-advise	Patients receiving @DRUG$ and @DRUG$ or other diuretics should be observed closely to determine if the desired effect is obtained.
249	DDI-effect	@DRUG$, including cinoxacin, may enhance the effects of oral @DRUG$, such as warfarin or its derivatives.
250	DDI-effect	Warfarin: The effects of @DRUG$ and @DRUG$ on GI bleeding are synergistic, such that users of both drugs together have a risk of serious GI bleeding higher than that of users of either drug alone.
251	DDI-mechanism	When used in therapeutic doses, @DRUG$ had a modest effect on the pharmacokinetics of atorvastatin, carbamazepine, cetirizine, didanosine, efavirenz, fluconazole, @DRUG$, midazolam, rifabutin, sildenafil, theophylline (intravenous and oral), triazolam, trimethoprim/sulfamethoxazole or zidovudine.
252	DDI-mechanism	Agents that are CYP3A4 inhibitors that have been found, or are expected, to increase plasma levels of @DRUG$ are the following: Acetazolamide, azole antifungals, cimetidine, clarithromycin(1), dalfopristin, danazol, delavirdine, diltiazem, erythromycin(1), fluoxetine, fluvoxamine, grapefruit juice, isoniazid, itraconazole, ketoconazole, loratadine, nefazodone, niacinamide, nicotinamide, protease inhibitors, propoxyphene, quinine, @DRUG$, troleandomycin, valproate(1), verapamil, zileuton.
253	DDI-effect	Resistance to the neuromuscular blocking action of @DRUG$ has been demonstrated in patients chronically administered phenytoin or @DRUG$.
254	DDI-advise	Concomitant administration of @DRUG$ and @DRUG$ is not recommended because naproxen is displaced from its binding sites during the concomitant administration of aspirin, resulting in lower plasma concentrations and peak plasma levels.
255	DDI-mechanism	Barbiturates, @DRUG$, or rifampin increased metabolic clearance of @DRUG$ because of the induction of hepatic enzymes.
256	DDI-mechanism	Substances that are potent inhibitors of CYP3A4 activity (eg, ketoconazole and @DRUG$) decrease @DRUG$ metabolism and increase gefitinib plasma concentrations.
257	DDI-effect	Drugs Decreasing Heparin Effect: @DRUG$, tetracyclines, nicotine, or antihistamines may partially counteract the anticoagulant action of @DRUG$.
258	DDI-effect	- Drugs whose efficacy is impaired by @DRUG$ include: anticoagulants, corticosteroids, @DRUG$, digitoxin, doxycycline, estrogens, furosemide, oral contraceptives, rifampin, quinidine, theophylline, vitamin D.
259	DDI-mechanism	Discontinuation of cimetidine in well-controlled patients receiving @DRUG$ and @DRUG$ may decrease the plasma levels and efficacy of the antidepressants.
260	DDI-mechanism	The following are examples of drugs known to inhibit the metabolism of other related @DRUG$, presumably through inhibition of CYP3A: nefazodone, fluvoxamine, @DRUG$, diltiazem, isoniazide, and some macrolide antibiotics.
261	DDI-effect	- Drugs whose efficacy is impaired by @DRUG$ include: anticoagulants, @DRUG$, coumarin, digitoxin, doxycycline, estrogens, furosemide, oral contraceptives, rifampin, quinidine, theophylline, vitamin D.
262	DDI-advise	Nephrotoxic agents : Concomitant administration of @DRUG$ and agents with nephrotoxic potential [e.g., intravenous aminoglycosides (e.g., tobramycin, gentamicin, and amikacin), @DRUG$, foscarnet, intravenous pentamidine, vancomycin, and non-steroidal anti-inflammatory agents] is contraindicated.
263	DDI-effect	the doses of @DRUG$ required to antagonize the effects of @DRUG$ were more than 100 times higher than those required to antagonize the effects of morphine.
264	DDI-effect	The concurrent use of two or more drugs with anticholinergic activity--such as an @DRUG$ (eg, chlorpromazine), an @DRUG$ (eg, trihexyphenidyl), and/or a tricyclic antidepressant (eg, amitriptyline)--commonly results in excessive anticholinergic effects, including dry mouth and associated dental complications, blurred vision, and, in patients exposed to high temperature and humidity, hyperpyrexia.
265	DDI-advise	When you are using @DRUG$, it is especially important that your health care professional know if you are using the following: Eye product containing @DRUG$.
266	DDI-effect	Benazepril, like other @DRUG$, has had less than additive effects with @DRUG$, presumably because both drugs lower blood pressure by inhibiting parts of the renin-angiotensin system
267	DDI-effect	The concurrent use of two or more drugs with anticholinergic activity--such as an @DRUG$ (eg, chlorpromazine), an antiparkinsonian drug (eg, @DRUG$), and/or a tricyclic antidepressant (eg, amitriptyline)--commonly results in excessive anticholinergic effects, including dry mouth and associated dental complications, blurred vision, and, in patients exposed to high temperature and humidity, hyperpyrexia.
268	DDI-effect	In patients receiving nonselective monoamine oxidase inhibitors (MAOIs) (e.g., @DRUG$) in combination with serotoninergic agents (e.g., fluoxetine, fluvoxamine, paroxetine, @DRUG$, venlafaxine), there have been reports of serious, sometimes fatal, reactions.
269	DDI-effect	In patients receiving nonselective monoamine oxidase inhibitors (MAOIs) (e.g., @DRUG$) in combination with @DRUG$ (e.g., fluoxetine, fluvoxamine, paroxetine, sertraline, venlafaxine), there have been reports of serious, sometimes fatal, reactions.
270	DDI-mechanism	@DRUG$, kaolin-pectin, sulfasalazine, neomycin, cholestyramine, certain anticancer drugs, and metoclopramide may interfere with intestinal @DRUG$ absorption, resulting in unexpectedly low serum concentrations.
271	DDI-advise	Nevertheless, the effects of @DRUG$ on travelers receiving comedication, particularly diabetics or patients using @DRUG$, should be checked before departure.
272	DDI-effect	Platelet inhibitors: Drugs such as acetylsalicylic acid, dextran, phenylbutazone, ibuprofen, @DRUG$, dipyridamole, hydroxychloroquine and others that interfere with platelet-aggregation reactions (the main hemostatic defense of heparinized patients) may induce bleeding and should be used with caution in patients receiving @DRUG$.
273	DDI-effect	@DRUG$, acetaminophen and caffeine may enhance the effects of: other @DRUG$s, alcohol, general anesthetics, tranquilizers such as chlordiazepoxide, sedative-hypnotics, or other CNS depressants, causing increased CNS depression.
274	DDI-mechanism	"A number of drugs, including @DRUG$, have been shown to displace @DRUG$ from plasma protein;"
275	DDI-advise	Because moderate CYP3A4 inhibitors (e.g., @DRUG$) result in 2-fold increase in plasma concentrations of @DRUG$, concomitant administration should also be approached with caution.
276	DDI-mechanism	Drugs which inhibit CYP 3A4 (e.g., ketoconazole, macrolide antibiotics such as @DRUG$) have the potential to result in increased plasma concentrations of @DRUG$.
277	DDI-mechanism	When intravenous morphine and BREVIBLOC were concomitantly administered in normal subjects, no effect on morphine blood levels was seen, but @DRUG$ steady-state blood levels were increased by 46% in the presence of @DRUG$.
278	DDI-mechanism	"Although specific studies have not been performed, coadministration with drugs that are mainly metabolized by CYP3A4 (eg, calcium channel blockers, dapsone, disopyramide, quinine, amiodarone, @DRUG$, warfarin, tacrolimus, cyclosporine, ergot derivatives, pimozide, carbamazepine, fentanyl, alfentanyl, alprazolam, and triazolam) may have elevated plasma concentrations when coadministered with @DRUG$;"
279	DDI-advise	Nicardipine HCl usually does not alter the plasma levels of digoxin, however, serum @DRUG$ levels should be evaluated after concomitant therapy with @DRUG$ is initiated.
280	DDI-advise	The use of @DRUG$ FOR INJECTION in combination with @DRUG$ is not recommended due to the risk of severe pulmonary toxicity.
281	DDI-effect	@DRUG$ may have additive effects with @DRUG$ and other CNS depressants, e.g., hypnotics, sedatives, tranquilizers, antianxiety agents.
282	DDI-advise	If concomitant treatment with @DRUG$ and an SSRI (e.g., fluoxetine, fluvoxamine, paroxetine, @DRUG$, citalopram, escitalopram) is clinically warranted, appropriate observation of the patient is advised.
283	DDI-mechanism	If @DRUG$ or other hepatic enzyme inducers are taken concurrently with @DRUG$ or Norpace CR, lower plasma levels of disopyramide may occur.
284	DDI-effect	Levodopa and Amantadine: Limited clinical data suggest a higher incidence of adverse experiences in patients receiving @DRUG$ concurrently with either levodopa or @DRUG$.
285	DDI-effect	Although glucocorticoids have been shown to reduce PROLEUKIN-induced side effects including fever, renal insufficiency, hyperbilirubinemia, confusion, and dyspnea, concomitant administration of these agents with PROLEUKIN may reduce the antitumor effectiveness of PROLEUKIN and thus should be avoided. 12 Beta-blockers and other @DRUG$ may potentiate the hypotension seen with @DRUG$.
286	DDI-advise	Caution should be used when administering or taking @DRUG$ with ketoconazole and other strong CYP3A4 inhibitors such as, but not limited to, atazanavir, clarithromycin, indinavir, @DRUG$, nefazodone, nelfinavir, ritonavir, saquinavir, telithromycin, troleandomycin (TAO), and voriconazole .
287	DDI-mechanism	Concomitant use of @DRUG$ and drugs that inhibit CYP3A4 (eg, ketoconazole, itraconazole, erythromycin, clarithromycin, ritonavir, atazanavir, indinavir, nefazodone, nelfinavir, @DRUG$, telithromycin) may increase exposure to dasatinib and should be avoided.
288	DDI-advise	Digitalis: @DRUG$ dosage must be determined with care in patients undergoing treatment with @DRUG$, as hypercalcemia in such patients may precipitate cardiac arrhythmias.
289	DDI-effect	Acetaminophen and methotrexate - @DRUG$ may decrease hepatic toxicity in those with acetaminophen overdosage or in those taking @DRUG$.
290	DDI-effect	@DRUG$ reduced or eliminated the increases in FI responding produced by intermediate doses of either (+)-NANM or @DRUG$ in pigeons, but did not antagonize the decreases in FI or FR responding produced by high doses of PCP or either stereoisomer of NANM.
291	DDI-effect	Resistance to the neuromuscular blocking action of @DRUG$ has been demonstrated in patients chronically administered @DRUG$ or carbamazepine.
292	DDI-advise	@DRUG$ may be taken with a light meal 1 h following the administration of 400 mg of @DRUG$.
293	DDI-int	A possible interaction between @DRUG$ and @DRUG$, a fluoroquinolone antibiotic, has been reported, resulting in a potentiation of the hypoglycemic action of glyburide.
294	DDI-effect	Other drugs which may enhance the neuromuscular blocking action of nondepolarizing agents such as @DRUG$ include certain antibiotics (e. g., aminoglycosides, tetracyclines, bacitracin, polymyxins, lincomycin, clindamycin, colistin, and @DRUG$), magnesium salts, lithium, local anesthetics, procainamide, and quinidine.
295	DDI-mechanism	When intravenous morphine and BREVIBLOC were concomitantly administered in normal subjects, no effect on morphine blood levels was seen, but @DRUG$ steady-state blood levels were increased by 46% in the presence of @DRUG$.
296	DDI-advise	It is recommended that plasma lithium levels be monitored when @DRUG$ is coadministered with @DRUG$.
297	DDI-effect	Nephrotoxicity has been reported following concomitant administration of other @DRUG$ with potent diuretics such as @DRUG$.
298	DDI-mechanism	Carbamazepine: @DRUG$  causes a decrease in the steady-state @DRUG$ plasma concentrations and an increase in the steady-state carbamazepine epoxide plasma concentration.
299	DDI-effect	Additive adverse effects resulting from cholinergic blockade may occur when @DRUG$ is administered concomitantly with other antimuscarinics, amantadine, @DRUG$, phenothiazines, monoamine oxidase (MAO) inhibitors, tricyclic antidepressants or some antihistamines.
300	DDI-effect	Amantadine, tricyclic antidepressants, and @DRUG$ may increase anticholinergic effect of @DRUG$.
301	DDI-mechanism	Absorption of @DRUG$ is impaired by @DRUG$.
302	DDI-advise	Consequently, concomitant administration of @DRUG$ with strong CYP3A4 inhibitors (e.g., ketoconazole, @DRUG$, nefazodone, troleandomycin, clarithromycin, ritonavir, nelfinavir) should be approached with caution.
303	DDI-mechanism	@DRUG$ significantly increased the area under the curve at steady state (AUC(ss)) of rifabutin by 2.93-fold and the AUC(ss) of @DRUG$ by 13.3-fold.
304	DDI-advise	If concomitant treatment with @DRUG$ and an SSRI (e.g., fluoxetine, fluvoxamine, @DRUG$, sertraline, citalopram, escitalopram) is clinically warranted, appropriate observation of the patient is advised.
305	DDI-mechanism	CONCLUSIONS: Single-dose @DRUG$ coadministration leads to higher @DRUG$ exposure, presumably by inhibition of the first-pass metabolism of sirolimus.
306	DDI-effect	Serious toxicity may result if @DRUG$ is coadministered with monoamine oxidase inhibitors (@DRUG$).
307	DDI-effect	@DRUG$ decrease the hypotensive effect of @DRUG$.
308	DDI-advise	The benefits and risks of using @DRUG$ with @DRUG$ and other potentially nephrotoxic agents should be carefully considered, and the lowest effective dose employed
